Johann I. (Pfalz-Simmern),ヨハン1世・(プファルツ＝ジンメルン公)
Hermann Lietz,ヘルマン・リーツ
Adam von Württemberg,アダム・フォン・ヴュルテンベルク
Johann David Schöpf,ヨハン・ダーフィット・シュープ
Philipp Wilhelm August von der Pfalz,フィリップ・ヴィルヘルム・アウグスト・フォン・デア・プファルツ
William Beier,ウィリアム・バイアー
Hans Naumann (Mediävist),ハンス・ナウマン
Otto John,オットー・ヨーン
Friedrich Geiger (Fahrzeugdesigner),フリードリッヒ・ガイガー
Otto I. (Pfalz-Mosbach),オットー1世・(プファルツ＝モスバッハ公)
Hans Erwin von Spreti-Weilbach,ハンス・フォン・シュプレーティ＝ヴァイルバッハ
Johann Wilhelm Weinmann,ヨハン・ヴィルヘルム・ヴァインマン
Ulrich Greifelt,ウルリヒ・グライフェルト
Friedrich von Preußen (1911–1966),フリードリヒ・フォン・プロイセン・(1911-1966)
Hannah Pick-Goslar,ハンネリ・ホースラル
Ewald André Dupont,E・A・デュポン
Friedrich Karl von Eberstein,フリードリヒ・カール・フォン・エーベルシュタイン
Friedrich Kasimir (Pfalz-Zweibrücken-Landsberg),フリードリヒ・カジミール・(プファルツ＝ツヴァイブリュッケン＝ランツベルク公)
Karl Wilhelm Ferdinand Solger,カール・ヴィルヘルム・フェルディナント・ゾルガー
Albert Schäffle,アルベルト・シェフレ
Marcus Böhme,マルクス・ベーメ
Heidi Klum,ハイディ・クルム
Manuela Schwesig,マヌエラ・シュヴェーズィヒ
Friedrich Josias Prinz von Sachsen-Coburg und Gotha,フリードリヒ・ヨシアス・フォン・ザクセン＝コーブルク＝ゴータ
Harry von Bülow-Bothkamp,ハリー・フォン・ビューロウ＝ボートカンプ
Andreas E. Furtwängler,アンドレアス・フルトヴェングラー
Paul Daimler,パウル・ダイムラー
Franziska Sibylla Augusta von Sachsen-Lauenburg,フランツィスカ・ジビッラ・アウグスタ・フォン・ザクセン＝ラウエンブルク
Johann Wilhelm (Jülich-Kleve-Berg),ヨハン・ヴィルヘルム・(ユーリヒ＝クレーフェ＝ベルク公)
Margarete von Bayern (1442–1479),マルガレーテ・フォン・バイエルン・(1442-1479)
Wittekind zu Waldeck und Pyrmont,ヴィッテキント・ツー・ヴァルデック＝ピルモント
Walter Anderson,ヴァルター・アンダーソン
Otto II. (Braunschweig-Lüneburg),オットー2世・(ブラウンシュヴァイク＝リューネブルク公)
Christian Petzold (Regisseur),クリスティアン・ペツォールト・(映画監督)
Otto Friedrich Bollnow,オットー・フリードリッヒ・ボルノウ
Heinrich III. (Limburg),ハインリヒ3世・(リンブルフ公)
Karl August von Schleswig-Holstein-Gottorf,カール・アウグスト・フォン・シュレースヴィヒ＝ホルシュタイン＝ゴットルプ
Franz Otto (Braunschweig-Lüneburg),フランツ・オットー・(ブラウンシュヴァイク＝リューネブルク公)
Gottfried Münzenberg,ゴットフリート・ミュンツェンベルク
Nikolaus Schneider,ニコラウス・シュナイダー
Adam Bousdoukos,アダム・ブースドゥーコス
Günter Litfin,ギュンター・リトフィン
Camilla Horn,カミルラ・ホルン
Friedrich V. (Nürnberg),フリードリヒ5世・(ニュルンベルク城伯)
Johann III. (Nürnberg),ヨハン3世・(ニュルンベルク城伯)
Otto von Münchhausen (Botaniker),オットー・フォン・ミュンヒハウゼン・(植物学者)
Hans Fruhstorfer,ハンス・フルストルファー
Jakob Thomasius,ヤーコプ・トマジウス
Anni Steuer,アンニ・シュトイヤー
Heinrich Behnke,ハインリヒ・ベーンケ
Gerhard Ebeling,ゲアハルト・エーベリンク
Emil Hirschfeld,エミール・ヒルシュフェルト
Hans Frank,ハンス・フランク
Konrad Zuse,コンラート・ツーゼ
Otto von Guericke,オットー・フォン・ゲーリケ
Anton Fils,アントン・フィルツ
Paul Carell,パウル・カレル
Katharina Wagner,カタリーナ・ワーグナー
Heinrich Liebe,ハインリヒ・リーベ
Caroline Schelling,カロリーネ・シェリング
Manfred Burgsmüller,マンフレート・ブルクスミュラー
Lothar Schmid,ローター・シュミット
Hedwig Elisabeth Amalia von der Pfalz,ヘートヴィヒ・エリーザベト・フォン・デア・プファルツ
August I. (Braunschweig-Lüneburg),アウグスト1世・(ブラウンシュヴァイク＝リューネブルク公)
Günther Victor (Schwarzburg-Rudolstadt),ギュンター・ヴィクトル・(シュヴァルツブルク＝ルードルシュタット侯)
Georg Misch (Philosoph),ゲオルク・ミッシュ
Thanos Petsos,アサナシオス・ペツォス
Bernhard III. (Baden-Baden),ベルンハルト3世・(バーデン＝バーデン辺境伯)
Hermann Giesler,ヘルマン・ギースラー
Herbert Ihlefeld,ヘルベルト・イーレフェルト
Dietrich IV. (Lausitz),ディートリヒ4世・(ラウジッツ辺境伯)
Alexander (Pfalz-Zweibrücken),アレクサンダー・(プファルツ＝ツヴァイブリュッケン公)
Kurt Kuhlmey,クルト・クールマイ
Eckhart Tolle,エックハルト・トール
Otto Graf Lambsdorff,オットー・グラーフ・ラムスドルフ
Alfred Einstein,アルフレート・アインシュタイン
Britta Heidemann,ブリッタ・ハイデマン
Roberto Hilbert,ロベルト・ヒルバート
Julia Jentsch,ユリア・イェンチ
Erhard Heiden,エアハルト・ハイデン
Karl Korsch,カール・コルシュ
Ernst Gräfenberg,エルンスト・グレフェンベルグ
Conrad Schumann,コンラート・シューマン
Hermann Scherchen,ヘルマン・シェルヘン
Ernst Kretschmer,エルンスト・クレッチマー
Aby Warburg,アビ・ヴァールブルク
Ken Adam,ケン・アダム
René Rast,レネ・ラスト
Andreas Deja,アンドレアス・デジャ
Heinz Nixdorf,ハインツ・ニクスドルフ
Herbert Rosenfeld,ハーバート・ロゼンフェルド
Frank Beyer,フランク・バイヤー
Ludwig Knorr,ルートヴィヒ・クノール
Hermann Paul Müller,ヘルマン・パウル・ミューラー
Max Littmann,マックス・リットマン
Matthias Habich,マティアス・ハビッヒ
Karl Mildenberger,カール・ミルデンバーガー
Paul Lorenzen,パウル・ローレンツェン
Margareta Kozuch,マルガレーテ・コズーフ
Manfred Schnelldorfer,マンフレート・シュネルドルファー
Fırat Arslan,フィラット・アルスラン
Wolf Kahler,ヴォルフ・カーラー
Heinrich Hoerle,ハインリヒ・ホーレ
James Kwast,ジェームス・クヴァスト
Gustav Herglotz,グスタフ・ヘルグロッツ
Adolf Schlagintweit,アドルフ・シュラーギントヴァイト
Dietrich Adolf Hrabak,ディートリヒ・フラバク
Gerhard Hüsch,ゲルハルト・ヒュッシュ
Marie Karoline von Battenberg,マリー・フォン・バッテンベルク
Dietrich Eckart,ディートリヒ・エッカート
Wilhelm Backhaus,ヴィルヘルム・バックハウス
Alexander von Kluck,アレクサンダー・フォン・クルック
Lou Bega,ルー・ベガ
Heinrich Barkhausen,ハインリッヒ・バルクハウゼン
Jürgen Moltmann,ユルゲン・モルトマン
Paul Biedermann,パウル・ビーデルマン
Albrecht Mayer,アルブレヒト・マイヤー
Albert Bassermann,アルベルト・バッサーマン
Ernst August II. (Sachsen-Weimar-Eisenach),エルンスト・アウグスト2世・(ザクセン＝ヴァイマル＝アイゼナハ公)
Christine Magdalena von Pfalz-Zweibrücken-Kleeburg,クリスティーネ・マグダレーナ・フォン・プファルツ＝ツヴァイブリュッケン＝クレーブルク
Hans Conon von der Gabelentz,ハンス・コーノン・フォン・デア・ガーベレンツ
Christian Tetzlaff,クリスティアン・テツラフ
Harun Farocki,ハルーン・ファロッキ
Günther-Eberhardt Wisliceny,ギュンター＝エーベルハルト・ヴィスリツェニー
Georg (Bayern),ゲオルク・(バイエルン公)
Johann Hedwig,ヨハン・ヘートヴィヒ
Marcus Élieser Bloch,マルクス・エリエゼル・ブロッホ
Heinrich Kittel,ハインリヒ・キッテル
Johannes Abromeit,ヨハネス・アプロマイト
Richard Pfeiffer (Mediziner),リヒャルト・プファイファー
Raphael Liesegang,ラファエル・エデュアルト・リーゼガング
Walter Warzecha,ヴァルター・ヴァルツェハ
Andreas Prinz von Sachsen-Coburg und Gotha,アンドレアス・フォン・ザクセン＝コーブルク・ウント・ゴータ
Friedrich Ludwig (Pfalz-Zweibrücken-Landsberg),フリードリヒ・ルートヴィヒ・(プファルツ＝ツヴァイブリュッケン公)
Kaspar (Pfalz-Zweibrücken),カスパー・(プファルツ＝ツヴァイブリュッケン公)
Theodor Weißenberger,テオドール・ワイセンベルガー
Oskar Anderson (Statistiker),オスカー・アンダーソン
Verena Bentele,ベレーナ・ベンテレ
Ruprecht (Pfalz-Veldenz),ループレヒト・(プファルツ＝フェルデンツ公)
Wilhelm Ehm,ヴィルヘルム・エーム
Michael Stich,ミヒャエル・シュティヒ
Bernhard von Bülow,ベルンハルト・フォン・ビューロー
Michael Spindler,マイケル・スピンドラー
Simon Pauli (der Jüngere),ジーモン・パウリ
Rolf Singer,ロルフ・シンガー
August Wilhelm (Braunschweig-Wolfenbüttel),アウグスト・ヴィルヘルム・(ブラウンシュヴァイク＝ヴォルフェンビュッテル公)
Georg Marggraf,ゲオルク・マルクグラーフ
Johann August Carl Sievers,ヨハン・アウグスト・カール・ジーファース
Heino Ferch,ハイノ・フェルヒ
Augustus Quirinus Rivinus,アウグスト・クイリヌス・リヴィヌス
Max Amann (Politiker),マックス・アマン
Christian Träsch,クリスティアン・トレーシュ
Markus Beyer,マルクス・バイエル
Wilhelm Herrmann,ヴィルヘルム・ヘルマン
Gunda Niemann-Stirnemann,グンダ・ニーマン＝シュティルネマン
Ernst Troeltsch,エルンスト・トレルチ
Gottlob Berger,ゴットロープ・ベルガー
Franz Schmidberger,フランツ・シュミットバーガー
Bernhard II. (Braunschweig-Lüneburg),ベルンハルト2世・(ブラウンシュヴァイク＝リューネブルク公)
Klaus Schrodt,クラウス・シュロット
Ellen Brockhöft,エレン・ブロックヘフト
Simon August (Lippe),ジーモン・アウグスト・(リッペ＝デトモルト伯)
Maria Reiter,マリア・ライター
Pierre Kaffer,ピエール・カッファー
Charlotte von Hanau-Lichtenberg,シャルロッテ・フォン・ハーナウ＝リヒテンベルク
Friedrich Wilhelm II. (Sachsen-Altenburg),フリードリヒ・ヴィルヘルム2世・(ザクセン＝アルテンブルク公)
Peter Högl,ペーター・ヘーグル
Franz Wilhelm Prinz von Preußen,フランツ・ヴィルヘルム・フォン・プロイセン
Richardis von Schwerin,リヒャルディス・フォン・シュヴェリーン・(スウェーデン王妃)
Friedrich Wilhelm I. (Sachsen-Weimar),フリードリヒ・ヴィルヘルム1世・(ザクセン＝ヴァイマル公)
Heinz Tiessen,ハインツ・ティーセン
Hans Jüttner,ハンス・ユットナー
Max Warburg,マックス・ヴァールブルク
Benno Landsberger,ベンノ・ランツベルガー
Gottfried von Bismarck-Schönhausen,ゴットフリート・フォン・ビスマルク＝シェーンハウゼン
Walter Schottky,ヴァルター・ショットキー
Erich Koch,エーリヒ・コッホ
Ingrid Auerswald,イングリット・アウアースバルト
Philipp Bouhler,フィリップ・ボウラー
Sven Ulreich,スヴェン・ウルライヒ
Adolf Heusinger,アドルフ・ホイジンガー
Nadine Keßler,ナディネ・ケスラー
Karl Ewald Hasse,カール・エーヴァルト・ハッセ
Albert von Schrenck-Notzing,アルベルト・フォン・シュレンク＝ノッチング
Elisabeth Henriette von Hessen-Kassel,エリーザベト・ヘンリエッテ・フォン・ヘッセン＝カッセル
Ludwig VII. (Bayern),ルートヴィヒ7世・(バイエルン公)
Wilhelm Gliese,ヴィルヘルム・グリーゼ
Adolf Wild von Hohenborn,アドルフ・ヴィート・フォン・ホーエンボルン
Alfred Müller-Armack,アルフレート・ミュラー＝アルマック
Hugo Junkers,フーゴー・ユンカース
Martin Harnik,マーティン・ハルニック
Walther Wenck,ヴァルター・ヴェンク
Joachim von Preußen,ヨアヒム・フォン・プロイセン
Jakob Wassermann,ヤーコプ・ヴァッサーマン
Ernst-Robert Grawitz,エルンスト＝ロベルト・グラヴィッツ
Gertrud die Jüngere von Braunschweig,ゲルトルート・フォン・ブラウンシュヴァイク
Ludwig III. (Niederbayern),ルートヴィヒ3世・(バイエルン公)
Edgar Feuchtinger,エドガー・フォイヒティンガー
Dagmar Lurz,ダグマル・ルルツ
Hans Cramer,ハンス・クラーマー
Otto IV. (Bayern),オットー4世・(バイエルン公)
Willi Weber (Manager),ウィリー・ウェーバー
Kurt Feldt,クルト・フェルト
Stefan Steinweg,シュテファン・シュタインベック
Peter von Heydebreck,ペーター・フォン・ハイデブレック
Johann II. (Pfalz-Simmern),ヨハン2世・(プファルツ＝ジンメルン公)
Eduard Fortunat (Baden-Baden),エドゥアルト・フォルトゥナート・(バーデン＝バーデン辺境伯)
Harry Kupfer,ハリー・クプファー
Hans Christian Blech,ハンス・クリスチャン・ブレヒ
Otto Mayer (Jurist),オットー・マイヤー
Reinhard Hardegen,ラインハルト・ハーデガン
Kathleen Weiß,カトレーン・ワイス
Andreas Schnaas,アンドレアス・シュナース
Stefan von Pfalz-Simmern-Zweibrücken,シュテファン・(プファルツ＝ジンメルン＝ツヴァイブリュッケン公)
Hartmut Bagger,ハルトムート・バッガー
Volker Wieker,フォルカー・ヴィーカー
Andreas Raelert,アンドレアス・ラエラート
Markus Kuhn (Footballspieler),マーカス・クーン
Ernst Heinrich von Sachsen,エルンスト・ハインリヒ・フォン・ザクセン
Karl von Roques,カール・フォン・ロクエス
Hugo Leichtentritt,フーゴー・ライヒテントリット
Horst Stechbarth,ホルスト・シュテッヒバルト
Patrick Baum (Tischtennisspieler),パトリック・バウム
Anita Pallenberg,アニタ・パレンバーグ
Hermann Zapf,ヘルマン・ツァップ
Mischa Zverev,ミーシャ・ズベレフ
Lotte Lehmann,ロッテ・レーマン
Norbert Schramm,ノルベルト・シュラム
Gerhard Wessel,ゲルハルト・ヴェッセル
Maximilian von Herff,マキシミリアン・フォン・ヘルフ
Ludwig Jungermann,ルートヴィヒ・ユンガーマン
Sigmund Neumann,シグマンド・ノイマン
Thomas Sanderling,トーマス・ザンデルリング
Alfred Meyer-Waldeck,アルフレート・マイヤー＝ヴァルデック
Otto Schniewind (Admiral),オットー・シュニーヴィント
Sebastian Rudy,セバスティアン・ルディ
Bibiana Steinhaus,ビビアナ・シュタインハウス
Karl Theophil Guichard,カール・テオフィル・ギシャール
Heinz Günther Guderian,ハインツ・ギュンター・グデーリアン
Heinrich III. (Mecklenburg),ハインリヒ3世・(メクレンブルク公)
Albrecht II. (Mecklenburg),アルブレヒト2世・(メクレンブルク＝シュヴェリーン公)
Max Knoll,マックス・クノール
Anton Ulrich von Braunschweig-Wolfenbüttel,アントン・ウルリヒ・フォン・ブラウンシュヴァイク
Georg Christian Oeder,ゲオルク・クリスティアン・エーダー
Gisèle Freund,ジゼル・フロイント
Hans-Jürgen Syberberg,ハンス＝ユルゲン・ジーバーベルク
Franz Kaiser (Astronom),フランツ・カイザー
Irmgard Seefried,イルムガルト・ゼーフリート
Hermann Ehrhardt,ヘルマン・エアハルト
Sercan Sararer,セルジャン・サラレル
Ingo Steuer,インゴ・シュトイアー
Feridun Zaimoglu,フェリドゥン・ザイモグル
Horst Dassler,ホルスト・ダスラー
Armin Prinz zur Lippe,アルミン・ツア・リッペ
Bianca Schmidt,ビアンカ・シュミット
Lothar von Richthofen,ロタール・フォン・リヒトホーフェン
Christina von Sachsen (1461–1521),クリスティーナ・フォン・ザクセン・(1461-1521)
Viktoria von Preußen (1866–1929),ヴィクトリア・フォン・プロイセン・(1866-1929)
Berthold Schwarz,ベルトルト・シュヴァルツ
Armin Schwarz (Rallyefahrer),アルミン・シュヴァルツ
George Henschel,ジョージ・ヘンシェル
Anton Koberger,アントン・コーベルガー
Willy Fritsch,ヴィリー・フリッチ
Hermann Lang,ヘルマン・ラング
Johannes Frießner,ヨハネス・フリースナー
Dieter Hoeneß,ディーター・ヘーネス
Thomas Luckmann,トーマス・ルックマン
Daniel-Henry Kahnweiler,ダニエル＝ヘンリー・カーンワイラー
Hedwig von Pfalz-Sulzbach,ヘートヴィヒ・フォン・プファルツ＝ズルツバッハ
Elisabeth Sophia von Sachsen-Altenburg,エリーザベト・ゾフィア・フォン・ザクセン＝アルテンブルク
Karl-Heinz Schnellinger,カール＝ハインツ・シュネリンガー
"Dieter Müller (Fußballspieler, 1954)",ディーター・ミュラー
Bruno Loerzer,ブルーノ・レールツァー
Joseph Berchtold,ヨーゼフ・ベルヒトルト
Franz Ritter von Epp,フランツ・フォン・エップ
Leopold Ludwig (Pfalz-Veldenz),レオポルト・ルートヴィヒ・(プファルツ＝フェルデンツ公)
Friedrich (Pfalz-Zweibrücken-Veldenz),フリードリヒ・(プファルツ＝ツヴァイブリュッケン＝フェルデンツ公)
Johannes Werner (Kartograf),ヨハネス・ヴェルナー
Max Riemelt,マックス・リーメルト
Irina Korschunow,イリーナ・コルシュノフ
Frei Otto,フライ・オットー
Rolf Gölz,ロルフ・ゲルツ
Theo Adam,テオ・アダム
Anja Silja,アニャ・シリヤ
Michael von Biel,ミヒャエル・フォン・ビール
Hans Dominik,ハンス・ドミニク
Elisabeth Hauptmann,エリーザベト・ハウプトマン
Elisabeth von Regenstein-Blankenburg,エリーザベト2世・(クヴェードリンブルク女子修道院長)
Günther von Maltzahn,ギュンター・フォン・マルツァーン
Willy Langkeit,ヴィリィ・ラングカイト
Armin Rohde,アーミン・ローデ
Adolfo Hohenstein,アドルフ・ホーヘンシュタイン
Sylvester Groth,シルヴェスター・グロート
Hans Baur (Pilot),ヨハン・バウア
Wolfgang Wagner (Opernregisseur),ヴォルフガング・ワーグナー
Kurt Sanderling,クルト・ザンデルリング
Günter Guillaume,ギュンター・ギヨーム
Stefan Dohr,シュテファン・ドール
Jennifer Ulrich,ジェニファー・ウルリッヒ
Volker Weidler,フォルカー・ヴァイドラー
Theodor Busse,テオドーア・ブッセ
Wieland Wagner,ヴィーラント・ワーグナー
Marie Gutheil-Schoder,マリー・グートハイル＝ショーダー
Adolf Spamer,アードルフ・シュパーマー
Helmut Fath,ヘルムート・ファス
Waldemar von Baußnern,ヴァルデマール・フォン・バウスネルン
Eugen Herrigel,オイゲン・ヘリゲル
Marcel Beyer,マルセル・バイアー
Martin Wimmer,マーチン・ウィマー
Albert Bormann,アルベルト・ボルマン
Eduard Friedrich Weber (Mediziner),エドゥアルト・ヴェーバー
Arne Tode,アルネ・トーデ
Daniel Hermann (Eiskunstläufer),ダニエル・ヘルマン
Heinz Wallberg,ハインツ・ワルベルク
Ludwig Bergsträsser,ルートヴィヒ・ベルクシュトレッサー
Max-Josef Pemsel,マックス＝ヨーゼフ・ペムゼル
Johann Karl (Pfalz-Gelnhausen),ヨハン・カール・(プファルツ＝ゲルンハウゼン公)
René Lohse,レネ・ローゼ
Walter Zimmermann (Komponist),ヴァルター・ツィンマーマン・(作曲家)
Veronika Eberle,ヴェロニカ・エーベルレ
Wilhelm Heidkamp,ヴィルヘルム・ハイドカンプ
Friedrich von Gottl-Ottlilienfeld,フリードリヒ・フォン・ゴットル＝オットリリエンフェルト
Roland Asch,ローランド・アッシュ
Georg-Hans Reinhardt,ゲオルク＝ハンス・ラインハルト
Oka Nikolov,オカ・ニコロフ
Walter Dornberger,ヴァルター・ドルンベルガー
Oksana Chusovitina,オクサナ・チュソビチナ
Friedrich August Freiherr von der Heydte,フリードリッヒ・フォン・デア・ハイテ
Christian Mayer (Physiker),クリスチャン・マイヤー
Ariane Friedrich,アリアネ・フリードリヒ
Paul Kretschmer (Linguist),パウル・クレッチマー
Friedrich Carl Andreas,フリードリッヒ・カール・アンドレアス
Hugo von Seeliger,フーゴ・フォン・ゼーリガー
Miriam Neureuther,ミリアム・ゲスナー
Georg Kaiser,ゲオルグ・カイザー
Jörg Müller (Rennfahrer),ヨルグ・ミューラー
Wolfgang Iser,ヴォルフガング・イーザー
Christian IV. (Pfalz-Zweibrücken),クリスティアン4世・(プファルツ＝ツヴァイブリュッケン公)
Heinrich I. (Braunschweig-Lüneburg),ハインリヒ1世・(ブラウンシュヴァイク＝リューネブルク公)
Matthias Schweighöfer,マティアス・シュヴァイクホファー
Günther XXI. (Schwarzburg-Blankenburg),ギュンター・フォン・シュヴァルツブルク
Franz Engstler,フランツ・エングストラー
Willy Burmester,ウィリー・ブルメスター
Rudolf Leiding,ルドルフ・ライディング
Tilly Fleischer,ティリー・フライシャー
Jakob Albrecht,ジェイコブ・オルブライト
Mathilde in Bayern,マティルデ・イン・バイエルン
Karl Bartos,カール・バルトス
Wolfgang Schmieder,ヴォルフガング・シュミーダー
Joseph Süß Oppenheimer,ヨーゼフ・ズュース・オッペンハイマー
Ralf Dujmovits,ラルフ・ドゥイモビッツ
Wolfram Fleischhauer,ヴォルフラム・フライシュハウアー
Yıldıray Baştürk,ユルドゥライ・バシュテュルク
Gottlob Curt Heinrich von Tottleben,ゴットロープ・ハインリヒ・フォン・トートレーベン
Hans Röttiger,ハンス・レッティガー
Reinhart Ahlrichs,ラインハルト・アールリヒス
Hans-Rudolf Rösing,ハンス＝ルドルフ・レーズィンク
Ludwig III. (Pfalz),ルートヴィヒ3世・(プファルツ選帝侯)
"Andrea Fischer (Politikerin, 1960)",アンドレア・フィッシャー
Arnolt Schlick,アルノルト・シュリック
Philipp Melanchthon,フィリップ・メランヒトン
Petra Felke,ペトラ・フェルケ
Dietrich Bonhoeffer,ディートリヒ・ボンヘッファー
Wilhelm von Thoma,ヴィルヘルム・フォン・トーマ
Artur Axmann,アルトゥール・アクスマン
Maria von Geldern (Königin),メアリー・オブ・グエルダース
Oliver Hirschbiegel,オリヴァー・ヒルシュビーゲル
Hans von Luck (Oberst),ハンス・フォン・ルック
Jonas Folger,ジョナス・フォルガー
Paul Weinstein,パウル・ヴァインシュタイン
Timo Bernhard,ティモ・ベルンハルト
Paul Falk (Eiskunstläufer),パウル・ファルク
Boris Becker,ボリス・ベッカー
Rudolf Bultmann,ルドルフ・カール・ブルトマン
Horst Buchholz,ホルスト・ブッフホルツ
Thomas Strunz,トーマス・シュトルンツ
Kim Dotcom,キム・ドットコム
Sandra Schmitt,サンドラ・シュミット
Walter Elsasser,ウォルター・エルサッサー
Peter Lindbergh,ピーター・リンドバーグ
Friedrich Christiansen,フリードリッヒ・クリスチャンセン
Friedrich II. (Braunschweig-Lüneburg),フリードリヒ2世・(ブラウンシュヴァイク＝リューネブルク公)
Walther Stennes,ヴァルター・シュテンネス
Hans Wehr,ハンス・ヴェーア
Albrecht II. Alcibiades,アルブレヒト・アルキビアデス
Leonie Swann,レオニー・スヴァン
Peter Berling,ペーター・ベルリング
Christoph von Oldenburg,クリストファ・(オルデンブルク伯)
Ludwig Wolff (Chemiker),ルートヴィヒ・ヴォルフ
Marcel Tiemann,マルセル・ティーマン
Martin Drewes,マルティン・ドレーヴェス
Jakob I. (Baden),ヤーコプ1世・(バーデン辺境伯)
Sophia Charlotte von Platen-Hallermund,ゾフィア・シャルロッテ・フォン・キールマンゼック・(ダーリントン女伯爵)
Hanns Kneifel,ハンス・クナイフェル
Nikolaus Ludwig von Zinzendorf,ニコラウス・フォン・ツィンツェンドルフ
Gudrun Pausewang,グードルン・パウゼヴァング
Julius Meier-Graefe,ユリウス・マイヤー＝グラーフェ
Ernst Freiherr von Weizsäcker,エルンスト・フォン・ヴァイツゼッカー
Alexander Kluge,アレクサンダー・クルーゲ
Ute Lemper,ウテ・レンパー
Sigismund von Preußen,ジギスムント・フォン・プロイセン・(1896-1978)
Richard Sapper,リヒャルト・ザッパー
Annette Dytrt,アネッテ・ディトルト
Otto (V.) (Brandenburg),オットー5世・(ブランデンブルク辺境伯)
Hans Zender,ハンス・ツェンダー
Evi Sachenbacher-Stehle,エヴィ・ザッヘンバッハー＝シュテーレ
Günter Behnisch,ギュンター・ベーニッシュ
Ingo Schultz,インゴ・シュルツ
Adolf II. (Schaumburg-Lippe),アドルフ2世・(シャウムブルク＝リッペ侯)
Hans Grodotzki,ハンス・グロドツキ
Edmund Heines,エドムント・ハイネス
Otto Wöhler,オットー・ヴェーラー
