Friedrich Pourtalès,フリードリヒ・フォン・プルタレス
Andreas Hammerschmidt,アンドレーアス・ハンマーシュミット
Hannah Höch,ハンナ・ヘッヒ
Richard Sukuta-Pasu,リヒャルト・スクタ＝パス
Leon Goretzka,レオン・ゴレツカ
Daniel Gottlob Türk,ダニエル・ゴットロープ・テュルク
Axel Springer,アクセル・シュプリンガー
Marcel Kittel,マルセル・キッテル
Jörg Widmann,イェルク・ヴィトマン
Maria Sander,マリア・ザンダー
Christoph Demantius,クリストフ・デマンティウス
Marga Petersen,マルガ・ペテルセン
Jutta Heine,ユッタ・ハイネ
Bernhard Schmidt (Optiker),ベルンハルト・シュミット
Hans-Joachim Rotzsch,ハンス＝ヨアヒム・ロッチュ
Matt Lucas,マット・ルーカス
Günter Sommer,ギュンター・ソマー
Georg Caspar Schürmann,ゲオルク・カスパー・シュールマン
Florian Wanner,フロリアン・ワナー
Eberhard Werdin,エーベルハルト・ヴェルディン
Christian Haas (Leichtathlet),クリスチャン・ハース
Hugo von Habermann,フーゴー・フォン・ハーベルマン
René Tretschok,レネ・トレショク
Manuela Groß,マヌエラ・グロス
Evelyn Klaudt,エヴェリン・グロスマン
Manuela Mager,マヌエラ・マガー
Lutz Pfannenstiel,ルッツ・ファンネンシュティール
Rudolf Brandt (Jurist),ルドルフ・ブラント
Christiane Charlotte von Württemberg-Winnental,クリスティアーネ・シャルロッテ・フォン・ヴュルテンベルク＝ヴィンネンタール
Otto Rehhagel,オットー・レーハーゲル
Lian Ross,リアン・ロス
Hans-Martin Linde,ハンス＝マルティン・リンデ
Franziska Konitz,フランツィスカ・コーニッツ
Andreas Gursky,アンドレアス・グルスキー
Clara Westhoff,クララ・ヴェストホフ
Käthe Krauß,ケーテ・クラウス
Ursula Donath,ウルスラ・ドナート
André Hahn (Fußballspieler),アンドレ・ハーン
Barnim IX.,バルニム9世・(ポメラニア公)
André Kiesewetter,アンドレ・キーゼヴェッター
André Hughes,アンドレ・ヒューズ
Ute Thimm,ウーテ・ティム
Peter Kowald,ペーター・コヴァルト
Marie-Luise Neunecker,マリー＝ルイーズ・ノイネッカー
Julius Weismann,ユリウス・ヴァイスマン
Karlheinz Zoeller,カールハインツ・ツェラー
Kerstin Tzscherlich,ケールスティン・チューリヒ
Dietrich Becker (Komponist),ディートリヒ・ベッカー
Susianna Kentikian,スージー・ケンティキアン
Manfred Wolke,マンフレート・ヴォルケ
Heinrich Kley,ハインリヒ・クレイ
Gunter Hampel,ギュンター・ハンペル
Hans Tilkowski,ハンス・チルコフスキ
Lothar Emmerich,ローター・エメリッヒ
Sydne Vogel,シドニー・ボーゲル
Constanze Paulinus,コンスタンツェ・パウリヌス
Karin Hendschke,カーリン・ヘンチュケ
Joseph Heintz der Ältere,ヨーゼフ・ハインツ
Moritz (Sachsen-Zeitz),モーリッツ・(ザクセン＝ツァイツ公)
Kim Kulig,キム・クーリッヒ
Willy Bogner senior,ウィリー・ボグナー
Gabriele Münter,ガブリエレ・ミュンター
Daniel Halfar,ダニエル・ハルファー
Heinrich Zille,ハインリッヒ・ツィレ
Katharina Häcker,カタリナ・ヘッカー
Christine Schäfer,クリスティーネ・シェーファー
Georg Scholz (Maler),ゲオルク・ショルツ
André Schubert,アンドレ・シューベルト
Otto Lohmüller,オットー・ローミュラー
Luise Adolpha Le Beau,ルイーゼ・アドルファ・ル・ボー
Andreas Kunz (Nordischer Kombinierer),アンドレアス・クンツ
Johann Philipp Krieger,ヨハン・フィリップ・クリーガー
Corina Ssuschke-Voigt,コリーナ・シュシュケ
Heinz Ulzheimer,ハインツ・ウルツハイマー
Georg Wilhelm (Brandenburg-Bayreuth),ゲオルク・ヴィルヘルム・(ブランデンブルク＝バイロイト辺境伯)
Christian Petzold (Komponist),クリスティアン・ペツォールト
Marianne Kirchgeßner,マリアンネ・キルヒゲスナー
Christian Ernst (Brandenburg-Bayreuth),クリスティアン・エルンスト・(ブランデンブルク＝バイロイト辺境伯)
Herman Oskarowitsch Gref,ゲルマン・グレフ
Ferdinand Keller (Maler),フェルディナント・ケラー
Marie-Sophie Hindermann,マリー＝ソフィー・ヒンデルマン
Hans Liesche,ハンス・リーシェ
Gerhard Hennige,ゲルハルト・ヘンニゲ
Hieronymus Praetorius (Organist),ヒエロニムス・プレトリウス
Friedrich Merz,フリードリヒ・メルツ
Reiner Klimke,ライナー・クリムケ
Helmut Körnig,ヘルムート・ケーニヒ
Knut Reinhardt,クヌート・ラインハルト
Thomas Struth,トーマス・シュトゥルート
Jupp Derwall,ユップ・デアヴァル
Manfred Germar,マンフレート・ゲルマー
Andreas Klier,アンドレアス・クリール
Christian Wilhelm Ernst Dietrich,クリスティアン・ヴィルヘルム・エルンスト・ディートリッヒ
Sandro Wagner,ザンドロ・ヴァーグナー
Welf II.,ヴェルフ2世・(アルトドルフ伯)
Arnold Mendelssohn,アルノルト・メンデルスゾーン
Johann I. (Bayern),ヨハン1世・(バイエルン公)
Bernhard II. (Baden),ベルンハルト2世・(バーデン辺境伯)
Uwe Rösler,ウーヴェ・レスラー
Bogislaw V.,ボギスラフ5世・(ポメラニア公)
Sophie Adelheid in Bayern,ゾフィー・アーデルハイト・イン・バイエルン
Andreas Marschall,アンドレアス・マーシャル
Hedwig von Brandenburg,ヘートヴィヒ・フォン・ブランデンブルク
Erdmuthe von Brandenburg,エルトムーテ・フォン・ブランデンブルク
Maria Christina von Österreich-Teschen,マリア・クリスティーナ・フォン・エスターライヒ・(1879-1962)
Rudolf Wagner-Régeny,ルドルフ・ヴァーグナー＝レゲニー
Friedrich III. (Salm-Kyrburg),フリードリヒ3世・ツー・ザルム＝キルブルク
Jan Hoffmann (Eiskunstläufer),ヤン・ホフマン
Andreas Nägelein,聶凌峰
Johann Wilhelm (Sachsen-Weimar),ヨハン・ヴィルヘルム・(ザクセン＝ヴァイマル公)
"Gerkan, Marg und Partner",ゲルカン・マルク・アンド・パートナー
Paul Baum,パウル・バウム
Radbot (Habsburg),ラートボト・(ハプスブルク伯)
Johann Ernst Eberlin,ヨハン・エルンスト・エバーリン
Bastian Oczipka,バスティアン・オツィプカ
Maximilian Nicu,マクシミリアン・ニク
Michael Hübner (Radsportler),ミカエル・ヒュープナー
Christian Erbach,クリスティアン・エアバッハ
Georg Kulenkampff,ゲオルク・クーレンカンプ
Josef Piontek,ゼップ・ピオンテック
Matthias Weckmann,マティアス・ヴェックマン
Dorothea von Sachsen (1591–1617),ドロテア・フォン・ザクセン・(1591-1617)
Marco Rose,マルコ・ローゼ
Felix Brych,フェリックス・ブリッヒ
Birgit Lorenz,ビルギット・ローレンツ
Heinrich Schmidtgal,ハインリヒ・シュミットガル
Annette Kurschus,アネッテ・クーアシュス
Helga Masthoff,ヘルガ・マストホフ
Mathilde (Lothringen),マティルデ・フォン・ザクセン・(979-1025)
Felice Bauer,フェリーツェ・バウアー
Jean d’Orléans (1965),ジャン・ドルレアン・(1965-)
Tim Hölscher,ティム・ヘルシャー
Hansjörg Schellenberger,ハンスイェルク・シェレンベルガー
Wilhelm Christoph (Hessen-Homburg),ヴィルヘルム・クリストフ・(ヘッセン＝ホンブルク方伯)
Hans Plenk,ハンス・プレンク
Anton Winkler,アントン・ビンクラー
Günter Raphael,ギュンター・ラファエル
Annette Meeuvissen,アネット・ミューヴィセン
Johann Christian Schickhardt,ヨハン・クリスティアン・シックハルト
Amin Younes,アミン・ユネス
Bernd Meinunger,ベルント・マイヌンガー
Johann Heinrich Roos,ヨハン・ハインリヒ・ロース
Dietmar Mögenburg,ディートマー・メーゲンブルク
Rainer Barzel,ライナー・バルツェル
Savio Nsereko,サヴィオ・ヌセレコ
Lior Shamriz,リオル・シャムリッツ
Gerd Hornberger,ゲルト・ホルンベルガー
Johann Ludwig Bach,ヨハン・ルートヴィヒ・バッハ
Louise von Thurn und Taxis,ルイーザ・フォン・トゥルン・ウント・タクシス
Thomas Baltzar,トマス・バルツァー
Johann Georg von Sachsen (1869–1938),ヨハン・ゲオルク・フォン・ザクセン・(1869-1938)
Erwin Sietas,エルヴィン・ジータス
Carl Röchling (Maler),カール・レヒリンク
Heinrich VII. (Bayern),ハインリヒ7世・(バイエルン公)
Karl I. (Braunschweig-Wolfenbüttel),カール1世・(ブラウンシュヴァイク＝ヴォルフェンビュッテル公)
Anon Schmitson,アノン・シュミットソン
Mario Vrančić,マリオ・ヴランチッチ
Johanna Hagn,ヨハンナ・ハーグン
Peter Liebers (Eiskunstläufer),ペーター・リーベルス
Heinz-Wilhelm Eck,ハインツ＝ヴィルヘルム・エック
Thomas Köhler (Rennrodler),トーマス・ケラー
Georg Friedrich II. (Brandenburg-Ansbach),ゲオルク・フリードリヒ2世・(ブランデンブルク＝アンスバッハ辺境伯)
Johanna Senfter,ヨハンナ・ゼンフター
Erasmus Reinhold,エラスムス・ラインホルト
Ina Bauer,イナ・バウアー
Annerose Schmidt,アンネローゼ・シュミット
Uwe Gensheimer,ウーヴェ・ゲンスハイマー
Markus Feulner,マルクス・フォイルナー
Johann Caspar von Kerll,ヨハン・カスパール・ケルル
Albert von Keller,アルベルト・フォン・ケラー
Mesías Maiguashca,メシアス・マイグアシュカ
Michel Erhart,ミヒェル・エルハルト
Svenja Huth,スベニャ・フート
Johann Ernst (Nassau-Weilburg),ヨハン・エルンスト・(ナッサウ＝ヴァイルブルク侯)
Robert Wagner (Radsportler),ローベルト・ヴァーグナー・(自転車選手)
Otto Addo,オットー・アッド
Lydia Veicht,リディア・ヴェイヒト
Shira Willner,シーラ・ヴィルナー
Georg Flegel,ゲオルク・フレーゲル
Uwe Hünemeier,ウーヴェ・ヒューネマイアー
Fabian Johnson,ファビアン・ジョンソン
Marvin Matip,マーヴィン・マティプ
Jan Schur,ヤン・シューア
Klaus-Michael Bonsack,クラウス・ボンザック
Dieter Neuendorf,ディーター・ノイエンドルフ
Konrad Winkler,コンラート・ビンクラー
Dettlef Günther,デトレフ・ギュンター
Ludwig Wilhelm in Bayern,ルートヴィヒ・ヴィルヘルム・イン・バイエルン
Hermann I. (Lothringen),ヘルマン1世・(ロートリンゲン宮中伯)
Heinrich Schomburgk,ハインリヒ・ションブルク
Uwe Bewersdorf,ウーベ・ベーベルスドルフ
Georges Jacobi,ジョルジュ・ジャコビ
Marcel Maltritz,マルセル・マルトリッツ
Frank Mill,フランク・ミル
Johann Schobert,ヨハン・ショーベルト
Niko Bungert,ニコ・ブンガート
Marcel Witeczek,マルセル・ヴィテチェク
Daniel Baier (Fußballspieler),ダニエル・バイアー
Sylvio Kroll,シルビオ・クロル
Sascha Schneider,サシャ・シュナイダー
Hans-Joachim Walde,ハンス・ヨアヒム・ヴァルデ
Stephan Freigang,シュテファン・フライガング
Carl Kaufmann (Leichtathlet),カール・カウフマン・(陸上選手)
Kurt Bendlin,クルト・ベントリン
Peter Fehse,ペーター・フェーセ
Hans Winderstein,ハンス・ヴィンデルシュテイン
Karl (Nassau-Usingen),カール・(ナッサウ＝ウージンゲン侯)
Klaus-Dieter Kurrat,クラウス＝ディーター・クラート
Rolf Oesterreich (Eiskunstläufer),ロルフ・エステルライヒ
Uwe Peschel,ウーヴェ・ペシェル
Ferdinand Albrecht II. (Braunschweig-Wolfenbüttel),フェルディナント・アルブレヒト2世・(ブラウンシュヴァイク＝ヴォルフェンビュッテル公)
Dietrich Kampf,ディートリヒ・カンプ
Heinrich Harder,ハインリヒ・ハルダー
Philipp (Schleswig-Holstein-Sonderburg-Glücksburg),フィリップ・(シュレースヴィヒ＝ホルシュタイン＝ゾンダーブルク＝グリュックスブルク公)
Helmut Lachenmann,ヘルムート・ラッヘンマン
Marko Rehmer,マルコ・レーマー
Udo Quellmalz,ウド・クエルマルツ
Jörg Michael,ヨルグ・マイケル
Axel Zitzmann,アクセル・ジッツマン
Marc-André Kruska,マルク＝アンドレ・クルスカ
Alexander Kosenkow,アレクサンダー・コセンコー
Christian Wück,クリスティアン・ヴュック
Eckhard Krautzun,エックハルト・クラウツン
Friedrich Wilhelm Marpurg,フリードリヒ・ヴィルヘルム・マルプルク
Fin Bartels,フィン・バルテルス
Johann Sigismund Kusser,ヨハン・ジギスムント・クッサー
Jens Hegeler,イェンス・ヘーゲラー
Wilhelm Dick,ウィレン・ディック
Lestko (Ratibor),レシェク・(ラチブシュ公)
Heinz Trettner,ハインツ・トレットナー
Johann Philipp (Sachsen-Altenburg),ヨハン・フィリップ・(ザクセン＝アルテンブルク公)
Maximilian Beister,マクシミリアン・バイスター
Hans Weiditz,ハンス・ヴァイディッツ
Eric Carle,エリック・カール
Fabian Giefer,ファビアン・ギーファー
Michael Zorc,ミヒャエル・ツォルク
Günter Haritz,ギュンター・ハーリッツ
Michael Skibbe,ミヒャエル・スキッベ
Josef Sommer (Schauspieler),ジョセフ・ソマー
Anja Thauer,アニア・タウアー
Winfried Schäfer,ヴィンフリート・シェーファー
Anja Sommavilla,アンニャ・ゾマヴィラ
Otto Nerz,オットー・ネルツ
Ernst Friedrich II. (Sachsen-Hildburghausen),エルンスト・フリードリヒ2世・(ザクセン＝ヒルトブルクハウゼン公)
Hans Lutz (Radsportler),ハンス・ルッツ
Georg I. (Württemberg-Mömpelgard),ゲオルク1世・(ヴュルテンベルク＝メンペルガルト伯)
Gustav Adolf (Mecklenburg),グスタフ・アドルフ・(メクレンブルク公)
Wilhelm von Lindenschmit der Jüngere,ヴィルヘルム・リンデンシュミット・(子)
Johann Albrecht II. (Mecklenburg),ヨハン・アルブレヒト2世・(メクレンブルク公)
Heinrich XXIV. (Reuß-Ebersdorf),ハインリヒ24世・(ロイス＝エーベルスドルフ伯)
Conrad Schnitzler,コンラッド・シュニッツラー
Heinrich von Zügel,ハインリヒ・フォン・ツューゲル
Marcel Risse,マルセル・リッセ
Hans Filbinger,ハンス・フィルビンガー
Falko Weißpflog,ファルコ・バイスフロク
Marcel Heller,マルセル・ヘラー
Ibrahim Tanko,イブラヒム・タンコ
Gustav Reichardt,グスタフ・ライヒャルト
Nicolai Müller,ニコライ・ミュラー
Georg Schumann (Komponist),ゲオルク・シューマン・(作曲家)
Uwe Kagelmann,ウーベ・カゲルマン
Johann Heinrich Buttstett,ヨハン・ハインリヒ・ブットシュテット
Joachim Ringelnatz,ヨアヒム・リンゲルナッツ
Philipp Wollscheid,フィリップ・ヴォルシャイト
Saschko Gawriloff,サシュコ・ガヴリーロフ
Bogislaw XIV.,ボギスラフ14世・(ポメラニア公)
Johann Christoph Vogel,ヨハン・クリストフ・フォーゲル
Werner Liebrich,ヴェルナー・リーブリッヒ
Karl Anton Eckert,カール・エッケルト
Joseph Schuster (Komponist),ヨーゼフ・シュースター・(作曲家)
Thomas Quasthoff,トーマス・クヴァストホフ
Aribert von Anhalt,アリベルト・フォン・アンハルト
Karl Anton von Hohenzollern,カール・アントン・フォン・ホーエンツォレルン＝ジグマリンゲン・(1868-1919)
Felix Bastians,フェリックス・バスティアンス
Reinhard Fabisch,ラインハルト・ファビッシュ
Yasin Öztekin,ヤシン・エズテキン
Jan Kirchhoff,ヤン・キルヒホフ
Malik Fathi,マリク・ファティ
Valdet Rama,ヴァルデト・ラマ
Kevin Vogt,ケヴィン・フォクト
Alexander Madlung,アレクサンダー・マドルング
Pierre-Michel Lasogga,ピエール＝ミシェル・ラソッガ
Uli Stein (Fußballspieler),ウリ・シュタイン
Klaus Wolfermann,クラウス・ヴォルファーマン
Klaus-Jürgen Grünke,クラウス＝ユルゲン・グリュンケ
Marc Streitenfeld,マルク・ストライテンフェルト
Christoph Moritz,クリストフ・モリッツ
Astrid Hochstetter,アストリート・ホーホシュテッター
Elfie Donnelly,エルフィ・ドネリー
Hans-Jochen Vogel,ハンス＝ヨッヘン・フォーゲル
Eric Braeden,エリック・ブレーデン
Simon Geschke,シモン・ゲシュケ
Uli Kusch,ウリ・カッシュ
Reinhard Stumpf (Fußballspieler),ラインハルト・シュトゥンプ
Hermann Ottomar Herzog,ヘルマン・ヘルツォーク
Hans Nibel,ハンス・ニベル
Apparat (Musiker),アパラット
Heinrich Friedrich von der Pfalz,ハインリヒ・フリードリヒ・フォン・デア・プファルツ
Johann Eleazar Schenau,ヨハン・エレアザル・ツァイシッヒ
Hansi Flick,ハンス＝ディーター・フリック
Hans Donauer der Ältere,ハンス・ドナウアー
Heinz Röttger,ハインツ・レトガー
Olaf Marschall,オラフ・マーシャル
Arnold Büscher,アルノルト・ビュッシャー
Michael Rich,ミヒャエル・リッヒ
Konrad V. (Oels),コンラト5世コンツキ
Arthur Friedheim,アルトゥール・フリードハイム
Harry Glaß,ハリー・グラス
Georg Zacharias,ゲオルク・ツァハリアス
"Patrick Herrmann (Fußballspieler, 1991)",パトリック・ヘアマン
Manuel Schmiedebach,マヌエル・シュミーデバッハ
Peter Vonhof,ペーター・フォンホフ
Stephan Krehl,シュテファン・クレール
Raphael Wolf,ラファエル・ヴォルフ
Franz von Hoeßlin,フランツ・フォン・ヘスリン
Tony Jantschke,トニー・ヤンチュケ
Wolfgang Fortner,ヴォルフガング・フォルトナー
Carlos Schwabe,カルロス・シュヴァーベ
Willi Holdorf,ヴィリ・ホルドルフ
Ulrich Schnauss,ウルリッヒ・シュナウス
Oleg Velyky,オレグ・ヴェリキー
Shkodran Mustafi,シュコドラン・ムスタフィ
Terrence Boyd,テレンス・ボイド
Hartmut Briesenick,ハルトムート・ブリーゼニク
Robert von Württemberg,ローベルト・フォン・ヴュルテンベルク
Johannes Rottenhammer,ハンス・ロッテンハンマー
Antoine Monot,アントワーヌ・モノー・Jr
Bernd Bransch,ベルント・ブランシュ
Paul-Heinz Wellmann,パウル＝ハインツ・ヴェルマン
Arnold Topp,アルノルト・トップ
Sebastian Haseney,ゼバスティアン・ハーゼナイ
Anke Rehlinger,アンケ・レーリンガー
Thomas Klauser,トーマス・クラウザー
Diego Demme,ディエゴ・デンメ
Christian II. (Sachsen),クリスティアン2世・(ザクセン選帝侯)
John Neumeier,ジョン・ノイマイヤー
Thorsten Fink,トルステン・フィンク
"Johann Bernhard Bach (Komponist, 1676)",ヨハン・ベルンハルト・バッハ
Arnold Reissert,アーノルド・ライセルト
Paulo Rink,パウロ・リンク
Stephan Micus,ステファン・ミクス
Paul Friedrich zu Mecklenburg,パウル・フリードリヒ・ツー・メクレンブルク
Erik Pausin,エーリヒ・パウージン
Thomas Huschke,トマス・フシュケ
Arnold Huebner,アルノルト・ヒュプナー
Friedrich II. (Meißen),フリードリヒ2世・(マイセン辺境伯)
Wolfgang Kleff,ヴォルフガング・クレフ
Franz Binder (Fußballspieler),フランツ・ビンダー
Johann Sebastian Bach (Maler),ヨハン・ゼバスティアン・バッハ・(画家)
Miltiades Caridis,ミルティアデス・カリディス
Thomas Sydenham,トマス・シデナム
Dietrich Thurau,ディートリヒ・トゥーラウ
Rouwen Hennings,ロウヴェン・ヘニングス
Jakob Philipp Hackert,ヤコブ・フィリップ・ハッケルト
Friedrich II. (Hessen-Homburg),フリードリヒ2世・(ヘッセン＝ホンブルク方伯)
Natalie Horler,ナタリー・ホーラー
Isabel de Navarre,イザベル・ド・ナヴァール・(フィギュアスケート選手)
Ludwig der Springer,ルートヴィヒ跳躍伯
Mirko Votava,ミロスラフ・ボタバ
Dominic Klemme,ドミニク・クレメ
August Grisebach (Kunsthistoriker),アウグスト・グリーゼバッハ・(美術史家)
Ernst Willimowski,エルンスト・ヴィリモフスキ
August Halm,アウグスト・ハルム
Oliver Shanti,オリバー・シャンティ
Franz Schönhuber,フランツ・シェーンフーバー
Hermann van Pels,ヘルマン・ファン・ペルス
Dennis Diekmeier,デニス・ディークマイアー
Ernst Robert Curtius,エルンスト・ローベルト・クルツィウス
Heinrich Kaminski,ハインリヒ・カミンスキ
Ulrich Tukur,ウルリッヒ・トゥクル
Edgar Ende,エドガー・エンデ
Walter Gramatté,ヴァルター・グラマッテ
Björn Kircheisen,ビョルン・キルヒアイゼン
Heinrich (princeps militiae),ハインリヒ・(東フランケン)
Heinrich III. (Bayern),ハインリヒ3世・(バイエルン公)
Tobias Rau,トビアス・ラウ
Ferdinand Albrecht I. (Braunschweig-Wolfenbüttel-Bevern),フェルディナント・アルブレヒト1世・(ブラウンシュヴァイク＝ヴォルフェンビュッテル＝ベーヴェルン公)
Jürgen Straub,ユルゲン・シュトラウプ
Georg Pencz,ゲオルク・ペンツ
Johann Georg I. (Sachsen-Eisenach),ヨハン・ゲオルク1世・(ザクセン＝アイゼナハ公)
Slobodan Komljenović,スロボダン・コムリェノヴィッチ
Sebastian Rode,セバスティアン・ローデ
Stefan Aigner,シュテファン・アイグナー
Georg Thoma,ゲオルク・トーマ
Martin Lauer,マルチン・ラウアー
Johann Friedrich II. (Sachsen),ヨハン・フリードリヒ2世・(ザクセン公)
Karim Bellarabi,カリム・ベララビ
Meister Francke,マイスター・フランケ
Daniel Reiche,ダニエル・ライヒェ
Anna Pogany,アナ・ポガニー
Lee Charm,リー・チャーム
Hans Erich Apostel,ハンス・エーリッヒ・アポステル
Sebastian Langkamp,ゼバスティアン・ラングカンプ
Rolf Kasparek,ロックン・ロルフ
Eric Frenzel,エリック・フレンツェル
Jochen Danneberg,ヨッヘン・ダンネベルク
Ernst I. (Braunschweig-Lüneburg),エルンスト1世・(ブラウンシュヴァイク＝リューネブルク公)
Johann Krieger (Komponist),ヨハン・クリーガー
Christoph Janker,クリストフ・ヤンカー
Johann Liss,ヨハン・リス
Hakan Çalhanoğlu,ハカン・チャルハノール
Heinz Fütterer,ハインツ・フュッテラー
Georg Kolbe,ゲオルク・コルベ
Hans Albers,ハンス・アルバース
Ulrich Wehling,ウルリヒ・ベーリンク
Rafael Scheidt,ラファエル・フェリペ・シャイデ
Timo Ochs,ティモ・オクス
Johann Nikolaus Bach (Komponist),ヨハン・ニコラウス・バッハ
Henry Glaß,ヘンリー・グラス
Babette Koblenz,バベッテ・コブレンツ
Fabian Thylmann,ファビアン・ティルマン
Otto Freundlich,オットー・フロイントリッヒ
Milko Kelemen,ミルコ・ケレメン
Karl zu Mecklenburg (1708–1752),カール・ツー・メクレンブルク＝シュトレーリッツ
Holger Czukay,ホルガー・シューカイ
Anna von Harnier,アナ・フォン・ハルニアー
Hans-Jürgen Dörner (Fußballspieler),ハンス＝ユルゲン・デルナー
Oliver Reck,オリバー・レック
Hugo Distler,フーゴー・ディストラー
Kessler-Zwillinge,ケスラー姉妹
Harald Norpoth,ハラルト・ノルポト
Cenk Güvenç,ジェンク・ギュヴェンチ
Luis Manuel Seijas,ルイス・マヌエル・セイハス
Michael Preetz,ミヒャエル・プレーツ
Volker Braun,フォルカー・ブラウン
Siegmund von Hausegger,ジークムント・フォン・ハウゼッガー
Hans Georg von Arnim-Boitzenburg,ハンス・フォン・アルニム＝ボイツェンブルク
Erich Borchmeyer,エーリッヒ・ボルフマイヤー
Peer Kluge,ペール・クルゲ
Wolfgang Lotz (Agent),ウォルフガング・ロッツ
Melchior Franck,メルキオル・フランク
Otto V. (Bayern),オットー5世・(バイエルン公)
Klaus Ostwald,クラウス・オストヴァルト
Rolf Wolfshohl,ロルフ・ヴォルフショール
Aziz Bouhaddouz,アジズ・ブハドゥズ
Erwin Kostedde,エルヴィン・コステデ
Otto Froitzheim,オットー・フロイツハイム
Thomas Tuchel,トーマス・トゥヘル
Johann Cicero,ヨハン・ツィーツェロ・(ブランデンブルク選帝侯)
Siegfried Wentz,ジークフリート・ヴェンツ
Jörg Albertz (Fußballspieler),ヨルグ・アルベルツ
Moritz Volz,モリッツ・フォルツ
Barbara Claßen,バルバラ・クラッセン
Benno Orenstein,ベンノ・オーレンシュタイン
Annalena Baerbock,アンナレーナ・ベアボック
Jörg Buttgereit,ユルグ・ブットゲライト
Charles Friedek,チャールズ・フリーデク
Harald Genzmer,ハラルト・ゲンツマー
Peter Dronke,ピーター・ドロンケ
Mario Kummer,マリオ・クマー
Ingo Schwichtenberg,インゴ・シュヴィヒテンバーグ
Johann Walter,ヨハン・ワルター
Danilo Hondo,ダニーロ・ホンド
Nando Rafael,ナンド・ラファエル
Christian Schad,クリスチャン・シャド
Otto I. (Braunschweig),オットー1世・(ブラウンシュヴァイク＝リューネブルク公)
Thomas Allofs,トーマス・アロフス
Max Slevogt,マックス・スレーフォークト
