Emmy Klieneberger-Nobel,エミー・クラインバーガー＝ノーベル
Hany Mukhtar,ハニー・ムフタール
Joachim von Ribbentrop,ヨアヒム・フォン・リッベントロップ
Peter Scholze,ペーター・ショルツェ
Maria von Braunschweig-Wolfenbüttel (1566–1626),マリア・フォン・ブラウンシュヴァイク＝ヴォルフェンビュッテル
Helmuth Friedrichs,ヘルムート・フリードリヒス
Ingeborg von Kusserow,インゲボルグ・ファン・キュッセロー
Georg August Zenker,ゲオルク・ツェンカー
Leopold Ludwig,レオポルト・ルートヴィヒ
Wilibald Nagel,ヴィリバルト・ナーゲル
Winfried Brugger,ヴィンフリート・ブルッガー
Berend Jacobsen Karpfanger,ベーレント・ヤーコプゼン・カープファンガー
Mina Tander,ミナ・タンデル
Carl Christoph Lörcher,カールクリストフ・ロルヒャー
Helmuth Theodor Bossert,ヘルムート・テーオドール・ボッセルト
Margarete Schön,マルガレーテ・シェーン
Rolf Wilhelm Brednich,ロルフ・ヴィルヘルム・ブレードニヒ
Bodewin Keitel,ボーデヴィン・カイテル
Günther Radusch,ギュンター・ラドゥシュ
Manfred Döring,マンフレート・デーリング
Franz W. Seidler,フランツ・ザイトラー
Otto Gerdes,オットー・ゲルデス
Roger Melis,ロジャー・メリス
Fritz Gajewski,フリッツ・ガイェウフスキー
Willi Reschke,ヴィリ・レシュケ
Heinrich II. (HRR),ハインリヒ2世・(神聖ローマ皇帝)
Deniz Aytekin,デニス・アイテキン
Hartmut Höll,ハルトムート・ヘル
Wilhelm Münker,ウィルヘルム・ミュンカー
Otto Koellreutter,オットー・ケルロイター
Klaus Luhmer,クラウス・ルーメル
Lothar Krappmann,ローター・クラップマン
Natalie Wormsbecher,ナタリー・ヴォルムスベッヒャー
Hans Müller-Kray,ハンス・ミュラー＝クライ
Jürgen Brandt,ユルゲン・ブラント
Ulrich Koch (Musiker),ウルリヒ・コッホ
Erwin Barth,エルヴィン・バルト
Heinrich Vater,ハインリッヒ・アウグスト・ファーター
Franz Xaver Reichhart,フランツ・クサーヴァー・ライヒハート
Marjan Shaki,マジャーン・シャキ
Klaus Stern (Rechtswissenschaftler),クラウス・シュテルン
Peter Schmidt (Designer),ペーター・シュミット
Christoph in Bayern,クリストフ・イン・バイエルン
Hermann Bausinger,ヘルマン・バウジンガー
Hermann Bäumer,ヘルマン・ボイマー
Elisabeth Böckel,エリザベート・ベッケル
Oliver Bootz,オリバー・ブーツ
Kurt Lütgen,クルト・リュートゲン
Fritz Encke,フリッツ・エンケ
Susanna Margaretha Brandt,ズザンナ・マルガレータ・ブラント
Oskar Oehler,オスカール・エーラー
Friedrich Wilhelm Hack,フリードリヒ・ハック
Marianne Bachmeier,マリアンネ・バハマイヤー
Eberhard Jabach,エバーハルト・ジャバッハ
Hartmut Esslinger,ハルトムット・エスリンガー
Hilde Mangold,ヒルデ・マンゴルト
Sascha Göpel,ザーシャ・ゲーペル
Andreas Homoki,アンドレアス・ホモキ
Ingeborg Weber-Kellermann,インゲボルク・ヴェーバー＝ケラーマン
Heinrich Unverhau,ハインリヒ・ウンファーハウ
Sabine Thiesler,ザビーネ・ティースラー
Ramona Kühne,ラモーナ・キューネ
Wolfgang von Gronau,ヴォルフガング・フォン・グロナウ
Wolfgang Funke,ヴォルフガング・フンケ
Joachim Christoph von Jeetze,ヨアヒム・クリストフ・フリードリヒ・フォン・イェーツェ
Hito Steyerl,ヒト・シュタイエル
Karl Heinz Bohrer,カール・ハインツ・ボーラー
Dirk Adorf,ダーク・アドロフ
Theodor Litt,テオドール・リット
Wilhelm Flitner,ヴィルヘルム・フリットナー
Ernst von Aster (Philosoph),エルンスト・フォン・アスター
Zoya Douchine,ゾヤ・ドゥーシン
Christian Hohenadel,クリスチャン・ホーヘナデル
Peter Latz,ペーター・ラッツ
Igor Levit,イゴール・レヴィット
Susanne S. Renner,スザンヌ・レナー
Dietmar Bartsch,ディートマー・バルチュ
Heinrich Werner (Komponist),ハインリッヒ・ヴェルナー
Gustav Stresemann,グスタフ・シュトレーゼマン
Carl Friedrich Göschel,カール・フリードリヒ・ゲッシェル
Michael Theunissen,ミヒャエル・トイニッセン
Andreas M. Kaplan,アンドレアス・カプラン
Max Ernst Unger,マックス・ウンガー・(音楽学者)
Erwin von Helmersen,エルヴィン・フォン・ヘルメルゼン
Erwin Bumke,エルヴィン・ブムケ
Gerhard Hirschfeld,ゲルハルト・ヒルシュフェルト
Friedrich Bernhard (Pfalz-Gelnhausen),フリードリヒ・ベルンハルト・(プファルツ＝ゲルンハウゼン公)
Frank Jelinski,フランク・イェリンスキー
Dietmar Woidke,ディートマー・ヴォイトケ
Eva-Ingeborg Scholz,エヴァ・インゲボルグ・シュルフ
Gerrit Zitterbart,ゲリット・ツィッターバルト
Dietz Otto Edzard,ディーツ＝オットー・エッツァルト
Hannibal von Lüttichau,ハンニバル・フォン・リュッティヒャウ
Joachim Zahn,ヨアヒム・ザーン
Klaus Held,クラウス・ヘルト
Mario Götze,マリオ・ゲッツェ
Johann Gottlieb Fichte,ヨハン・ゴットリープ・フィヒテ
Harald Grohs,ハラルド・グロース
Nina Eichinger,ニーナ・アイヒンガー
Ruth Ziesak,ルート・ツィーザク
Herbert Wagner (Physiker),ヘルベルト・ワグナー
Sven Meyer (Eiskunstläufer),スヴェン・マイヤー
Bodo Ramelow,ボド・ラメロウ
Bettina Pousttchi,ベティーナ・プスチー
"Michael Müller (Politiker, 1964)",ミヒャエル・ミュラー
Werner Andreas Albert,ヴェルナー・アンドレアス・アルベルト
Georg Balthasar Metzger,ゲオルク・バルタザール・メッツガー
Clemens Meyer (Schriftsteller),クレメンス・マイヤー
Heinrich Vogt (Astronom),ハインリヒ・フォークト・(天文学者)
Heinrich Berlin,ハインリヒ・ベルリン
Mike Hanke,マイク・ハンケ
Otto Bachof,オットー・バッホフ
Enoch zu Guttenberg,エノッホ・ツー・グッテンベルク
Ulrich Gabler,ウルリッヒ・ガブラー
Manuel Neuer,マヌエル・ノイアー
Rainer Kirsch,ライナー・キルシュ
Evelyn Richter,エヴェリン・リヒター
Thomas Meyer-Fiebig,トーマス・マイヤー＝フィービッヒ
August von Herder,ジギムント・アウグスト・ヴォルフガング・ヘルダー
Hermine Huntgeburth,ヘルミーネ・フントゥゲボールト
Karl Friedrich Wilhelm Braun,カール・フリードリヒ・ヴィルヘルム・ブラウン
George Grosz,ジョージ・グロス
Hugo Grimm (Schauspieler),ヒュベルトゥス・グリム
Wolfgang Caspar Printz,ヴォルフガング・プリンツ
Katharina von Altenbockum,カタリーナ・フォン・アルテンボックム
Fritz Rudolf Fries,フリッツ・ルドルフ・フリース
Tim Wiese,ティム・ヴィーゼ
Otto Griessing,オットー・グリーシンク
Klaus Niedzwiedz,クラウス・ニーヅビーズ
Herbert Hübner (Schauspieler),ハーバート・ヒュープナー
Elisabeth von Schleswig-Holstein-Sonderburg,エリーザベト・フォン・シュレースヴィヒ＝ホルシュタイン＝ゾンダーブルク
Katja Weitzenböck,カーチャ・ヴァイツェンベック
Christian Bartholomae,クリスチャン・バルトロメー
Patrick Süskind,パトリック・ジュースキント
Nicole Schott,ニコル・ショット
Cecilie von Preußen (1917–1975),ツェツィーリエ・フォン・プロイセン
Christian Redl (Schauspieler),クリスチャン・レドル
Heinrich Dumoulin,ハインリヒ・デュモリン
Wolfgang Walter (Mathematiker),ヴォルフガンク・ウォルター
Bernd Aldenhoff,ベルント・アルデンホフ
Winfried Hassemer,ヴィンフリート・ハッセマー
Armgard (Rietberg),アルムガルト・フォン・リートベルク
Anna von Braunschweig-Lüneburg,アンナ・フォン・ブラウンシュヴァイク＝リューネブルク
Robert Vischer,ロベルト・フィッシャー
Peter Schiergen,ペーター・シールゲン
Anton Bergmeier,アントン・ベルクマイヤー
Hermann Grossmann (SS-Mitglied),ヘルマン・グロスマン
Theodor Viehweg,テオドール・フィーヴェク
August von Sachsen (1589–1615),アウグスト・フォン・ザクセン
Oskar Daubmann,オスカル・ダウブマン
Hans Reiser (Schauspieler),ハンス・ライザー・(俳優)
Heinrich Bedford-Strohm,ハインリヒ・ベッドフォード＝ストローム
Gerd Vespermann,ゲルト・ヴェスパーマン
Hartmut Klug,ハルトムート・クルーク
Anna Hollmann,アンナ・ホルマン
Wolfgang Michel (Japanologe),ヴォルフガング・ミヒェル
Max Ernst Mayer,マックス・エルンスト・マイヤー
Wolfgang Kaschuba,ヴォルフガング・カシューバ
Arthur Schnabel,アルトゥル・シュナーベル・(柔道)
Heinrich der Löwe,ハインリヒ3世・(ザクセン公)
Gerald Asamoah,ゲーラルド・アサモア
Axel Stein,アクセル・シュタイン
Jerôme Gondorf,ジェローム・ゴンドルフ
Heinrich Rombach,ハインリヒ・ロムバッハ
Heinz Waaske,ハインツ・ヴァースケ
Benjamin List,ベンジャミン・リスト
Norbert Bolz,ノルベルト・ボルツ
Rudolf Smend (Jurist),ルドルフ・スメント
Ludwig Philipp (Pfalz-Guttenberg),ルートヴィヒ・フィリップ・(プファルツ＝グッテンベルク公)
Tonio Selwart,トニオ・セルヴァルト
Philipp Ludwig (Schleswig-Holstein-Sonderburg-Wiesenburg),フィリップ・ルートヴィヒ・(シュレースヴィヒ＝ホルシュタイン＝ゾンダーブルク＝ヴィーゼンブルク公)
Heinz Bechert,ハインツ・ベッヘルト
Otto Schlüter (Geograph),オットー・シュリューター
Ludwig Hoelscher,ルートヴィヒ・ヘルシャー
Bogislaw von Bonin,ボギスラウ・フォン・ボーニン
Hans-Dietrich Genscher,ハンス＝ディートリヒ・ゲンシャー
Ursula Arnold (Fotografin),ウーズラ・アーノルト
Carl-A. Fechner,カール・フェヒナー
Zofia Garden,ゾフィア・ガルデン
Thomas Schumacher (Musiker),トーマス・シューマッハ
Melchior Bauer,メルヒオール・バウアー
Günther Grzimek (Landschaftsarchitekt),ギュンター・グルツィメク
Franz Hawlata,フランツ・ハヴラタ
Hermann Adam von Kamp,ヘルマン・アーダム・フォン・カンプ
Lenz Kriss-Rettenbeck,レンツ・クリス＝レッテンベック
Enorbel Márquez-Ramirez,エノルベル・マルケス＝ラミレス
Hermann Lorenz (Henker),ヘルマン・ローレンツ
Astrid Paprotta,アストリット・パプロッタ
Uwe Pörksen,ウヴェ・ペルクセン
Herbert Schwedt,ヘルベルト・シュヴェート
Karl-Heinz Schwab,カール・ハインツ・シュヴァープ
Gerhard Krebs (Historiker),ゲルハルト・クレープス
Franz Ruttner,フランツ・ルットナー
Daniel Lascău,ダニエル・ラスカウ
Frauke Eickhoff,フラウケ・アイコフ
Petra Oelker,ペトラ・エルカー
Peter Eichhorn (Wirtschaftswissenschaftler),ペーター・アイヒホルン
Otto Riehs,オットー・リース
Ludwig Leo (Architekt),ルートヴィヒ・レオ
Werner Panitzki,ヴェルナー・パニツキ
Vladimir Tsvetkov,ウラジーミル・ツヴェトコフ
Joachim Friedrich von Stutterheim,ヨアヒム・フリードリヒ・フォン・シュトゥッターハイム
Jochen Bohl,ヨッヘン・ボール
Elisabeth von Brandenburg (1425–1465),エリーザベト・フォン・ブランデンブルク・(1425-1465)
Christopher Mies,クリストファー・ミース
Ralf Kelleners,ラルフ・ケルナーズ
Elke Erb,エルケ・エルプ
Max Bruch,マックス・ブルッフ
Johann Heinrich Wilhelm Dietz,ヨハン・ハインリヒ・ヴィルヘルム・ディーツ
Jeffrey Carney,ジェフリー・カーニー
Manuel Friedrich,マヌエル・フリードリヒ
Johann Gasteiger,ヨハン・ガスタイガー
Peter Munz,ピーター・マンツ
Sergei Tchoban,セルゲイ・チョーバン
Rolf Kleinert,ロルフ・クライネルト
Wilhelm Ludwig von Baden-Durlach,ヴィルヘルム・ルートヴィヒ・フォン・バーデン＝ドゥルラハ
Stefan Kießling,シュテファン・キースリング
Tony Schmidt (Rennfahrer),トニー・シュミット
Florentin zu Salm-Salm,フロレンティン・ツー・ザルム＝ザルム
Dora Hitz,ドーラ・ヒッツ
Johann Baptist Eichelsdörfer,ヨハン・バプティスト・アイヒェルスデルファー
Alexander Baumann (Flugzeugkonstrukteur),アレクサンダー・バウマン
Oskar Lafontaine,オスカー・ラフォンテーヌ
Ernst Zörner,エルンスト・ツェルナー
"Joachim Herrmann (Politiker, 1928)",ヨアヒム・ヘルマン
George Alexander Albrecht,ゲオルゲ・アレクサンダー・アルブレヒト
Adam von Bremen,ブレーメンのアダム
Gina Falckenberg,ギナ・ファルケンベルク
Friederike Caroline von Sachsen-Coburg-Saalfeld,フリーデリケ・カロリーネ・フォン・ザクセン＝コーブルク＝ザールフェルト
Thomas Meißner,トーマス・マイスナー
Florian Ballhaus,フロリアン・バルハウス
Wolfgang Hahn (Mathematiker),ヴォルフガンク・ハーン
Friedrich Klaeber,フレデリック・クレーバー
Claudio Pizarro,クラウディオ・ピサーロ
Friedrich Karl Wilhelm,フリードリヒ・カール・ヴィルヘルム
Uta Briesewitz,ユタ・ブリースウィッツ
Klaus Hasselmann,クラウス・ハッセルマン
Paula Kalenberg,パウラ・カレンベルク
Otto Falckenberg,オットー・ファルケンベルク
Hans Ueberschaar,ヨハンネス・ユーバーシャール
Knut Urban,クヌート・ウルバン
Fredy Schmidtke,フレディ・シュミットケ
Jörg Faerber,イェルク・フェルバー
Wilhelm (Werle),ヴィルヘルム・(ヴェルレ領主)
Adolf von Bomhard,アドルフ・フォン・ボンハルト
"Melusina von der Schulenburg, Countess of Walsingham",ペトロニラ・メルジーネ・フォン・デア・シューレンブルク・(ウォルシンガム女伯爵)
Oliver Stokowski,オリヴァー・ストコウスキ
Lydia Rabinowitsch-Kempner,リディア・ラビノヴィッチ＝ケンプナー
"Kacper Przybyłko (Fußballspieler, 1993)",カツペル・プシビウコ
Seyran Ateş,セイラン・アテシュ
Mathias Wieman,マチアス・ヴィーマン
Konradin Groth,コンラディン・グロート
Edgar Selge,エトガー・ゼルゲ
Heiko Maas,ハイコ・マース
Aleixo-Platini Menga,アレイショ＝プラティニ・メンガ
Fahri Yardım,ファーリ・オーゲン・ヤルディム
Laura Emonts,ラウラ・ワイエンマイアー
Alex Brendemühl,アレックス・ブレンデミュール
Wolfgang Zilzer,ヴォルフガング・ツィルツァー
Marianne von der Leyen,マリアンネ・フォン・ダールベルク
Alfred Partikel,アルフレッド・パーティケル
Christina Benecke,クリスティーナ・ベネッケ
Siegfried Mauser,ジークフリート・マウザー
Hans Memling,ハンス・メムリンク
Oldenburger Baby,オルデンブルク事件
Klaus Dede,クラウス・デデ
Jürgen Tonkel,ユルゲン・トンケル
Oliver Stritzel,オリヴァー・シュトリツェル
Dietrich Lohmann,ディートリッヒ・ローマン
Otto Wacker (Kunsthändler),オットー・ヴァッカー
Sigurd Hofmann,シグルド・ホフマン
Christoph Graupner,クリストフ・グラウプナー
Maria Mies,マリア・ミース
Mario Veit,マリオ・ベイト
Birgit Prinz,ビルギット・プリンツ
Heiko Westermann,ハイコ・ヴェスターマン
Werner Marx (Philosoph),ヴェルナー・マルクス
Thomas Mutsch,トーマス・ムテシュ
Agnes von Mansfeld-Eisleben,アグネス・フォン・マンスフェルト＝アイスレーベン
Robert Habeck,ロベルト・ハーベック
Max Picard,マックス・ピカート
Jost Amman,ヨースト・アンマン
Martin Braxenthaler,マルティン・ブラクセンターラー
Hans Schemm,ハンス・シェム
Bernhard Woldenga,ベルンハルト・ヴォルデンガ
Franz-Joseph Schulze,フランツ＝ヨーゼフ・シュルツェ
Jana-Franziska Poll,ヤナ・ポル
Robert Enke,ロベルト・エンケ
Susanne Stadlmüller,ズザンネ・シュタッドルミュラー
Torsten Frings,トルステン・フリンクス
Peter Merker,ペーター・メルカー
Kevin Trapp,ケヴィン・トラップ
Kurt Leimer,クルト・ライマー
Gero Hütter,ゲロ・ヒュッター
Sebastian Wimmer (SS-Mitglied),ゼバスティアン・ヴィンマー
Simone Peter,ジモーネ・ペーター
Ernst Münch (Forstwissenschaftler),エルンスト・ミュンヒ・(林学者)
Armin Mohler,アルミン・モーラー
Hans Bernoulli,ハンス・ベルヌーイ
Johann Jakob Bodmer,ヨハン・ヤーコプ・ボードマー
Markus Dröge,マルクス・ドレーゲ
Ankie Beilke,貝安琪
Amalie von der Pfalz,アマーリエ・フォン・デア・プファルツ
Bernhard (Baden-Durlach),ベルンハルト・(バーデン＝ドゥルラハ辺境伯)
Mats Hummels,マッツ・フンメルス
Nesrin Şamdereli,ネスリン・サムデレリ
Jens Zimmermann (Musiker),イェンス・ツィマーマン
Elisabeth Heimpel,エリザベート・ハインペル
Carl Böhret,カール・ベーレト
Ernst-Heinrich Schmauser,ハインリヒ・シュマウザー
Günther Josten,ギュンター・ヨステン
Boris Rhein,ボリス・ライン
Boris Kodjoe,ボリス・コジョー
Gustav Heigel,グスタフ・ヘイゲル
Aribert Heim,アリベルト・ハイム
Marie von Schwarzburg-Rudolstadt,マリー・フォン・シュヴァルツブルク＝ルードルシュタット
Hans Peter Duerr,ハンス・ペーター・デュル
Walter Zapp,ヴァルター・ツァップ
Mathilde Hain,マティルデ・ハイン
Alfons Deeken,アルフォンス・デーケン
Gustav Allinger,グスタフ・アリンガー
Helmut Coing,ヘルムート・コーイング
Monika Krohwinkel,モニカ・クローヴィンケル
Paul Hinkler,パウル・ヒンクラー
Jakob Ullmann,ヤーコプ・ウルマン
Torsten Loibl,トーステン・ロイブル
Walter Troppenz,ヴァルター・トロッペンツ
Andrea Diewald,アンドレア・ディーヴァルト
Helmut Winschermann,ヘルムート・ヴィンシャーマン
Leopold Gutterer,レオポルト・グッテラー
Takashi Ochi,越智敬
Karl-Sigismund Kramer,カール＝ジーギスムント・クラーマー
"Henning Alexander von Kleist (General, um 1676)",ヘニング・アレクサンダー・フォン・クライスト
Günter Wolf (General),ギュンター・ヴォルフ
Thomas Strobl,トーマス・ストローブル
Herbert Friedrich,ヘルベルト・フリードリヒ
Leonie Benesch,レオニー・ベネシュ
Adolph Friedrich von der Schulenburg,アドルフ・フリードリヒ・フォン・デア・シューレンブルク
Franziska Buch,フランツィスカ・ブッフ
Miriam Steinel,ミリアム・シュタイネル
Christian Möller (Theologe),クリスティアン・メラー
Hermann Schmitz (Philosoph),ヘルマン・シュミッツ
Moritz Brand,モーリッツ・ブランド
Ronald Grossarth-Maticek,ロナルト・グロッサルト＝マティチェク
Karl Dammer,カール・ダマー
Christina Hammer,クリスティーナ・ハマー
Joachim Tschirner,ヨアヒム・チルナー
Dennis Aogo,デニス・アオゴ
Gottfried Korff,ゴットフリート・コルフ
Dietrich Stauffer,ディートリッヒ・シュタウファー
Jakob Muth,ヤコブ・ムート
Dieter Kreidler,ディーター・クライトラー
Klaus Roth (Volkskundler),クラウス・ロート
Boris von Smercek,ボリス・フォン・スメルチェック
Nena,ネーナ
Henry van de Velde,アンリ・ヴァン・デ・ヴェルデ
Mehmet Scholl,メーメット・ショル
Piotr Trochowski,ピオトル・トロホウスキ
Konstanze Vernon,コンスタンツェ・ヴェルノン
Kaspar Maase,カスパル・マーゼ
Karl Suske,カール・ズスケ
Frank Otfried July,フランク・オトフリート・ユリー
Helge Gerndt,ヘルゲ・ゲルント
Anatol Ugorski,アナトール・ウゴルスキ
"Ulrich Herrmann (Pädagoge, 1939)",ウーリッヒ・ヘルマン
Richard Roosen,リヒャルト・ローゼン
Walter Schmitt (SS-Mitglied),ヴァルター・シュミット
Irmela Hijiya-Kirschnereit,イルメラ・日地谷・キルシュネライト
Philipp von Schwaben,フィリップ・(神聖ローマ皇帝)
Matthias Grünewald,マティアス・グリューネヴァルト
Nikolaus von Kues,ニコラウス・クザーヌス
Lewon Aronjan,レヴォン・アロニアン
Karlheinz Stockhausen,カールハインツ・シュトックハウゼン
Marita Koch,マリタ・コッホ
Friedrich Gottlieb Klopstock,フリードリヒ・ゴットリープ・クロプシュトック
Till Lindemann,ティル・リンデマン
Wilhelm Decker (Politiker),ヴィルヘルム・デッカー
Daniel Libeskind,ダニエル・リベスキンド
Roman Weidenfeller,ローマン・ヴァイデンフェラー
Paul Frosch,パウル・フロッシュ
Gustav Vorherr,グスタフ・フォアヘア
Arnold Schönberg,アルノルト・シェーンベルク
Sascha Burchert,サシャ・ブルヒャート
Gerhard Mertins,ゲルハルト・メルティンズ
Klaus Meine,クラウス・マイネ
René Adler,レネー・アードラー
Andreas Köpke,アンドレアス・ケプケ
Alfred von Tirpitz,アルフレート・フォン・ティルピッツ
Michael Keusch,ミヒャエル・ケウシュ
Bill Kaulitz,ビル・カウリッツ
Ron-Robert Zieler,ロン＝ロベルト・ツィーラー
Diego Contento,ディエゴ・コンテント
Otto Barnewald,オットー・バルネヴァルト
Wigbert (Meißen),ヴィクベルト
Sophie von Preußen (1870–1932),ソフィア・(ギリシャ王妃)
Gustav Krupp von Bohlen und Halbach,グスタフ・クルップ
Friedrich Kemnade,フリードリヒ・ケンナーデ
Heinrich Brüning,ハインリヒ・ブリューニング
Dominik Schwager,ドミニク・シュワガー
Robert Huth,ロベルト・フート
Theodor Kober,テオドール・コーバー
Hans Luther,ハンス・ルター
Martin Schongauer,マルティン・ショーンガウアー
Christian Lorenz,クリスチャン・ロレンツ
Pina Bausch,ピナ・バウシュ
Hermann von Stahleck,ヘルマン3世・(ライン宮中伯)
Angela Gossow,アンジェラ・ゴソウ
Otto Klemperer,オットー・クレンペラー
Harald Rose (Physiker),ハラルド・ローゼ
Rainer Forst,ライナー・フォアスト
André Previn,アンドレ・プレヴィン
Sebastian Boenisch,セバスティアン・ボエニシュ
Dietmar Hamann,ディートマー・ハマン
Christian Ziege,クリスティアン・ツィーゲ
Thomas Häßler,トーマス・ヘスラー
Andreas Möller,アンドレアス・メラー
Kristin Otto,クリスティン・オットー
Alexander König (Eiskunstläufer),アレクサンダー・ケーニッヒ
Harald Grosskopf,ハラルド・グロスコフ
Armin Zimmermann (Admiral),アルミン・ツィンマーマン
Werner Hegemann,ヴェルナー・ヘーゲマン
Georg Varrentrapp,ゲオルク・ファレントラップ
Reinhard Schwarz-Schilling,ラインハルト・シュヴァルツ＝シリング
Alexej von Jawlensky,アレクセイ・フォン・ヤウレンスキー
Halil Altıntop,ハリル・アルトゥントップ
Haddaway,ハダウェイ
Luise von Mecklenburg-Strelitz,ルイーゼ・フォン・メクレンブルク＝シュトレーリッツ
Otto Bremer,オットー・ブレーマー
Jeanette Hain,ジャネット・ハイン
Carl Schuhmann,カール・シューマン
Franz Anton Schubert,フランツ・アントン・シューベルト
Uli Jon Roth,ウリ・ジョン・ロート
Johann Pfeiffer (Komponist),ヨハン・プファイファー
Markus Merk,マルクス・メルク
Michael Heinrich (Politikwissenschaftler),ミヒャエル・ハインリッヒ
Ursula Buckel,ウルスラ・ブッケル
Arthur Kaufmann (Jurist),アルトゥール・カウフマン・(法学者)
Willy Merté,ウィリー・ウォルター・メルテ
Ina Maria Schnitzer,ヨルダン・カーヴァー
Konrad III. (HRR),コンラート3世・(神聖ローマ皇帝)
Konrad IV. (HRR),コンラート4世・(神聖ローマ皇帝)
Sepp Herberger,ゼップ・ヘルベルガー
Thomas Schaaf,トーマス・シャーフ
Rudolf Schenker,ルドルフ・シェンカー
Auguste Karoline von Braunschweig-Wolfenbüttel,アウグステ・カロリーネ・フォン・ブラウンシュヴァイク＝ヴォルフェンビュッテル
Ludwig von Hofmann,ルートヴィヒ・フォン・ホフマン
Bruno Walter,ブルーノ・ワルター
Dirk Lehmann,ディルク・レーマン
Konrad I. (Ostfrankenreich),コンラート1世・(ドイツ王)
Moritz Leitner,モリッツ・ライトナー
Martin Bucer,マルチン・ブツァー
Rudolf Wissell,ルドルフ・ヴィッセル
Carl Kuntz (Maler),カール・クンツ
Christian Lell,クリスティアン・レル
Carl Stamitz,カール・シュターミッツ
"Toni Schumacher (Fußballspieler, 1954)",ハラルト・シューマッハー
Zvjezdan Misimović,ズヴェズダン・ミシモヴィッチ
Max Liebermann,マックス・リーバーマン
Maria von Brabant (1190–1260),マリー・ド・ブラバン・(1190-1260)
Manfred Deckert,マンフレート・デッケルト
Rafed El-Masri,ラフェド・エル＝マスリ
Herbert Eimert,ヘルベルト・アイメルト
Robert Sterl,ロベルト・シュテルル
