Chris Rea,クリス・レア
Fatima Whitbread,ファティマ・ウィットブレッド
David Ogilvy,デイヴィッド・オグルヴィ
Zienia Merton,ジーニア・マートン
Leslie Norman,レジー・ノーマン
"Eric Drummond, 16th Earl of Perth",エリック・ドラモンド (16代パース伯爵)
N. T. Wright,ニコラス・トマス・ライト
"George Mountbatten, 2nd Marquess of Milford Haven",ジョージ・マウントバッテン
Audrey Williamson,オードリー・ウィリアムソン
Lemmy,レミー・キルミスター
Robert Donat,ロバート・ドーナット
Ellen MacArthur,エレン・マッカーサー
Penelope Lively,ペネロピ・ライヴリー
Ginger Baker,ジンジャー・ベイカー
Chris Hoy,クリス・ホイ
Gerald Durrell,ジェラルド・ダレル
"Edward Grey, 1st Viscount Grey of Fallodon",エドワード・グレイ
Colin Renfrew,コリン・レンフルー
Katy B,ケイティ・B
Eugene Chaplin,ユージン・アンソニー・チャップリン
Scott Sinclair,スコット・シンクレア
Josh McEachran,ジョシュ・マクイクラン
Karl Johnson,カール・ジョンソン
Stewart Granger,スチュワート・グレンジャー
John Pasche,ジョン・パッシェ
Craig Levein,クレイグ・レヴェイン
Peter Mandelson,ピーター・マンデルソン
Joe Strummer,ジョー・ストラマー
Edward Fox,エドワード・フォックス
Henry Bellingham,ヘンリー・ベリンガム
Maryam d'Abo,マリアム・ダボ
Graeme Souness,グレアム・スーネス
Kunal Nayyar,クナル・ネイヤー
Nicholas Woodeson,ニコラス・ウッドソン
Ruth Wilson,ルース・ウィルソン
John Vane,ジョン・ベーン
Tim Hunt,ティモシー・ハント
Alan Bullock,アラン・ブロック
Graham Coxon,グレアム・コクソン
Gavin Williamson,ゲイビン・ウィリアムソン
Ingrid Newkirk,イングリッド・ニューカーク
"Alexander Cambridge, 1st Earl of Athlone",アレキサンダー・ケンブリッジ (初代アスローン伯爵)
"Thomas Bruce, 7th Earl of Elgin",トマス・ブルース (第7代エルギン伯爵)
Percy Hodge,パーシー・ホッジ
Ernest Thesiger,アーネスト・セジガー
Christopher Cazenove,クリストファー・カジノブ
Kit Symons,キット・シモンズ
Duff Cooper,ダフ・クーパー
Robert Skidelsky,ロバート・スキデルスキー
"Alistair Vane-Tempest-Stewart, 9th Marquess of Londonderry",アリスター・ヴェーン＝テンペスト＝ステュアート (第9代ロンドンデリー侯爵)
Amanda Donohoe,アマンダ・ドノホー
Charles Walker,チャールズ・ウォーカー
Mo Mowlam,モ・モウラム
Hilary Benn,ヒラリー・ベン
Richard Roberts,リチャード・ロバーツ
Roland Joffé,ローランド・ジョフィ
Kieran Richardson,キーラン・リチャードソン
Nedum Onuoha,ネダム・オヌオハ
Steve Davis,スティーブ・デイビス
Eliot Sumner,エリオット・サムナー
"Angus Douglas-Hamilton, 15th Duke of Hamilton",アンガス・ダグラス＝ハミルトン (第15代ハミルトン公爵)
Bill Deedes,ビル・ディーディス
Peter Thomas Bauer,ピーター・バウアー
Thomas Lewis,トーマス・ルイス
Martin Rees,マーティン・リース
"Herbert Samuel, 1st Viscount Samuel",ハーバート・サミュエル
"Edmund Ironside, 1st Baron Ironside",エドムンド・アイアンサイド
David Bentley,デヴィッド・ベントリー
Alan Ball Jr.,アラン・ボール・ジュニア
"Nicholas Stern, Baron Stern of Brentford",ニコラス・スターン
"John Lytton, 5th Earl of Lytton",ジョン・リットン
George Carey,ジョージ・ケアリー
Graham Hutchings,グラハム・ハッチングス
Evelyn Beatrice Hall,エヴリン・ベアトリス・ホール
Ben Barnes,ベン・バーンズ
Skandar Keynes,スキャンダー・ケインズ
Naomi Campbell,ナオミ・キャンベル
Rotha Lintorn-Orman,ロウサ・リントーン＝オーマン
J. Rendel Harris,J・レンデル・ハリス
Fortune Gordien,フォーチュン・ゴーディエン
Henry Fuseli,ヨハン・ハインリヒ・フュースリー
Charles Shaughnessy,チャールズ・ショーネシー
Benny Hill,ベニー・ヒル
John Hurt,ジョン・ハート
Dudley Moore,ダドリー・ムーア
Edmund Goulding,エドマンド・グールディング
Simon Davies,サイモン・デイヴィス
Glenn Hughes,グレン・ヒューズ
Kate Mosse,ケイト・モス (作家)
Louise Lombard,ルイーズ・ロンバード
Tilda Swinton,ティルダ・スウィントン
David Hemmings,デヴィッド・ヘミングス
Phil Wilson,フィル・ウィルソン
Harold Shipman,ハロルド・シップマン
James Taylor,ジェームス・テイラー
Robert Runcie,ロバート・ランシー
"Edward George, Baron George",エドワード・ジョージ
Geoffrey Fisher,ジョフリー・フィッシャー
"Maurice Hankey, 1st Baron Hankey",モーリス・ハンキー (初代ハンキー男爵)
Robert Fisk,ロバート・フィスク
Robin Walker,ロビン・ウォーカー
Jack Davenport,ジャック・ダヴェンポート
Ray Winstone,レイ・ウィンストン
David Fletcher,デビッド・フレッチャー
David Johnson,デヴィッド・ジョンソン
Richard Francis Burton,リチャード・フランシス・バートン
Christopher Isherwood,クリストファー・イシャーウッド
A. L. Rowse,A・L・ラウス
"William Morris, 1st Viscount Nuffield",ウィリアム・モリス
David Puttnam,デヴィッド・パットナム
Michael Bond,マイケル・ボンド
John M. Pollard,ジョン・ポラード
Bernard Hill,バーナード・ヒル
Brendan Rodgers,ブレンダン・ロジャーズ
Billy Williams,ビリー・ウィリアムズ
Jane Seymour,ジェーン・シーモア
Ben Wallace,ベン・ウォレス
Alain de Botton,アラン・ド・ボトン
Robert Graves,ロバート・グレーヴス
Martin Amis,マーティン・エイミス
"Charles Guthrie, Baron Guthrie of Craigiebank",チャールズ・ガスリー (ガスリー男爵)
Colin McRae,コリン・マクレー
"Hugh Dowding, 1st Baron Dowding",ヒュー・ダウディング
John Bercow,ジョン・バーコウ
Alan Baker,アラン・ベイカー
Francis Crick,フランシス・クリック
Peter Woodthorpe,ピーター・ウッドソープ
Philip Glenister,フィリップ・グレニスター
Joan Armatrading,ジョーン・アーマトレイディング
Robert Green,ロバート・グリーン
Gustav Holst,グスターヴ・ホルスト
Dolly Martin,ドリー・リード
Paul Jones,ポール・ジョーンズ
Prince Sadruddin Aga Khan,サドルッディーン・アーガー・ハーン
Clive Brittain,クライヴ・ブリテン
Thomas Cranmer,トマス・クランマー
"Antony Armstrong-Jones, 1st Earl of Snowdon",アンソニー・アームストロング＝ジョーンズ
"George Villiers, 4th Earl of Clarendon",ジョージ・ヴィリアーズ
"William Morrison, 1st Viscount Dunrossil",ウィリアム・モリソン (初代ダンロッシル子爵)
Karl Pearson,カール・ピアソン
Stephen Wolfram,スティーブン・ウルフラム
Jessica Brown Findlay,ジェシカ・ブラウン・フィンドレイ
Jake Scott,ジェイク・スコット
Scott Quigg,スコット・クィッグ
Michael Caine,マイケル・ケイン
Leslie Hore-Belisha,レズリー・ホア＝ベリシャ
Alan McInally,アラン・マキナリー
Matthew Wilson,マシュー・ウィルソン
"David Cunliffe-Lister, 2nd Earl of Swinton",デイヴィッド・カンリフ＝リスター
"John Astor, 3rd Baron Astor of Hever",ジョン・ジェイコブ・アスター
"Gerald Gardiner, Baron Gardiner",ジェラルド・ガーディナー (ガーディナー男爵)
"Hugh FitzRoy, 11th Duke of Grafton",ヒュー・フィッツロイ (第11代グラフトン公)
Danny Blanchflower,ダニー・ブランチフラワー
Kevin McNally,ケヴィン・マクナリー
Gloria Holden,グロリア・ホールデン
Helen Shapiro,ヘレン・シャピロ
Mary Rand,マリー・ランド
"Ian Russell, 13th Duke of Bedford",イアン・ラッセル (第13代ベッドフォード公)
"Thomas Galbraith, 2nd Baron Strathclyde",トマス・ガルブレイス
"Hector Monro, Baron Monro of Langholm",ヘクター・モンロー
"Rudolph Lambart, 10th Earl of Cavan",第10代キャバン伯ルドルフ・ランバート
"Frances D'Souza, Baroness D'Souza",フランセス・デ・スーザ
Robert Winston,ロバート・ウィンストン
Michael Ashcroft,マイケル・アシュクロフト
"Richard Vincent, Baron Vincent of Coleshill",リチャード・ヴィンセント (ヴィンセント・オブ・コールシル男爵)
"Oliver Russell, 2nd Baron Ampthill",オリヴァー・ラッセル (第2代アムトヒル男爵)
"Hugh Cavendish, Baron Cavendish of Furness",ヒュー・キャヴェンディッシュ
Caroline Goodall,キャロライン・グッドール
Robin Harper,ロビン・ハーパー
John Davis,ジョン・デイヴィス
Roger Daltrey,ロジャー・ダルトリー
James McFadden,ジェームズ・マクファデン
Don Airey,ドン・エイリー
"William Ward, 2nd Earl of Dudley",ウィリアム・ハンブル・ワード (第2代ダドリー伯爵)
Ralph Brown,ラルフ・ブラウン
Jimmy Armfield,ジミー・アームフィールド
Charles Williams,チャールズ・ウィリアムズ
Titus Bramble,タイタス・ブランブル
Nicholas Courtney,ニコラス・コートニー
John Marshall,ジョン・マーシャル (ドラマー)
John Dee,ジョン・ディー
Paul Beresford,ポール・ベレスフォード
Luciana Berger,ルシアナ・バーガー
Jake Berry,ジェイク・ベリー
John Gilling,ジョン・ギリング
Peter Hammond,ピーター・ハモンド
"Robert Shirley, 13th Earl Ferrers",ロバート・シャーリー
"Guy Innes-Ker, 10th Duke of Roxburghe",ガイ・イニス＝カー (第10代ロックスバラ公爵)
"Michael Boyce, Baron Boyce",マイケル・ボイス
Hugh Griffith,ヒュー・グリフィス
"Charles Douglas, 3rd Duke of Queensberry",チャールズ・ダグラス (第3代クイーンズベリー公爵)
"Edwin Bramall, Baron Bramall",エドウィン・ブラモール
"Frederick Gordon-Lennox, 9th Duke of Richmond",フレデリック・ゴードン＝レノックス (第9代リッチモンド公爵)
"Arthur Foljambe, 2nd Earl of Liverpool",アーサー・フォジャム (第2代リヴァプール伯爵)
Joan Walley,ジョアン・ウォーリー
"Clementine Churchill, Baroness Spencer-Churchill",クレメンタイン・チャーチル
Steve Webster,スティーブ・ウェブスター
Geezer Butler,ギーザー・バトラー
David Bohm,デヴィッド・ボーム
"Charles Gordon-Lennox, 8th Duke of Richmond",チャールズ・ゴードン＝レノックス (第8代リッチモンド公爵)
"David Triesman, Baron Triesman",デヴィッド・トライズマン
Beeban Kidron,ビーバン・キドロン
"John Ganzoni, 2nd Baron Belstead",ジョン・ガンゾニー
Philip Chetwode,フィリップ・チェットゥッド
"Greville Howard, Baron Howard of Rising",グレヴィル・ハワード
Jamie Lidell,ジェイミー・リデル
Derek Johnson,デレク・ジョンソン
Dido,ダイド
Peter Foldes,ピーター・フォルデス
Ian Holloway,イアン・ホロウェイ
Kevin Davies,ケヴィン・デイヴィス
Charlie Adam,チャーリー・アダム
Holliday Grainger,ホリデイ・グレインジャー
Tom Watson,トム・ワトソン (労働党)
Mary McCartney,メアリー・マッカートニー
Benjamin Robins,ベンジャミン・ロビンズ
Herbert Morrison,モリソン
"John Spencer-Churchill, 11th Duke of Marlborough",ジョン・スペンサー＝チャーチル
"Julian Asquith, 2nd Earl of Oxford and Asquith",ジュリアン・アスキス (第2代オックスフォード＝アスキス伯爵)
Matthew Upson,マシュー・アップソン
"Frederick Lindemann, 1st Viscount Cherwell",フレデリック・リンデマン
"William Cavendish-Bentinck, 7th Duke of Portland",ウィリアム・キャヴェンディッシュ＝ベンティンク (第7代ポートランド公爵)
"John Birt, Baron Birt",ジョン・バート
"Robert Gascoyne-Cecil, 7th Marquess of Salisbury",ロバート・ガスコイン＝セシル
William Moseley,ウィリアム・モーズリー
Alexander Siddig,アレクサンダー・シディグ
"Patrick Boyle, 10th Earl of Glasgow",パトリック・ボイル
"Dominick Browne, 4th Baron Oranmore and Browne",ドミニク・ブラウン (第4代オレンモア＝ブラウン男爵)
"James Lindesay-Bethune, 16th Earl of Lindsay",ジェームズ・リンジー＝ベスーン (第16代リンジー伯爵)
"Michael Bowes-Lyon, 18th Earl of Strathmore and Kinghorne",マイケル・ボーズ＝ライアン
"Thomas Denman, 3rd Baron Denman",トマス・デンマン
Paul Ince,ポール・インス
Robin Cook,ロビン・クック
Jerry Desmonde,ジェリー・デズモンド
Leonard Trelawny Hobhouse,レナード・ホブハウス
George Shaw,ジョージ・ショー
Desmond Morris,デズモンド・モリス
David Blunkett,デイヴィッド・ブランケット
Stewart Downing,スチュワート・ダウニング
"John Harding, 1st Baron Harding of Petherton",ジョン・ハーディング (初代ハーディング・オブ・ザートン男爵)
Eric Laithwaite,エリック・レイスウェイト
Steve McClaren,スティーブ・マクラーレン
"Malcolm Sinclair, 20th Earl of Caithness",マルコム・シンクレア
"John Montagu, 11th Earl of Sandwich",ジョン・モンタギュー
"Willoughby Norrie, 1st Baron Norrie",ウィロビー・ノリー
William Walton,ウィリアム・ウォルトン
Jack Straw,ジャック・ストロー
Colin Jackson,コリン・ジャクソン
Alf Ramsey,アルフ・ラムゼイ
Nathan Delfouneso,ネイサン・デルフォンゾ
Marc Albrighton,マーク・オルブライトン
Roberta Blackman-Woods,ロバータ・ブラックマン＝ウッズ
Mark Lawrenson,マーク・ローレンソン
Nicola Blackwood,ニコラ・ブラックウッド
Simon Reynolds,サイモン・レイノルズ
"James Graham, 8th Duke of Montrose",ジェイムズ・グラハム (第8代モントローズ公爵)
"Valerie Amos, Baroness Amos",ヴァレリー・アモス
"Frederick Marquis, 1st Earl of Woolton",フレデリック・マーキス (初代ウールトン伯爵)
Anna Atkins,アンナ・アトキンス
Tony Iommi,トニー・アイオミ
George Mallory,ジョージ・マロリー
Dan Wheldon,ダン・ウェルドン
Kate Winslet,ケイト・ウィンスレット
Fraizer Campbell,フレイザー・キャンベル
Declan Galbraith,デクラン・ガルブレイス
Cary Elwes,ケイリー・エルウィス
Harold Ridley,リドレー
Alexander Munro,アレクサンダー・ムンロー
Arthur Darvill,アーサー・ダーヴィル
Drew McIntyre,ドリュー・マッキンタイア
Steven Taylor,スティーブン・テイラー
Davitt Moroney,デイヴィット・モロニー
Andrew Bingham,アンドリュー・ビンガム
Lara Pulver,ララ・パルヴァー
Jamie xx,ジェイミー・xx
"Michael Jay, Baron Jay of Ewelme",マイケル・ジェイ (ジェイ・オブ・ユーウェルム男爵)
"Charles Canning, 1st Earl Canning",チャールズ・カニング
Kevin Rowland,ケヴィン・ローランド
Edward Judd,エドワード・ジャッド
Paul Grice,ポール・グライス
Aga Khan IV,アーガー・ハーン4世
Alma Reville,アルマ・レヴィル
Robert Fripp,ロバート・フリップ
Gary Speed,ガリー・スピード
Morrissey,モリッシー
Joey Barton,ジョーイ・バートン
Arnold Wesker,アーノルド・ウェスカー
Jack Colback,ジャック・コルバック
Bernard Archard,バーナード・アーチャード
David Vaughan,デヴィッド・ヴォーン
Linda Thompson,リンダ・トンプソン
Tom Blenkinsop,トム・ブレンキンソップ
Heather Wheeler,ヒーザー・ウィーラー
Chris White,クリス・ホワイト
Peter Bone,ピーター・ボン
Greg Mansell,グレッグ・マンセル
"Robert Lindsay, 29th Earl of Crawford",ロバート・リンジー
Joan Aiken,ジョーン・エイケン
Pat Jennings,パット・ジェニングス
Timothy Garton Ash,ティモシー・ガートン・アッシュ
Flora Robson,フローラ・ロブソン
Mark Selby,マーク・セルビー
Pete Doherty,ピート・ドハーティ
Billy Bremner,ビリー・ブレムナー
"Michael Bishop, Baron Glendonbrook",マイケル・ビショップ
Duncan Sandys,ダンカン・サンディス
Mick Jagger,ミック・ジャガー
David Platt,デビッド・プラット
Ben Amos,ベン・エイモス
Les Ferdinand,レス・ファーディナンド
P. F. Strawson,ピーター・フレデリック・ストローソン
Brian Epstein,ブライアン・エプスタイン
"John Kerr, Baron Kerr of Kinlochard",ジョン・カー、キンロッカードのカー男爵
"John Spencer-Churchill, 10th Duke of Marlborough",ジョン・スペンサー=チャーチル
Jo Grimond,ジョー・グリモンド
Crispin Blunt,クリスピン・ブラント
James Herriot,ジェイムズ・ヘリオット
Mike Newell,マイク・ニューウェル
Steve Harper,スティーヴ・ハーパー
Alan Whitehead,アラン・ホワイトヘッド
Yamilé Aldama,ヤミレ・アルダマ
Ben Bradshaw,ベン・ブラッドショー
Wade Barrett,ウェイド・バレット
Boris Karloff,ボリス・カーロフ
Steve Brine,スティーブ・ブライン
James Brokenshire,ジェイムズ・ブロークンシャー
Karen Bradley,カレン・ブラッドリー
Tahesia Harrigan,タヘシア・ハリガン＝スコット
Julian Brazier,ジュリアン・ブレイジャー
Katherine Legge,キャサリン・レッグ
Eva Ibbotson,エヴァ・イボットソン
Domino Harvey,ドミノ・ハーヴィー
Graham Brady,グレアム・ブレイディ
John Whittingdale,ジョン・ウィッティングデール
Jade Goody,ジェイド・グッディ
Nonso Anozie,ノンソー・アノジー
Michael Gambon,マイケル・ガンボン
David Prowse,デビッド・プラウズ
Craig Gardner,クレイグ・ガードナー
Carl Robinson,カール・ロビンソン
Chris Ashton,クリス・アシュトン
Roy Hodgson,ロイ・ホジソン
Jim Herrick,ジム・ヘリック
James Gray,ジェームズ・グレイ
Edward Collingwood,エドワード・コーリングウッド
Paddy Barnes,パディ・バーンズ
Lauren Cohan,ローレン・コーハン
Connor Wickham,コナー・ウィッカム
Raheem Sterling,ラヒーム・スターリング
Hazel Blears,ヘーゼル・ブリアーズ
Cathleen Nesbitt,キャスリーン・ネスビット
Tom Brake,トム・ブレイク
Nigella Lawson,ナイジェラ・ローソン
David Hamilton,デイヴィッド・ハミルトン
Tim Roth,ティム・ロス
Christopher Greenwood,クリストファー・グリーンウッド
Susannah Harker,スザンナ・ハーカー
Mary Ure,メアリー・ユーア
Joe Loss,ジョー・ロス
Eileen Essell,アイリーン・エッセル
James McNeill Whistler,ジェームズ・マクニール・ホイッスラー
"Robin Dixon, 3rd Baron Glentoran",ロビン・ディクソン
"Frederick Dainton, Baron Dainton",フレデリック・ディントン
"Arnold McNair, 1st Baron McNair",アーノルド・マクネア
Mary Norton,メアリー・ノートン
Adam Hammill,アダム・ハミル
"Alan Brooke, 1st Viscount Alanbrooke",アラン・ブルック (初代アランブルック子爵)
John Louis Emil Dreyer,ジョン・ドレイヤー
Georgia Tennant,ジョージア・モフェット
Graham Greene,グレアム・グリーン
Theresa May,テリーザ・メイ
Leopold David de Rothschild,レオポルド・デーヴィッド・ド・ロスチャイルド
M.I.A.,M.I.A.
Barry Ferguson,バリー・ファーガソン
Bill Wiggin,ビル・ウィギン
"Timothy Beaumont, Baron Beaumont of Whitley",ティム・ビューモント
"Janet Young, Baroness Young",ジャネット・ヤング
"David Neuberger, Baron Neuberger of Abbotsbury",デイヴィッド・ニューバーガー (ニューバーガー男爵)
"Nat Wei, Baron Wei",ナット・ウェイ
Vince Clarke,ヴィンス・クラーク
Sean Hoare,ショーン・ホア
James Joll,ジェームズ・ジョル
"William Cavendish-Bentinck, 6th Duke of Portland",ウィリアム・キャヴェンディッシュ＝ベンティンク
Nick Brown,ニック・ブラウン
Craig Whittaker,クレイグ・ホイッテイカー
Geraldine McEwan,ジェラルディン・マキューアン
"Richard Kahn, Baron Kahn",リチャード・カーン
"Hallam Tennyson, 2nd Baron Tennyson",ハラム・テニソン (第2代テニソン男爵)
"John Hamilton-Gordon, 1st Marquess of Aberdeen and Temair",ジョン・ハミルトン＝ゴードン (初代アバディーン＝テメイア侯爵)
"Charles Hardinge, 1st Baron Hardinge of Penshurst",チャールズ・ハーディング
"Stephen Green, Baron Green of Hurstpierpoint",ステファン・グリーン
"Michael Brougham, 5th Baron Brougham and Vaux",マイケル・ブルーム
Bon Scott,ボン・スコット
Stuart Sutcliffe,スチュアート・サトクリフ
"Douglas Haig, 1st Earl Haig",ダグラス・ヘイグ
Clive Granger,クライヴ・グレンジャー
Angus Deaton,アンガス・ディートン
Matt Smith,マット・スミス
Stuart Holden,スチュアート・ホールデン
Asa Butterfield,エイサ・バターフィールド
Tony Judt,トニー・ジャット
Christopher Eccleston,クリストファー・エクルストン
"Arthur Gore, 9th Earl of Arran",アーサー・ゴア
"David Douglas-Home, 15th Earl of Home",デビッド・ダグラス＝ヒューム (第15代ヒューム伯爵)
"Nicholas Phillips, Baron Phillips of Worth Matravers",ニコラス・フィリップス
Katherine Parkinson,キャサリン・パーキンソン
Alice Keppel,アリス・ケッペル
"Janric Craig, 3rd Viscount Craigavon",ジャンリック・クレイグ
Moira Shearer,モイラ・シアラー
Manny Charlton,マニー・チャールトン
Christopher Kelk Ingold,クリストファー・ケルク・インゴルド
Herbert Ponting,ハーバート・ポンティング
Georg Solti,ゲオルク・ショルティ
Tom Hollander,トム・ホランダー
Kevin McKidd,ケヴィン・マクキッド
Onora O'Neill,オノラ・オニール
Wayne Rooney,ウェイン・ルーニー
Chris Bryant,クリス・ブライアント
Thomas Brodie-Sangster,トーマス・サングスター
Ian Kershaw,イアン・カーショー
John Charles,ジョン・チャールズ
Duncan James,ダンカン・ジェイムス
"Peter Inge, Baron Inge",ピーター・イング
"Nicolas Rea, 3rd Baron Rea",ジョン・ニコラス・リー
Frank Whittle,フランク・ホイットル
Jane Asher,ジェーン・アッシャー
George Forrest,ジョージ・フォレスト
"John Hunt, Baron Hunt",ジョン・ハント
"Edward Evans, 1st Baron Mountevans",エドワード・エヴァンズ (初代マウントエヴァンズ男爵)
Norman Tebbit,ノーマン・テビット
Sam Hutchinson,サム・ハッチンソン
David Yates,デヴィッド・イェーツ
Fred Perry,フレッド・ペリー
David Haye,デビッド・ヘイ
Susan Greenfield,スーザン・グリーンフィールド
Keith Vaz,キース・ヴァズ
Danny Gabbidon,ダニー・ガビドン
David Dunn,デヴィッド・ダン
Rick Wakeman,リック・ウェイクマン
Bill Wyman,ビル・ワイマン
John Turner,ジョン・ターナー
Diana Cooper,ダイアナ・クーパー
"Thomas Ashton, 1st Baron Ashton of Hyde",トマス・アシュトン (ハイドの初代アシュトン男爵)
Heather Mills,ヘザー・ミルズ
Fiona Bruce,フィオナ・ブルース
Claude Auchinleck,クルード・オーキンレック
Barbara Steele,バーバラ・スティール
Olivia d'Abo,オリヴィア・ダボ
"Frederick Lugard, 1st Baron Lugard",フレデリック・ルガード
"Rufus Isaacs, 1st Marquess of Reading",ルーファス・アイザックス
"Herbert Plumer, 1st Viscount Plumer",ハーバート・プルーマー
Daley Thompson,デイリー・トンプソン
Arthur Drewry,アーサー・ドルリー
Princess Helena Victoria of Schleswig-Holstein,ヘレナ・ヴィクトリア・オブ・シュレスウィグ＝ホルスタイン
Brian Jones,ブライアン・ジョーンズ
John Gielgud,ジョン・ギールグッド
Norman Haworth,ウォルター・ハース
Ian Blair,イアン・ブレア
Paul McGann,ポール・マッギャン
Shayne Ward,シェイン・ワード
Blake Aldridge,ブレイク・オルドリッジ
Malcolm Bruce,マルコム・ブルース
David Lodge,デイヴィッド・ロッジ
Annie Ross,アニー・ロス
Harold Wilson,ハロルド・ウィルソン
Curtis Davies,カーティス・デイヴィス
Nick Hornby,ニック・ホーンビィ
Alec Douglas-Home,アレック・ダグラス＝ヒューム
"David Young, Baron Young of Graffham",グラファム卿デビッド・ヤング
Harold Macmillan,ハロルド・マクミラン
Mark Strong,マーク・ストロング
Jeremy Browne,ジェレミー・ブラウン
David Willetts,デイヴィッド・ウィレッツ
Laura Fraser,ローラ・フレイザー
Edward Heath,エドワード・ヒース
Boy George,ボーイ・ジョージ
Mick Taylor,ミック・テイラー
Frederick Delius,フレデリック・ディーリアス
Iain Banks,イアン・バンクス
"Mark Malloch Brown, Baron Malloch-Brown",マーク・マロック・ブラウン
"Jack Cunningham, Baron Cunningham of Felling",ジャック・カニンガム
"Rodney Elton, 2nd Baron Elton",ロドニー・エルトン
"Conrad Russell, 5th Earl Russell",コンラッド・ラッセル (第5代ラッセル伯爵)
Isaiah Berlin,アイザイア・バーリン
Steve Howe,スティーヴ・ハウ
