Douglas Adams,ダグラス・アダムズ
Luther Blissett,ルーサー・ブリセット
John Barnes,ジョン・バーンズ
Robin Williams,ロビン・ウィリアムズ
Charles Samuel Franklin,チャールズ・サミュエル・フランクリン
Sarah Walker,サラ・ウォーカー
Danny Graham,ダニー・グレアム
Robert Page,ロブ・ページ
Clifford Edmund Bosworth,クリフォード・エドモンド・ボスワース
Henry Gray,ヘンリー・グレイ
Han Suyin,ハン・スーイン
Monty Python,モンティ・パイソン
Richard G. Morris,リチャード・G・モリス
Eddie Redmayne,エディ・レッドメイン
Hertha Ayrton,ハータ・エアトン
Adrian Mariappa,エイドリアン・マリアッパ
Tom Cleverley,トム・クレヴァリー
David Cameron,デーヴィッド・キャメロン
Jack Clayton,ジャック・クレイトン
Kate Bush,ケイト・ブッシュ
Patrick Stewart,パトリック・スチュワート
Aidy Boothroyd,アイディ・ブースロイド
"Queen Elizabeth, The Queen Mother",エリザベス・ボーズ＝ライアン
Mary Lee Woods,メアリー・リー・ウッズ
Sophie Wilson,ソフィー・ウィルソン
Kenny Jackett,ケニー・ジャケット
Ashley Young,アシュリー・ヤング
Ben Foster,ベン・フォスター
Tim Berners-Lee,ティム・バーナーズ＝リー
Charles K. Kao,チャールズ・カオ
David Mitchell,デイヴィッド・ミッチェル
Alex Salmond,アレックス・サモンド
Marvin Sordell,マーヴィン・ソーデル
Doris Lessing,ドリス・レッシング
Marcus Gayle,マーカス・ゲイル
Stephen Hawking,スティーヴン・ホーキング
David James,ディビッド・ジェームス
Jimmy Wales,ジミー・ウェールズ
Gavin Mahon,ギャヴィン・マホン
Virginia Woolf,ヴァージニア・ウルフ
Gordon Brown,ゴードン・ブラウン
Kieran Gibbs,キーラン・ギブス
Harold Pinter,ハロルド・ピンター
Hans Wilsdorf,ハンス・ヴィルスドルフ
Frank Lloyd,フランク・ロイド
Scott Adkins,スコット・アドキンス
Nicky Hopkins,ニッキー・ホプキンス
Ralph Fiennes,レイフ・ファインズ
Carrie Lam,林鄭月娥
Charlie Chaplin,チャールズ・チャップリン
James DeGale,ジェームス・デゲール
Tom Ince,トム・インス
Arthur Balfour,アーサー・バルフォア
J. R. R. Tolkien,J・R・R・トールキン
Simon Wells,サイモン・ウェルズ
Neville Chamberlain,ネヴィル・チェンバレン
Ian Porterfield,イアン・ポーターフィールド
Charles Oman,チャールズ・オマーン
Sacha Baron Cohen,サシャ・バロン・コーエン
Fitz Hall,フィッツ・ホール
Leanne Wood,リアーン・ウッド
Lee Hodson,リー・ホドソン
Sean Dyche,ショーン・ダイチェ
Ray Lewington,レイ・レウィントン
Lonnie Donegan,ロニー・ドネガン
Judi Dench,ジュディ・デンチ
Timothy Dalton,ティモシー・ダルトン
Scott Loach,スコット・ローチ
Nyron Nosworthy,ナイロン・ノスワーシー
Frank Lampard,フランク・ランパード
John Rhys-Davies,ジョン・リス＝デイヴィス
Jessie J,ジェシー・J
Frederick Keeping,フレドリック・キーピング
Arthur Percival,アーサー・パーシバル
Keira Knightley,キーラ・ナイトレイ
Troy Deeney,トロイ・ディーニー
John Eustace,ジョン・ユースタス
Jonathan Hogg,ジョナサン・ホッグ
Adam Miller,アダム・ミラー
Alesha Dixon,アレシャ・ディクソン
John Campbell,ジョン・キャンベル
Michael Johnson,マイケル・ジョンソン
Sean Murray,ショーン・マレー
Ikechi Anya,イケチ・アンヤ
Michael Carrick,マイケル・キャリック
Chris Iwelumo,クリス・イウェルモ
Victoria Drummond,ヴィクトリア・ドラモンド
Louise Johnson,ルイーズ・ジョンソン
Rupert Grint,ルパート・グリント
James Key,ジェームス・キー
Chris Smalling,クリス・スモーリング
Jonny Evans,ジョニー・エヴァンズ
Audrey Hepburn,オードリー・ヘプバーン
George Bernard Shaw,ジョージ・バーナード・ショー
Steph Houghton,ステフ・ホートン
Laura Bassett,ラウーラ・バセット
Ricky Gervais,リッキー・ジャーヴェイス
Carl Jenkinson,カール・ジェンキンソン
Theo Walcott,セオ・ウォルコット
Robert Grabarz,ロバート・グラバーズ
Jill Scott,ジル・スコット
Anita Asante,アニータ・アサンテ
Eniola Aluko,エニオラ・アルコ
John Lennon,ジョン・レノン
Sergey Kapitsa,セルゲイ・カピッツァ
Luigi Cherubini,ルイジ・ケルビーニ
Delia Derbyshire,デリア・ダービーシャー
Helen Porter,ヘレン・ポーター
"David Cecil, 6th Marquess of Exeter",デヴィッド・バーリー
Peter Lilley,ピーター・リリー
Geri Horner,ジェリ・ハリウェル
John Farnham,ジョン・ファーナム
Desmond Llewelyn,デスモンド・リュウェリン
J. Horace Round,ジョン・ホレス・ラウンド
Karl Henry,カール・ヘンリー
Alun Michael,アラン・マイケル
Hope Powell,ホープ・パウエル
Casey Stoney,ケイシー・ストーニー
Jean Shrimpton,ジーン・シュリンプトン
James Hilton,ジェームズ・ヒルトン
Kenny Miller,ケニー・ミラー
Robert Louis Stevenson,ロバート・ルイス・スティーヴンソン
Angus Young,アンガス・ヤング
Kathleen Booth,キャスリーン・ブース
H. G. Wells,ハーバート・ジョージ・ウェルズ
John Pritchard,ジョン・プリッチャード
Mo Farah,モハメド・ファラー
Greg Rutherford,グレッグ・ラザフォード
John Francis,ジョン・フランシス
George Edward Luckman Gauntlett,エドワード・ガントレット
Terri Attwood,テリー・アトウッド
Wendy Hall,ウェンディ・ホール
Hugo Weaving,ヒューゴ・ウィーヴィング
Adele,アデル
Kim Wilde,キム・ワイルド
Nathaniel Chalobah,ナサニエル・チャロバー
Gabby Logan,ガビー・ローガン
Ellie Goulding,エリー・ゴールディング
Sophie Bradley-Auckland,ソフィー・ブラッドリー
Claire Rafferty,クレア・ラファティ
Jack the Ripper,切り裂きジャック
Chris Patten,クリストファー・パッテン
Doctor P,Doctor P
Marlon Roudette,マーロン・ルーデット
Helene Hayman,ヘレン・ヘイマン
Robert Arnott Wilson,ロバート・アーノット・ウィルソン
Mike Hawthorn,マイク・ホーソーン
Rachel Brown,レイチェル・ブラウン
Richard Dawkins,リチャード・ドーキンス
Charles III of the United Kingdom,チャールズ3世
Mark Millar,マーク・ミラー
George Mikes,ジョージ・ミケシュ
Victoria Beckham,ヴィクトリア・ベッカム
Matthew Vaughn,マシュー・ヴォーン
Faye White,フェイ・ホワイト
Katie Chapman,ケイティ・チャップマン
Alan Davie,アラン・デイヴィー
William Golding,ウィリアム・ゴールディング
Rachel Yankey,レイチェル・ヤンキー
Stephen Merchant,スティーヴン・マーチャント
Clive Sinclair,クライヴ・シンクレア
Rowan Atkinson,ローワン・アトキンソン
"Arthur Nicolson, 1st Baron Carnock",アーサー・ニコルソン
"Herbrand Russell, 11th Duke of Bedford",ハーブランド・ラッセル (第11代ベッドフォード公)
Anne V. Coates,アン・V・コーツ
Martyn Lloyd-Jones,マーティン・ロイドジョンズ
Roshan Seth,ロシャン・セス
Orlando Bloom,オーランド・ブルーム
Gladwyn Jebb,ヒューバート・マイルズ・グラッドウィン・ジェブ
Friedrich Hayek,フリードリヒ・ハイエク
Terry Gilliam,テリー・ギリアム
Paul Gascoigne,ポール・ガスコイン
David Broome,デビッド・ブルーム
Gabrielle Aplin,ガブリエル・アプリン
Ivo Lapenna,イヴォ・ラペンナー
"Robert Baden-Powell, 1st Baron Baden-Powell",ロバート・ベーデン＝パウエル
Toni Duggan,トニ・ダガン
Stanley Kubrick,スタンリー・キューブリック
Ryan Fraser,ライアン・フレイザー
V. S. Naipaul,V・S・ナイポール
Fara Williams,ファラ・ウィリアムズ
Karen Carney,カレン・カーニー
Amy Johnson,エミー・ジョンソン
Salman Rushdie,サルマン・ラシュディ
Ellen White,エレン・トニ・ホワイト
Rachel Williams,レイチェル・ウィリアムズ
Ebenezer Howard,エベネザー・ハワード
Jane Goldman,ジェーン・ゴールドマン
Keith Campbell,キース・キャンベル (生物学者)
Slash,スラッシュ
Uri Geller,ユリ・ゲラー
Fit Finlay,デイブ・フィンレー
Lance Tingay,ランス・ティンゲイ
William Auld,ウィリアム・オールド
John C. Wells,ジョン・C・ウェルズ
Mark Rocco,マーク・ロコ
Kylie Minogue,カイリー・ミノーグ
Alex Harvey,アレックス・ハーヴィー
Dave Taylor,デビッド・テイラー
Bertrand Russell,バートランド・ラッセル
Reginald Campbell,レジナルド・キャンベル
Graham Chapman,グレアム・チャップマン
George William Gray,ジョージ・ウィリアム・グレイ
Alan Carr,アラン・カー
Michael Hunter,マイケル・ハンター
Monie Love,モニー・ラヴ
John Barrowman,ジョン・バロウマン
Paul McCartney,ポール・マッカートニー
Roald Dahl,ロアルド・ダール
Ken Johnson,ケン・ジョンソン
Digby Jones,ディグビー・ジョーンズ
Patrick Jenkin,パトリック・ジェンキン (ジェンキン・オブ・ローディング男爵)
Alex Ferguson,アレックス・ファーガソン
Karen Spärck Jones,カレン・スパーク・ジョーンズ
Cozy Powell,コージー・パウエル
Eric Burdon,エリック・バードン
Ringo Starr,リンゴ・スター
Robin Janvrin,ロビン・ジャンブリン (ジャンブリン男爵)
Richard Meinertzhagen,リチャード・マイナーツハーゲン
Lesley Garrett,レスリー・ギャレット
Lyndsey Marshal,リンゼイ・マーシャル
John McAfee,ジョン・マカフィー
Michael Cates,マイケル・ケイツ
Amy Winehouse,エイミー・ワインハウス
Colin Crouch,コリン・クラウチ
Acker Bilk,アッカー・ビルク
J. K. Rowling,J・K・ローリング
Mike Oldfield,マイク・オールドフィールド
Geoffrey Dear,ジョフリー・ディア
Aaron Taylor-Johnson,アーロン・ジョンソン
Chris Hull,クリス・ハル
Paul Scholes,ポール・スコールズ
John Cleese,ジョン・クリーズ
John Surtees,ジョン・サーティース
Jackie Stewart,ジャッキー・スチュワート
George Harrison,ジョージ・ハリスン
Graham Hill,グラハム・ヒル
Alicia Rhodes,アリシア・ロードス
Eddie Marsan,エディ・マーサン
Andrew Garfield,アンドリュー・ガーフィールド
Robert Cecil,ロバート・セシル
Elizabeth Taylor,エリザベス・テイラー
Brian May,ブライアン・メイ
Elton John,エルトン・ジョン
Arthur Conan Doyle,アーサー・コナン・ドイル
Jim Clark,ジム・クラーク
Brian Cox,ブライアン・コックス
Steven Caulker,スティーヴン・コーカー
Hugh Dalton,ヒュー・ダルトン
Jack Wilshere,ジャック・ウィルシャー
Frances Fisher,フランシス・フィッシャー
Tinie Tempah,タイニー・テンパー
Myleene Klass,マイリーン・クラス
Labrinth,ラブリンス
Sara Gomer,サラ・ゴーマー
Marcus Mumford,マーカス・マムフォード
Ernest Cox,アーネスト・コックス
Claire Booth,クレア・ウィンザー
Paul Johnson,ポール・ジョンソン
Gordon Ramsay,ゴードン・ラムゼイ
Archer John Porter Martin,アーチャー・マーティン
Christian Bale,クリスチャン・ベール
T. S. Eliot,T・S・エリオット
Alvin Lee,アルヴィン・リー
Denis Thatcher,デニス・サッチャー
Richard Attwood,リチャード・アトウッド
Lance Macklin,ランス・マックリン
Tony Rolt,トニー・ロルト
W. D. Hamilton,ウィリアム・ドナルド・ハミルトン
Agatha Christie,アガサ・クリスティ
Jocky Wilson,ジョッキー・ウィルソン
Bill Tarmey,ビル・ターミー
Terry Pratchett,テリー・プラチェット
Matthew Kneale,マシュー・ニール
Margaret Wycherly,マーガレット・ワイチャーリイ
Rudyard Kipling,ラドヤード・キップリング
Daniel Tammet,ダニエル・タメット
Humphrey Tonkin,ハンフリー・トンキン
Robert Pattinson,ロバート・パティンソン
Rowan Williams,ローワン・ウィリアムズ
Peter Brook,ピーター・ブルック
Richard Laurence Millington Synge,リチャード・シング
Roy Budd,ロイ・バッド
Clive Dunn,クライヴ・ダン
Sean Connery,ショーン・コネリー
Freddie Mercury,フレディ・マーキュリー
"William, Prince of Wales",ウィリアム
Charles Hesterman Merz,チャールズ・マーズ
Christopher Nolan,クリストファー・ノーラン
Amy Macdonald,エイミー・マクドナルド
Cyril Norman Hinshelwood,シリル・ヒンシェルウッド
Bernard Katz,ベルンハルト・カッツ
Shaun Maloney,ショーン・マロニー
Daniel Craig,ダニエル・クレイグ
Hannah Harper,ハンナ・ハーパー
Jack Hawkins,ジャック・ホーキンス
Roger Taylor,ロジャー・テイラー
John Cale,ジョン・ケイル
Hugh Laurie,ヒュー・ローリー
Steven Weisberg,スティーヴン・ワイズバーグ
Robert Bolt,ロバート・ボルト
Chris Wood,クリス・ウッド
Mervyn Peake,マーヴィン・ピーク
Dorothy M. Needham,ドロシー・ニーダム
Calum Chambers,カラム・チェンバース
Gaël Bigirimana,ガエル・ビギリマナ
Justin Welby,ジャスティン・ウェルビー
Charlie Pace,チャーリー・ペース
Charlotte Lewis,シャーロット・ルイス
Charles Widmore,チャールズ・ウィドモア
Arthur C. Clarke,アーサー・C・クラーク
Jamie Carragher,ジェイミー・キャラガー
Stanley Bacon,スタンリー・ベーコン
Graeme Sharp,グレアム・シャープ
Alfred Hitchcock,アルフレッド・ヒッチコック
Tim Curry,ティム・カリー
Eric Hobsbawm,エリック・ホブズボーム
Justin Chadwick,ジャスティン・チャドウィック
Richard Barbieri,リチャード・バルビエリ
Clarence Kingsbury,クラレンス・キングスバリー
Ernest Payne,アーネスト・ペイン
Steven Runciman,スティーヴン・ランシマン
Jimmy Stewart,ジミー・スチュアート
Tiff Needell,ティフ・ニーデル
D. H. Lawrence,デーヴィッド・ハーバート・ローレンス
Christopher Hitchens,クリストファー・ヒッチンス
Chris Craft,クリス・クラフト
Joe Fry,ジョー・フライ
Jonathan Williams,ジョナサン・ウィリアムズ
Robin Widdows,ロビン・ウィドウズ
Peter Westbury,ピーター・ウェストバリー
Jackie Lewis,ジャッキー・ルイス
Alan Rees,アラン・リース
John Nettles,ジョン・ネトルズ
Mike Taylor,マイク・テイラー （レーシングドライバー）
Alan Turing,アラン・チューリング
Ken Wharton,ケン・ウォートン
Robert Robinson,ロバート・ロビンソン
Ian Heilbron,イアン・ヒールブロン
Vic Wilson,ヴィック・ウィルソン
Eric Brandon,エリック・ブランドン
George Orwell,ジョージ・オーウェル
Chris Lawrence,クリス・ローレンス
John Madden,ジョン・マッデン
Nicolas Roeg,ニコラス・ローグ
Pete Townshend,ピート・タウンゼント
Edmund Dulac,エドマンド・デュラック
David Bowie,デヴィッド・ボウイ
"Harold Alexander, 1st Earl Alexander of Tunis",ハロルド・アレグザンダー
Ian Dunbar,イアン・ダンバー
Margaret Thatcher,マーガレット・サッチャー
Matthew Pinsent,マシュー・ピンセント
Alexander Fleming,アレクサンダー・フレミング
Emma Watson,エマ・ワトソン
J. J. Thomson,ジョゼフ・ジョン・トムソン
Anne Anderson,アン・アンダーソン
Henry McMahon,ヘンリー・マクマホン
"Mary Russell, Duchess of Bedford",メアリー・ラッセル (ベッドフォード公爵夫人)
Daphne Oram,ダフネ・オラム
Dorothée Pullinger,ドロテ・プーリンガー
Rebecca Adlington,レベッカ・アドリントン
Daniel Radcliffe,ダニエル・ラドクリフ
Ed Sheeran,エド・シーラン
"Hastings Russell, 12th Duke of Bedford",ヘイスティングス・ラッセル (第12代ベッドフォード公)
Elsie Widdowson,エルシー・ウィドウソン
Rosalind Franklin,ロザリンド・フランクリン
Kathleen Lonsdale,キャスリーン・ロンズデール
Jonny Lee Miller,ジョニー・リー・ミラー
Toby Stephens,トビー・スティーブンス
Emeric Pressburger,エメリック・プレスバーガー
Michael Powell,マイケル・パウエル
Alexander Korda,アレクサンダー・コルダ
Jonathan Ross,ジョナサン・ロス
Gary Lineker,ゲイリー・リネカー
Nicola Pellow,ニコラ・ペロー
Claire Forlani,クレア・フォーラニ
Darren Fletcher,ダレン・フレッチャー
Colin Davis,コリン・デービス
Catherine Zeta-Jones,キャサリン・ゼタ＝ジョーンズ
Maggie Smith,マギー・スミス
Willoughby Hamilton,ウィロビー・ハミルトン
Alan Cox,アラン・コックス
Paul Dirac,ポール・ディラック
Tony Richardson,トニー・リチャードソン
Steve Redgrave,スティーヴ・レッドグレーヴ
Stephen Frears,スティーヴン・フリアーズ
David Lean,デヴィッド・リーン
Lisa Stansfield,リサ・スタンスフィールド
Barbara Cartland,バーバラ・カートランド
John Riseley-Prichard,ジョン・リズリー＝プリチャード
Tim Parnell,ティム・パーネル
Richard Attenborough,リチャード・アッテンボロー
John Chadwick,ジョン・チャドウィック
Claire Tomalin,クレア・トマリン
Mike Cowlishaw,マイク・カウリショウ
Oliver James,オリヴァー・ジェームズ
Agnes Baden-Powell,アグネス・ベーデン＝パウエル
Stephen Booth,スティーヴン・ブース
"Andrew Cunningham, 1st Viscount Cunningham of Hyndhope",アンドルー・カニンガム (初代カニンガム・オヴ・ハインドホープ子爵)
C. S. Lewis,C・S・ルイス
Mo Hayder,モー・ヘイダー
Daniel Fathers,ダニエル・ファーザーズ
Kate Richardson-Walsh,ケイト・ウォルシュ
Alvin Stardust,アルヴィン・スターダスト
Adam F,アダムF
Winston Churchill,ウィンストン・チャーチル
Sienna Guillory,シエンナ・ギロリー
John Schlesinger,ジョン・シュレシンジャー
Conor Maynard,コナー・メイナード
Melanie Brown,メラニー・ブラウン
Ken Loach,ケン・ローチ
Laurence Olivier,ローレンス・オリヴィエ
Tony Marsh,トニー・マーシュ
Aleister Crowley,アレイスター・クロウリー
Zaha Hadid,ザハ・ハディッド
Colin Chapman,コーリン・チャップマン
Peter Whitehead,ピーター・ホワイトヘッド
Tim Burke,ティム・バーク
James Prescott Joule,ジェームズ・プレスコット・ジュール
Ludwig Wittgenstein,ルートヴィヒ・ウィトゲンシュタイン
Dorothea Douglass,ドロテア・ダグラス・チェンバース
David Livingstone,デイヴィッド・リヴィングストン
Sid Vicious,シド・ヴィシャス
Richard Holmes,リチャード・ホームズ
Kenneth Branagh,ケネス・ブラナー
Marianne Faithfull,マリアンヌ・フェイスフル
Dorothy Round,ドロシー・ラウンド
John Boorman,ジョン・ブアマン
Peter Greenaway,ピーター・グリーナウェイ
Eric Broadley,エリック・ブロードレイ
Martin Brundle,マーティン・ブランドル
Bernie Ecclestone,バーニー・エクレストン
Robbie Williams,ロビー・ウィリアムズ
Laurence Irving,ローレンス・アイヴィング
Tanita Tikaram,タニタ・ティカラム
Christine Ohuruogu,クリスティーン・オールグー
Jessica Ennis-Hill,ジェシカ・エニス
Stirling Moss,スターリング・モス
Johnny Herbert,ジョニー・ハーバート
John Maynard Keynes,ジョン・メイナード・ケインズ
Lucy Griffiths,ルーシー・グリフィス (1986年生の女優)
Ken Russell,ケン・ラッセル
Syd Barrett,シド・バレット
Constance Tipper,コンスタンス・ティッパー
Desmond Titterington,デスモンド・ティッターリントン
David Coulthard,デビッド・クルサード
Tom Pryce,トム・プライス
Bat Ye'or,バート・ヨール
Dawn French,ドーン・フレンチ
"Sarah, Duchess of York",ヨーク公爵夫人セーラ
Desmond Hume,デズモンド・ヒューム
Daniel Faraday,ダニエル・ファラデー
Glen Matlock,グレン・マトロック
Allan McNish,アラン・マクニッシュ
Rupert Wyatt,ルパート・ワイアット
Chris Corbould,クリス・コーボールド
Nick Davis,ニック・デイヴィス
Charles Laughton,チャールズ・ロートン
Michael Collins,マイケル・コリンズ
Ben Kingsley,ベン・キングズレー
Pip Pirrup,ピップ・ピリップ
Gerald du Maurier,ジェラルド・ド・モーリエ
Hans Eysenck,ハンス・アイゼンク
A. Edward Sutherland,A・エドワード・サザーランド
Parminder Nagra,パーミンダ・ナーグラ
Keeley Hazell,キーリー・ヘーゼル
A. N. Sherwin-White,シャーウィン・ホワイト
A. C. Grayling,A・C・グレイリング
Ross Brawn,ロス・ブラウン
Mike Hailwood,マイク・ヘイルウッド
Graham Taylor,グレアム・テイラー
Salman Khan,サルマン・カーン
Eric Clapton,エリック・クラプトン
Peter Ustinov,ピーター・ユスティノフ
Władysław Raczkiewicz,ヴワディスワフ・ラチュキェヴィチ
Petula Clark,ペトゥラ・クラーク
Dorothy Hodgkin,ドロシー・ホジキン
Hugh Seymour Davies,ヒュー・シーモア・デーヴィス
Lily Loveless,リリー・ラヴレス
Alexa Chung,アレクサ・チャン
Teddy Sinclair,ナタリア・キルズ
Ron Dennis,ロン・デニス
James Callaghan,ジェームズ・キャラハン
Max Born,マックス・ボルン
Ridley Scott,リドリー・スコット
Kevin Ayers,ケヴィン・エアーズ
"Patrick Stopford, 9th Earl of Courtown",パトリック・ストップフォード
Katrina Kaiftulutulu,カトリーナ・カイフ
Elisabeth Schwarzkopf,エリーザベト・シュヴァルツコップ
Klaus Fuchs,クラウス・フックス
Mo Nunn,モー・ナン
Vic Elford,ヴィック・エルフォード
Max Mosley,マックス・モズレー
Ethel Smyth,エセル・スマイス
Sandy Denny,サンディ・デニー
Mimi Smith,ミミ・スミス
A. J. Quinnell,A・J・クィネル
Henry Porter,ヘンリー・ポーター
Sid Watkins,シド・ワトキンス
Kenny Acheson,ケニー・アッチソン
George Abecassis,ジョージ・アベカシス
Carol V. Robinson,キャロル・V・ロビンソン
Kelly Reilly,ケリー・ライリー
John Major,ジョン・メージャー
Caroline Lucas,キャロライン・ルーカス
Frank Williams,フランク・ウィリアムズ
Jock Clear,ジョック・クレア
Winifred Wagner,ヴィニフレート・ワーグナー
Ernst Chain,エルンスト・ボリス・チェーン
Philippa of Lancaster,フィリパ・デ・レンカストレ
Christiane Amanpour,クリスティアン・アマンプール
Natalie Dormer,ナタリー・ドーマー
Kelly Smith,ケリー・スミス
Radosław Sikorski,ラドスワフ・シコルスキ
Sebastian Haffner,セバスティアン・ハフナー
Marie of Romania,マリア
Mike Gascoyne,マイク・ガスコイン
Julian Bailey,ジュリアン・ベイリー
Innes Ireland,イネス・アイルランド
Rebecca West,レベッカ・ウェスト
"Katharine, Duchess of Kent",キャサリン
Susan Cooper,スーザン・クーパー
Steve Coast,スティーブ・コースト
Hans Krebs,ハンス・クレブス
"Diana, Princess of Wales",ダイアナ
Conrad Veidt,コンラート・ファイト
William Hague,ウィリアム・ヘイグ
Laura Robson,ローラ・ロブソン
Nigel Mansell,ナイジェル・マンセル
Edith Evans,イーディス・エヴァンス
Lily Allen,リリー・アレン
Heather Nova,ヘザー・ノヴァ
Florence Green,フローレンス・グリーン
David Beckham,デビッド・ベッカム
Andy Murray,アンディ・マレー
Martin Whitmarsh,マーティン・ウィットマーシュ
Adrian Newey,エイドリアン・ニューウェイ
Nick Wirth,ニック・ワース
Imogen Poots,イモージェン・プーツ
Barbara West,バーバラ・ウェスト
Elizabeth II,エリザベス2世
Damon Hill,デイモン・ヒル
Edith Hannam,エディット・ハンナム
Jenson Button,ジェンソン・バトン
Anthony Horowitz,アンソニー・ホロヴィッツ
"Doug Hoyle, Baron Hoyle",ダグ・ホイル
Lewis Hamilton,ルイス・ハミルトン
Danny Pugh,ダニー・ピュー
Arrow,アロー
Andros Townsend,アンドロス・タウンゼント
Adam Smith,アダム・スミス
Jane Horrocks,ジェーン・ホロックス
Sally Gunnell,サリー・ガネル
Tony Blair,トニー・ブレア
Amanda Holden,アマンダ・ホールデン
Kenny Morgans,ケン・モーガンス
Laura Marling,ローラ・マーリング
Diana Wynne Jones,ダイアナ・ウィン・ジョーンズ
A. L. Kennedy,A・L・ケネディ
A. O. L. Atkin,オリバー・アトキン
George Joseph Smith,ジョージ・ジョゼフ・スミス
Reg White,レグ・ホワイト
A. W. Watkins,A・W・ワトキンス
Amy Price-Francis,エイミー・プライス＝フランシス
Jack Greenwell,ジャック・グリーンウェル
Nathan Redmond,ネイサン・レドモンド
"Alexander Macmillan, 2nd Earl of Stockton",アレクサンダー・マクミラン (第2代ストックトン伯爵)
