Steve Rothery,スティーブ・ロザリー
Kevork Malikyan,ケヴォルク・マリキャン
Julie Girling,ジュリー・ガーリング
Emma Orczy,バロネス・オルツィ
Elisabeth Sladen,エリザベス・スレイドン
Walter Smith,ウォルター・スミス
Ally Kerr,アリー・カー
Robert Westall,ロバート・ウェストール
Chaz Jankel,チャズ・ジャンケル
Hannen Swaffer,ハンネン・スワッファー
Stanhope Forbes,スタンホープ・フォーブス
Paul Young,ポール・ヤング
Peter Reid,ピーター・リード
Anthony Asquith,アンソニー・アスキス
Jonathan Hyde,ジョナサン・ハイド
Daphne Walker,ダフネ・ウォーカー
Edward Craven Walker,エドワード・クレイヴン・ウォーカー
Ice MC,アイスMC
Kerry Ellis,ケリー・エリス
David Rintoul,デヴィッド・リントウル
David Walliams,デヴィッド・ウォリアムス
Henry Scott Tuke,ヘンリー・スコット・テューク
Peter Lorimer,ピーター・ロリマー
Jenny Agutter,ジェニー・アガター
Cecilia Payne Gaposchkin,セシリア・ペイン・ガポーシュキン
Emma Georgina Rothschild,エマ・ジョージナ・ロスチャイルド
Eros Vlahos,エロス・ヴラホス
Savannah Marshall,サバンナ・マーシャル
Andrew Latimer,アンディー・ラティマー
Samantha Fox,サマンサ・フォックス
Melita Norwood,メリタ・ノーウッド
Mary Tamm,メアリー・タム
Henry Thomas Buckle,ヘンリー・バックル
George Albert Boulenger,ジョージ・アルバート・ブーレンジャー
Catherine Schell,カトリーヌ・シェル
Princess Victoria of the United Kingdom,ヴィクトリア・アレクサンドラ
Romola Garai,ロモーラ・ガライ
Joe Mercer,ジョー・マーサー
David Weir,デヴィッド・ウィアー
Ruth Sheen,ルース・シーン
David Nash,デイヴィッド・ナッシュ
Richey Edwards,リッチー・ジェームス・エドワーズ
Neville Southall,ネヴィル・サウスオール
Robert Liddell,ロバート・リデル
Patricia Wentworth,パトリシア・ウェントワース
Marilyn Strathern,マリリン・ストラザーン
Jim Clark,ジム・クラーク
James Purefoy,ジェームズ・ピュアフォイ
Ingeborga Dapkūnaitė,インゲボルガ・ダクネイト
Joan Robinson,ジョーン・ロビンソン
Andrew Castle,アンドリュー・キャッスル
Annie Besant,アニー・ベサント
Kathryn Prescott,キャスリン・プレスコット
Rachel Hurd-Wood,レイチェル・ハード＝ウッド
Ivor Novello,アイヴァー・ノヴェロ
Thomas Derrick,デリック
Deep Roy,ディープ・ロイ
Ian McDonald,イアン・マクドナルド
Guru Josh,グール・ジョシュ
Susan Kay,スーザン・ケイ
Imelda Staunton,イメルダ・スタウントン
Fiona Fullerton,フィオナ・フラートン
Indira Varma,インディラ・ヴァルマ
Joanne Harris,ジョアン・ハリス
Teddy Sheringham,テディ・シェリンガム
Dakota Blue Richards,ダコタ・ブルー・リチャーズ
Maurice Denham,モーリス・デナム
Sarah Jayne Dunn,サラ・ジェーン・ダン
Chris Birchall,クリストファー・バーチャル
Colin Dowdeswell,コリン・ダウデスウェル
Judith Furse,ジュディス・ファース
Geoffrey Hutchings,ジョフリー・ハッチングス
Chris Martin,クリス・マーティン
Douglas Wilmer,ダグラス・ウィルマー
Sam Riley,サム・ライリー
Jack Watson,ジャック・ワトソン
Alfred East,アルフレッド・イースト
Jenny Beavan,ジェニー・ビーヴァン
Sophie Kinsella,ソフィー・キンセラ
Emilia Clarke,エミリア・クラーク
Kathy Kirby,キャシー・カービー
Ernest William Hobson,アーネスト・ウィリアム・ホブソン
Chris Dickens,クリス・ディケンズ
Jaye Davidson,ジェイ・デヴィッドソン
Hayley Atwell,ヘイリー・アトウェル
Craig Eastmond,クレイグ・イーストモンド
Hattie Morahan,ハティ・モラハン
Jack Cardiff,ジャック・カーディフ
Ben Elton,ベン・エルトン
Millvina Dean,ミルヴィナ・ディーン
Allan Wells,アラン・ウェルズ
George H. Bryan,ジョージ・ハートレイ・ブライアン
Mabel Collins,メイベル・コリンズ
Lucy Davis,ルーシー・デイヴィス
Kate Duchêne,ケイト・デュシェーヌ
Jo Durie,ジョー・デュリー
Charlotte Rampling,シャーロット・ランプリング
Owen Teale,オーウェン・ティール
Jaki Graham,ジャッキー・グラハム
Edmund Clifton Stoner,エフォモンド・クリフトン・ストナー
Jack Hildyard,ジャック・ヒルドヤード
Ambrose,アンブローズ
Audrey Sale-Barker,オードリー・セール＝バーカー
Simon Le Bon,サイモン・ル・ボン
Muriel Box,ミュリエル・ボックス
Paula Rego,ポーラ・レゴ
Mary Renault,メアリ・ルノー
Paula Yates,ポーラ・イェーツ
Alfred Fowler,アルフレッド・ファウラー
Vladislav Shoot,ヴラディスラフ・シューチ
Ellen Whitaker,エレン・ウィテカー
Michael Carreras,マイケル・カレラス
Shirley Bassey,シャーリー・バッシー
Maggie Cheung,張曼玉
Graeme Le Saux,グレアム・ル・ソー
Mick Ronson,ミック・ロンソン
Brian Ashton,ブライアン・アシュトン
Henry of England,ヘンリー (エドワード1世王子)
Moura Lympany,モーラ・リンパニー
Leon Kossoff,レオン・コゾフ
Lee Miller,リー・ミラー (サッカー選手)
Gary Windo,ゲイリー・ウィンド
Gladys Cooper,グラディス・クーパー
Patrick Macnee,パトリック・マクニー
Gavin Harrison,ギャヴィン・ハリソン
George S. Robertson,ジョージ・S・ロバートソン
Dave Ball,デイヴ・ボール
Harold Spencer Jones,ハロルド・スペンサー＝ジョーンズ
Hugh Evan-Thomas,ヒュー・エヴァン＝トーマス
Nicholas Hooper,ニコラス・フーパー
Scott Malone,スコット・マローン
Norman Smith,ノーマン・スミス
Atticus Ross,アッティカス・ロス
Gary Ablett,ガリー・アブレット
James Leslie Starkey,ジェームズ・L・スターキー
Jennifer Saunders,ジェニファー・サウンダーズ
Lily Cole,リリー・コール
Stella Rimington,ステラ・リミントン
Beryl Grey,ベリル・グレイ
Leanne Rowe,リアン・ロウ
John Henry Muirhead,ムーアヘッド
John E. Walker,ジョン・E・ウォーカー
Margaret Furse,マーガレット・ファーズ
Roger Whittaker,ロジャー・ウィテッカー
Jancis Robinson,ジャンシス・ロビンソン
David Snellgrove,デイヴィッド・スネルグローブ
Marthe Richard,マルト・リシャール
Jeeves,ジーヴス
Steve Woolgar,スティーヴ・ウールガー
Herbert Rawlinson,ハーバート・ローリンソン
David Cox,デイヴィッド・コックス
Noor Inayat Khan,ヌーア・イナヤット・カーン
Francesca Annis,フランチェスカ・アニス
William Kennedy Dickson,ウィリアム・K・L・ディクソン
Kelle Marie,ケリー・マリー
Colin Hendry,コリン・ヘンドリー
Joan Hickson,ジョーン・ヒクソン
Jung Chang,ユン・チアン
Euclides Zefanias Dumaculane,ダニエル・ベディングフィールド
Dave Kitson,デイヴ・キットソン
Phil Manzanera,フィル・マンザネラ
Hilary Mantel,ヒラリー・マンテル
Kevin Gallacher,ケヴィン・ギャラハー
Ewen Bremner,ユエン・ブレムナー
Derek Riggs,デレク・リッグス
Rob Lee,ロブ・リー
Diana Douglas,ダイアナ・ダグラス
Jasmine Sinclair,ジャスミン・シンクレア
Edgar Wright,エドガー・ライト
William Hartnell,ウィリアム・ハートネル
Bradley James,ブラッドリー・ジェームズ
Wendy Beckett,ウェンディー・ベケット
Beth Orton,ベス・オートン
Matthew Elias,マシュー・エリアス
Hannah England,ハンナ・イングランド
Sonia Lannaman,ソニア・ラナマン
André Morell,アンドレ・モレル
Arthur Wynne,アーサー・ウィン
"J. Arthur Rank, 1st Baron Rank",J・アーサー・ランク
Duncan Ferguson,ダンカン・ファーガソン
Hannah Taylor-Gordon,ハナ・テイラー・ゴードン
Sarah Burton,サラ・バートン
Steve Archibald,スティーブ・アーチボルド
Kelly Schafer,ケリー・シェーファー
Johnson Beharry,ジョンソン・ベハリー
Jhumpa Lahiri,ジュンパ・ラヒリ
Jared Harris,ジャレッド・ハリス
Terry Butcher,テリー・ブッチャー
Andrew C. Fabian,アンドルー・ファビアン
Leo Sayer,レオ・セイヤー
Julian Sands,ジュリアン・サンズ
James Gillray,ジェームズ・ギルレイ
Nigel Adkins,ナイジェル・アドキンス
Sean Biggerstaff,ショーン・ビガースタッフ
Lindsey Davis,リンゼイ・デイヴィス
Johann Hari,ヨハン・ハリ
Lili Kraus,リリー・クラウス
Mick Farren,ミック・ファーレン
Phil Neal,フィル・ニール
Trevor Steven,トレヴァー・スティーヴン
Karen David,カレン・デヴィッド
Afshan Azad,アフシャン・アザド
Jennifer Ehle,ジェニファー・イーリー
Ruth Prawer Jhabvala,ルース・プラワー・ジャブヴァーラ
Lady Caroline Lamb,キャロライン・ラム
Margaret Burbidge,マーガレット・バービッジ
Terry Chimes,テリー・チャイムズ
Jack E. Cox,ジャック・コックス
Róisín Murphy,ロウシーン・マーフィー
Princess Beatrice of Saxe-Coburg and Gotha,ベアトリス・オブ・サクス＝コバーグ＝ゴータ
Claire Bloom,クレア・ブルーム
Paul Cook,ポール・クック
David Warner,デビッド・ワーナー
Rik Mayall,リック・メイヨール
Becky Downie,レベッカ・ダウニー
Gordon Kennedy,ゴードン・ケネディ
Haig Oundjian,ヘイグ・アウンジャン
Michael Booker,マイケル・ブッカー
Vita Sackville-West,ヴィタ・サックヴィル＝ウェスト
"Princess Alice, Countess of Athlone",アリス・オブ・オールバニ
Nicholas Henderson,ニコラス・ヘンダースン
Terry Hayes,テリー・ヘイズ
Valerie Hobson,ヴァレリー・ホブソン
Anton Rodgers,アントン・ロジャース
Ian Richardson,イアン・リチャードソン
Caroline Bliss,キャロライン・ブリス
Sonia,ソニア
Ann Davison,アン・デイヴィソン
Luke Pasqualino,ルーク・パスカリーノ
Jane Ellen Harrison,ジェーン・エレン・ハリソン
Russell T Davies,ラッセル・T・デイヴィス
David Batty,デビッド・バッティ
Delroy Lindo,デルロイ・リンドー
Harold Lowe,ハロルド・ロウ
Anna Kingsford,アンナ・キングスフォード
Alma Cogan,アルマ・コーガン
Isaac Deutscher,アイザック・ドイッチャー
Ray Clemence,レイ・クレメンス
Graham Swift,グレアム・スウィフト
Matt Ryan,マット・ライアン
Ned Haig,ネッド・ヘイグ
John N. Gray,ジョン・グレイ
Patrick Doyle,パトリック・ドイル
Jessica Barden,ジェシカ・バーデン
Ernest William Brown,アーネスト・ウィリアム・ブラウン
Quentin Skinner,クェンティン・スキナー
Jo Walton,ジョー・ウォルトン
Paul Graham,ポール・グラハム
Nick Frost,ニック・フロスト
Simon Stephens,サイモン・スティーヴンス (脚本家)
Gordon Duncan,ゴードン・ダンカン
Rob Knox,ロブ・ノックス
Gwen Ffrangcon-Davies,グェン・フランコン＝デイヴィス
Philip Tartaglia,フィリップ・タータグリア
Geoffrey Rowell,ジェフリ・ローウェル
Joan Benham,ジョアン・ベンハム
Denys Page,デニス・ペイジ
Christopher Reid,クリストファー・リード
Alex Reid,アレックス・リード
John Keegan,ジョン・キーガン
Siegfried Sassoon,ジークフリード・サスーン
Danny Higginbotham,ダニー・ヒギンボザム
Compton Bennett,コンプトン・ベネット
Jon Walmsley,ジョン・ウォルムスリー
Anna Arrowsmith,アン・スパン
Shirley Strong,シャーリー・ストロング
Kelly Sotherton,ケリー・サザートン
John Clapham,クラッパム
Sami Yusuf,サミ・ユスフ
Ken Hensley,ケン・ヘンズレー
R. F. Delderfield,ロナルド・デルダーフィールド
Mary Elizabeth Braddon,メアリー・エリザベス・ブラッドン
Nigel Havers,ナイジェル・ヘイヴァース
Steven Waddington,スティーヴン・ウォディントン
Denys Lasdun,デニス・ラスダン
Debbie Wiseman,デビー・ワイズマン
Kitty Crowther,キティ・クローザー
Iain Turner,イアイン・ターナー
William Robertson,ウィリアム・ロバートソン
Mike Bailey,マイク・ベイリー
Al Stewart,アル・スチュアート
Ronald George Wreyford Norrish,ロナルド・ノーリッシュ
Miriam Karlin,ミリアム・カーリン
Owen Hargreaves,オーウェン・ハーグリーヴス
Peter Ebdon,ピーター・エブドン
Liz May Brice,リズ・メイ・ブライス
Bramwell Fletcher,ブラムウェル・フレッチャー
Daisy Burrell,デイジー・バレル
Charles Clifford,チャールズ・クリフォード
Darren Anderton,ダレン・アンダートン
Rolando patch,ハリー・パッチ
Daphne Arden,ダフネ・アーデン
Vic Lewis,ヴィック・ルイス
Julia Annas,ジュリア・アナス
Katherine Grainger,キャサリン・グレインジャー
Guy Hamilton,ガイ・ハミルトン
Frances Ruffelle,フランシス・ラッフェル
Serena Scott Thomas,セレナ・スコット・トーマス
James Meade,ジェイムズ・ミード
Kenny Clare,ケニー・クレア
Elkie Brooks,エルキー・ブルックス
Neil Murray,ニール・マーレイ
Stuart Urban,スチュアート・アーバン
Patrick French,パトリック・フレンチ
Mel Collins,メル・コリンズ
Richard Deacon,リチャード・ディーコン
David Usher,デイヴィッド・アッシャー (歌手)
Reginald Johnston,レジナルド・ジョンストン
Arthur Hind,アーサー・ハインド (実業家)
Thomas Abel Brimage Spratt,トーマス・エイベル・ブリメイジ・スプラット
Elihu Thomson,エリフ・トムソン
Sarah-Jane Potts,サラ＝ジェーン・ポッツ
Sebastian de Souza,セバスチャン・デ・ソウザ
Winifred Holtby,ウィニフレッド・ホルトビー
Emil Voigt,エミール・ボイト
Nicola Sturgeon,ニコラ・スタージョン
Robert T. A. Innes,ロバート・イネス
Andrew Knott,アンドリュー・ノット
Neil Paterson,ニール・パターソン
Geoffrey Burbidge,ジェフリー・バービッジ
Michael Balint,マイケル・バリント
Byron Webster,バイロン・ウェブスター
Josh Lewsey,ジョシュ・ルーシー
Johnston Forbes-Robertson,ジョンストン・フォーブズ＝ロバートソン
J. A. Todd,J. A. トッド
Tracey Thorn,トレイシー・ソーン
Bernard Sumner,バーナード・サムナー
Gillian Rose,ジリアン・ローズ
"Princess Maud, Countess of Southesk",モード
David Schneider,デヴィッド・シュナイダー
Leon Jackson,レオン・ジャクソン
Gordon Welchman,ゴードン・ウェルチマン
Peter Mayhew,ピーター・メイヒュー
Noel Streatfeild,ノエル・ストレトフィールド
James Nesbitt,ジェームズ・ネスビット
Neil Lennon,ニール・レノン
Steve Coppell,スティーヴ・コッペル
Chris Sutton,クリス・サットン
Dave Davies,デイヴ・デイヴィス
Alexander McCall Smith,アレグザンダー・マコール・スミス
Margery Sharp,マージェリー・シャープ
Sarah Storey,サラ・ストーリー
Jennifer Nicks,ジェニファー・ニックス
Marcus Bent,マーカス・ベント
Rick Davies,Richard（Rick) Davies
Roger Delgado,ロジャー・デルガード
Piers Morgan,ピアーズ・モーガン
Linton Kwesi Johnson,リントン・クウェシ・ジョンソン
David Murphy,デイヴィッド・マーフィー
Frank Brangwyn,フランク・ブラングィン
Jamie Hewlett,ジェイミー・ヒューレット
Alan White,アラン・ホワイト
Peter Sutcliffe,ピーター・サトクリフ
Lukas Jutkiewicz,ルーカス・ユトキエヴィッツ
Edward Hibbert,エドワード・ヒバート
Ruth Ellis,ルース・エリス
Julie Fowlis,ジュリー・ファウリス
Christine Grahame,クリスティン・グレアム
Cara Seymour,カーラ・シーモア
John Scott Haldane,ジョン・スコット・ホールデン
Jack Cork,ジャック・コーク
Christopher Neame,クリストファー・ニーム
Bruce Crawford,ブルース・クロフォード
Helen Troke,ヘレン・トローク
Betty Nuthall,ベティ・ナットール
Celia Imrie,セリア・イムリー
Barbara Burke,バーバラ・バーク
Piers Anthony,ピアズ・アンソニイ
Patrick Troughton,パトリック・トルートン
John Clive Ward,ジョン・クリーヴ・ウォード
Harry Colt,ハリー・コルト
Donald Ross,ドナルド・ロス
Henry Tonks,ヘンリー・トンクス
Harry Ellis,ハリー・エリス
Deborah Moore,デボラ・ムーア
Stephenie McMillan,ステファニー・マクミラン
Hugh Lofting,ヒュー・ロフティング
Katy Manning,ケイティ・マニング
Thomas Sydenham,トーマス・サイデンハム
Colin Davis,コリン・デイヴィス
Frank Bridge,フランク・ブリッジ
Beverly Kinch,ベバリー・キンチェ
Maurice Dobb,モーリス・ドッブ
Ronnie Biggs,ロナルド・ビッグズ
Torin Thatcher,トリン・サッチャー
Hazel O'Connor,ヘイゼル・オコナー
Jon Pertwee,ジョン・パートウィー
Guy Pratt,ガイ・プラット
Bryony Lavery,ブライオニー・レイヴリー
Mark Clattenburg,マーク・クラッテンバーグ
Stacey Solomon,ステーシー・ソロモン
Adolph Deutsch,アドルフ・ドイチュ
Hank Marvin,ハンク・マーヴィン
Jaroslav Drobný,ヤロスラフ・ドロブニー
Alasdair Allan,アラスデア・アラン
Lord David Cecil,デイヴィッド・セシル (1902-1986)
Donald Maclean,ドナルド・マクリーン
Kevin Allen,ケヴィン・アレン
Thomas Adès,トーマス・アデス
Mark Gatiss,マーク・ゲイティス
Ewen Montagu,ユーエン・モンタギュー
James Mourilyan Tanner,ジェームス・タナー
Dizzee Rascal,ディジー・ラスカル
Nikolai Medtner,ニコライ・メトネル
Roy Harper,ロイ・ハーパー
Ned Maddrell,ネッド・マドレル
John Lloyd,ジョン・ロイド
Nigel Cole,ナイジェル・コール
Andrew Marvell,アンドルー・マーヴェル
Catherine Johnson,キャサリン・ジョンソン
Roger Hunt,ロジャー・ハント
Steve Bloomer,スティーブ・ブルーマー
Vivian Campbell,ヴィヴィアン・キャンベル
William Orbit,ウィリアム・オービット
Yvonne Blake,イヴォンヌ・ブレイク
Joe Worsley,ジョー・ワーズリー
Margaret John,マーガレット・ジョン
Craig Brown,クレイグ・ブラウン (1940年生のサッカー選手)
Norma Varden,ノーマ・ヴァーデン
Daniel Harding,ダニエル・ハーディング
Sophie Thompson,ソフィー・トンプソン
Mary Lou McDonald,メアリー・ルー・マクドナルド
Malia,マリア
Sigismund Payne Best,シギスムント・ペインベスト
Tim Hetherington,ティム・ヘザリントン
Tommy Bowe,トミー・ボー
Lalla Ward,ララ・ウォード
Benjamin Zephaniah,ベンジャミン・ゼファニア
Arthur Scargill,アーサー・スカーギル
Alison Snowden,アリソン・スノーデン
Alan Shepherd,アラン・シェパード
Izaak Walton,アイザック・ウォルトン
William Astbury,ウィリアム・アストベリー
Archie Cochrane,アーチボルド・コクラン
Peter Egan,ピーター・イーガン
Judy Oakes,ジュディ・オークス
Boaz Myhill,ボアズ・マイヒル
Cliff Bastin,クリフ・バスティン
DJ Campbell,DJ・キャンベル
John Neville Keynes,ジョン・ネヴィル・ケインズ
Grantley Goulding,グラントリー・ゴールディング
Steve Clark,スティーヴ・クラーク
Jonathan Lynn,ジョナサン・リン
Martin Kemp,マーティン・ケンプ
Roy Bhaskar,ロイ・バスカー
Teddy Thompson,テディ・トンプソン
Peter Kennaugh,ピーター・ケノー
Christian Malcolm,クリスチャン・マルコム
Jimmy White,ジミー・ホワイト
John Wetton,ジョン・ウェットン
John Hewitt,ジョン・ヒューイット
Angela Constance,アンジェラ・コンスタンス
Simon Fuller,サイモン・フラー
Margaret Tyzack,マーガレット・タイザック
Michael Turner,マイケル・ターナー
Richard Llewellyn,リチャード・ルエリン
Lady Ottoline Morrell,レディ・オットリン・モレル
Richard Henry Stevens,リチャード・ヘンリー・スティーヴンス
Pat Condell,パット・コンデル
John Taylor,ジョン・テイラー
Mary Gordon,メアリー・ゴードン
Sandrine Holt,サンドリン・ホルト
Geoff Emerick,ジェフ・エメリック
Mark Sheppard,マーク・A・シェパード
Lancelot Hogben,ランスロット・ホグベン
Ophelia Lovibond,オフィリア・ラヴィボンド
Faith Brook,フェイス・ブルック
Ali Smith,アリ・スミス
Barbara Kellerman,バーバラ・ケラーマン
Jemima Goldsmith,ジェマイマ・マルセル・ゴールドスミス
Herbert Pitman,ハーバート・ピットマン
Baillie Scott,ベイリー・スコット
Lascelles Abercrombie,ラッセル・アバークロンビー
Omid Djalili,オミッド・ジャリリ
Helen Watts,ヘレン・ワッツ
Sam Claflin,サム・クラフリン
John Flaxman Jr.,ジョン・フラクスマン
George William Russell,ジョージ・ウィリアム・ラッセル
Cyril Scott,シリル・スコット
Michael Bingham,マイケル・ビンガム
Bryan Gunn,ブライアン・ギャン
Phyllis Covell,フィリス・コベル
Joanna Page,ジョアンナ・ペイジ
Andy Clark,アンディ・クラーク (ミュージシャン)
Blythe Masters,ブライス・マスターズ
Edward Alleyn,エドワード・アレン
Reginald Dyer,レジナルド・ダイアー
Lee Jackson,リー・ジャクソン
Don Lusher,ドン・ラッシャー
Tom Sermanni,トム・サーマンニ
Phil Campbell,フィル・キャンベル
Simon Phillips,サイモン・フィリップス
James Willstrop,ジェームズ・ウィルストロップ
Flick Shagwell,フリック・シャグウェル
Brenda Milner,ブレンダ・ミルナー
Peter Mensah,ピーター・メンサー
Tyrone Mears,タイロン・ミアーズ
Dorothy Greenhough-Smith,ドロシー・グリーンハウ＝スミス
Edmund Robertson,エドマンド・F・ロバートソン
Gwendoline Christie,グェンドリン・クリスティー
Brian Kidd,ブライアン・キッド
Augustus John,オーガスタス・ジョン
Ron Moody,ロン・ムーディー
Spike Milligan,スパイク・ミリガン
W. O. Bentley,ウォルター・オーウェン・ベントレー
Reginald Victor Jones,R・V・ジョーンズ
Nick Cook,ニック・クック
Peter Gandy,ピーター・ギャンディ
Jill Parker-Hammersley-Shirley,ジル・ハマースリー
Thomas Chalmers,トーマス・チャーマーズ
Miles Malleson,マイルス・モールソン
Henry Surtees,ヘンリー・サーティース
Esmé Bianco,エスメ・ビアンコ
Dorothy Holman,ドロシー・ホルマン
Oliver Ford Davies,オリバー・フォード・デイヴィーズ
Lilian Baylis,リリアン・ベイリス
Steven Naismith,スティーヴン・ネイスミス
Colin Baker,コリン・ベイカー (俳優)
Shelley Conn,シェリー・コン
Dimitri Leonidas,ディミトリー・レオニダス
Michael Halliday,M・A・K・ハリデー
Kenneth Colley,ケネス・コリー
Donald Crisp,ドナルド・クリスプ
Patrick Bowes-Lyon,パトリック・ボーズ＝ライアン
Roy Welensky,ロイ・ウェレンスキー
John Gwilliam,ジョン・グィリアム
Benjamin Ross,ベンジャミン・ロス
Honeysuckle Weeks,ハニーサックル・ウィークス
Alice Powell,アリス・パウエル
Samantha Barks,サマンサ・バークス
Finn Jones,フィン・ジョーンズ
Anna Reynolds,アンナ・レイノルズ
Michael Argyle,アーガイル
Jim Corbett,ジム・コーベット (猟師)
Stevie Smith,スティーヴィー・スミス
Ruth Belville,ルース・ベルヴィル
Mary Honeyball,メアリー・ハニボール
Caroline John,キャロライン・ジョン
Alison Steadman,アリソン・ステッドマン
Jim Gillespie,ジム・ギレスピー
Andrew Dunn,アンドルー・ダン
Lisa Tuttle,リサ・タトル
Andy Bown,アンディ・ボウン
Jodie Kidd,ジョディ・キッド
Michael Gothard,マイケル・ゴタード
Wendy Smith-Sly,ウェンディ・スライ
Eleanor Bron,エレノア・ブロン
Brian Jacques,ブライアン・ジェイクス
Cathy Dennis,キャシー・デニス
John Woodvine,ジョン・ウッドヴァイン
Frank Hadow,フランク・ハドー
Christopher Cockerell,クリストファー・コッカレル
Mina Loy,ミナ・ロイ
Don Rendell,ドン・レンデル
Anthony Barnes Atkinson,アンソニー・アトキンソン
Tony Hatch,トニー・ハッチ
Simon Curtis,サイモン・カーティス
Barbara Leigh-Hunt,バーバラ・リー＝ハント
Alice Coote,アリス・クート
Edward Arthur Milne,エドワード・アーサー・ミルン
Geraldine James,ジェラルディン・ジェームズ
Mark Day,マーク・デイ
Charles Villiers Stanford,チャールズ・ヴィリアーズ・スタンフォード
George Larner,ジョージ・ラーナー
Richard Long,リチャード・ロング
Colin Wilson,コリン・ウィルソン
Richard Ashcroft,リチャード・アシュクロフト
Annabel Schofield,アナベル・スコフィールド
Alan Gardiner,アラン・ガーディナー
Charlotte Riley,シャーロット・ライリー
Ian G. Macdonald,イアン・マクドナルド
