"Prince Pedro Augusto, 5th Prince of Kohary",ペーター・アウグスト・フォン・ザクセン＝コーブルク・ウント・ゴータ
Tristram Hunt,トリストラム・ハント
Warren Christie,ウォーレン・クリスティー
Henry Tizard,ヘンリー・ティザード
Emily Head,エミリー・ヘッド
Douglas Booth,ダグラス・ブース
Sharon Hodgson,シャロン・ホジソン
Kate Hoey,ケイト・ホーイ
George Hollingbery,ジョージ・ホリングベリー
Philip Hollobone,フィリップ・ホロボーン
Stuart Parnaby,スチュアート・パーナビー
Jonathan Coe,ジョナサン・コー
Roy Harrod,ロイ・ハロッド
Ben Alnwick,ベン・アニック
Clinton Morrison,クリントン・モリソン
Jimmy Perry,ジミー・ペリー
James George Scott,ジェームス・ジョージ・スコット
Eddie Kramer,エディ・クレイマー
Martin Fleischmann,マーティン・フライシュマン
H. Christopher Longuet-Higgins,ロングエット・ヒギンズ
Charles Coulson,チャールズ・クールソン
Gary Williams,ガリー・ウィリアムズ
Mike Ashley,マイク・アシュリー
David Jacobs,デビッド・ジェイコブズ
"Navnit Dholakia, Baron Dholakia",ナヴニット・ドラキア
John Selden,ジョン・セルデン
Norman Read,ノーマン・リード
Jimmy Hood,ジミー・フッド
Adam Holloway,アダム・ホロウェイ
David Prain,デーヴィッド・プレイン
Ravel Morrison,ラヴェル・モリソン
Richard Duffy,リチャード・ダフィー
A. S. F. Gow,アンドリュー・シデナム・ファーラー・ゴウ
Mark McGhee,マーク・マギー
Anthony R. Hunter,トニー・ハンター
Gary Kemp,ゲイリー・ケンプ
Tom Hughes,トム・ヒューズ (俳優)
David Bomberg,デビット・ボンバーグ
Chris Finnegan,クリス・フィネガン
Robert Jankel,ロバート・ジャンケル
Lucy Fleming,ルーシー・フレミング
Jeff Noon,ジェフ・ヌーン
Garth Crooks,ガース・クルックス
Mark Burns,マーク・バーンズ
Samuel Barnett,サミュエル・バーネット
Kelvin Hopkins,ケルヴィン・ホプキンズ
Kris Hopkins,クリス・ホプキンズ
Martin Horwood,マーティン・ホーウッド
Willard Wheatley,ウィラード・ウィートリー
Frederick Abberline,フレデリック・アバーライン
Julian Huppert,ジュリアン・ハパート
Robert Stephens,ロバート・スティーヴンス
Donald Wilson,ドナルド・ウィルソン
Clive Thomas,クライヴ・トーマス
Edmund Hirst,エドモンド・ハースト
Daniel Nicol Dunlop,ダニエル・ニコル・ダンロップ
George Barger,ジョージ・バーシャー
Cedric Price,セドリック・プライス
Jason Thompson,ジェイソン・トンプソン
Stewart Hosie,スチュワート・ホージー
Gerald Howarth,ジェラルド・ホワース
Roy Thomas Baker,ロイ・ベイカー
Thomas Birch,トーマス・バーチ
Richard Harvey,リチャード・ハーヴィー
John Sydenham Furnivall,ジョン・シデナム・ファーニヴァル
Robert H. Crabtree,ロバート・クラブトリー
Robert Aickman,ロバート・エイクマン
John Stenhouse,ジョン・ステンハウス
Alan R. Battersby,アラン・R・バターズビー
Danny Ward,ダニー・ウォード
Salvador Moncada,サルバドール・モンカダ
John Bostock,ジョン・ボストック
Sean Teale,ショーン・ティール
Conor MacNeill,コナー・マクニール
John Howell,ジョン・ハウエル
Lindsay Hoyle,リンジー・ホイル
Alexander Boksenberg,アレキサンダー・ボクセンバーグ
David Greene,デヴィッド・グリーン
Rupert Evans,ルパート・エヴァンス
"Eustace Roskill, Baron Roskill",ユースタス・ロスキル
Frazer Richardson,フレイザー・リチャードソン
Ryan Lowe,ライアン・ロウ
"Fiennes Cornwallis, 3rd Baron Cornwallis",フィンズ・コーンウォリス (第3代コーンウォリス男爵)
Laura Trevelyan,ローラ・トレヴェリアン
William Playfair,ウィリアム・プレイフェア
Frederick Walton,フレデリック・ウォルトン
Philip Ball,フィリップ・ボール
Mark Brown,マーク・ブラウン
Nick Hurd,ニック・ハード
Jimmy Murphy,ジミー・マーフィー
May Hallatt,メイ・ホーラット
John Law,ジョン・ロー
Trevor Duncan,トレヴァー・ダンカン
Archie Scott Brown,アーチー・スコット＝ブラウン
John Clarke,ジョン・クラーク
Armando Iannucci,アーマンド・イアヌッチ
Reyner Banham,レイナー・バンハム
Ralph T. O'Neal,ラルフ・T・オニール
Russell Martin,ラッセル・マーティン
Paddy Roy Bates,パディ・ロイ・ベーツ
Gareth Emery,ガレス・エメリ
George Crabbe,ジョージ・クラッブ
Jon Hopkins,ジョン・ホプキンズ
Dean Leacock,ディーン・リーコック
Edward Weston,エドワード・ウェストン (化学者)
Edwin Southern,エドウィン・サザン
Ronald Gillespie,ロナルド・ギレスピー
Mel Galley,メル・ギャレー
Dave Holland,デイヴ・ホーランド
Sasha,サシャ
Edward Hobart Seymour,エドワード・シーモア
Neil Bartlett,ネイル・バートレット
Michael Dibdin,マイケル・ディブディン
Julian Baggini,ジュリアン・バジーニ
David Mallet,デヴィッド・マレット
David Tall,デイヴィッド・トール
Bill Forsyth,ビル・フォーサイス
Robert Morley,ロバート・モーレイ
Reg Revans,レッグ・レヴァンス
Daniel Kawczynski,ダニエル・コジンスキ
"Brenda Hale, Baroness Hale of Richmond",ブレンダ・ハル
Philip Kerr,フィリップ・カー
Howard Kendall,ハワード・ケンドール
Don Welsh,ドン・ウェルシュ
Martin Lowry,マーチン・ローリー
Warren Clarke,ウォーレン・クラーク
Peter Dronke,ピーター・ドロンケ
Ron Saunders,ロン・サンダース
Luke Goss,ルーク・ゴス
Harry Revel,ハリー・レヴェル
Callum Blue,カラム・ブルー
Ian Hodder,イアン・ホッダー
Jason Brown,ジェイソン・ブラウン
Steve Bould,スティーヴ・ボールド
Lee Peltier,リー・ペルティア
John McDonnell,ジョン・マクドネル
Bruno Heller,ブルーノ・ヘラー
Partha Dasgupta,パーサ・ダスグプタ
Jason McCartney,ジェイソン・マッカートニー
Peter Murray-Rust,ピーター・マレー＝ラスト
Sheila Hancock,シーラ・ハンコック
Barry Kitson,バリー・キットソン
George Dyson,ジョージ・ダイソン
Albert Campion,アルバート・チャンピオン
Brendan Coyle,ブレンダン・コイル
Paul Maynard,ポール・メイナード
John Mann,ジョン・マン
Leonard Carey,レオナルド・キャリー
J. R. Partington,J・R・パーティントン
"William Astor, 4th Viscount Astor",ウィリアム・アスター
Jesse Pennington,ジェシー・ペニントン
Porl Thompson,ポール・トンプソン
Osmund,オズムンド (ソールズベリー司教)
D'Arcy Wentworth Thompson,ダーシー・トムソン
Ernest Starling,アーネスト・スターリング
Philemon Pownoll,フィルモン・ポウノル
Mal Donaghy,マル・ドナギー
Robert Duff,ロバート・ダフ
Geoffrey Hill,ジェフリー・ヒル
I. Howard Marshall,ハワード・マーシャル
E. E. Clive,E・E・クライヴ
Graham Dorrans,グレアム・ドランス
James Walker,ジェームズ・ウォーカー
E. T. Whittaker,エドマンド・テイラー・ホイッテーカー
Helen Simpson,ヘレン・シンプソン
Anne Main,アン・メイン
Freddie Young,フレディ・ヤング
Edward Max Nicholson,マックス・ニコルソン
Paul Raymond,ポール・レイモンド
Arnold Hugh Martin Jones,アーノルド・ヒュー・マーティン・ジョーンズ
Douglas Bostock,ダグラス・ボストック
Edwin Cannan,エドウィン・キャナン
Gemma Gibbons,ジェマ・ギボンズ
Peter Wilson,ピーター・ウィルソン
Freddie Bartholomew,フレディ・バーソロミュー
Stuart Price,スチュアート・プライス
John Hopkins,ジョン・ホプキンス (作曲家)
Muzzy Izzet,ムジー・イゼット
Peter Sallis,ピーター・サリス
Stelios Haji-Ioannou,ステリオス・ハジ=イオアヌ
Dave Walder,デービット・ウォルダー
John Hopkins,ジョン・ホプキンズ
Stephen Lloyd,ステファン・ロイド
Brett Fancy,ブレット・ファンシー
Arnold Jackson,アーノルド・ジャクソン
Arnold Leese,アーノルド・リース
Naomi Long,ナオミ・ロング
Denis MacShane,デニス・マクシェーン
Angus MacNeil,アンガス・マクニール
Henry Drysdale Dakin,ヘンリー・デーキン
Richard Sykes,リチャード・サイクス
John Stuart Anderson,ジョン・スチュアート・アンダーソン
Brian Ackland-Snow,ブライアン・オークランド＝ショウ
W. Brian Arthur,W・ブライアン・アーサー
Percy Hobart,パーシー・ホバート
Andy Rouse,アンディ・ロウズ
Harry B. Whittington,ハリー・ウィッチントン
Helen Cherry,ヘレン・チェリー
Christopher Soghoian,クリストファー・ソゴイアン
Richard Corbett,リチャード・コーベット
Passenger,パッセンジャー
J. Peter Robinson,J・ピーター・ロビンソン
Tom Boyd,トム・ボイド
Quentin Bell,クエンティン・ベル
Christopher Smith,クリストファー・スミス
Frank Finlay,フランク・フィンレー
F. Richard Stephenson,リチャード・スティーヴンソン
Jack Douglas,ジャック・ダグラス
"Brian Kerr, Baron Kerr of Tonaghmore",ブライアン・カー
Jonathan Lord,ジョナサン・ロード
Cecil Beaton,セシル・ビートン
Elliot Cowan,エリオット・コーワン
Karen Lumley,カレン・ラムリー
"Robert Carswell, Baron Carswell",カースウェル卿
Brandon Hurst,ブランドン・ハースト
Oliver Stapleton,オリヴァー・ステイプルトン
Charles Bronson,チャールズ・ブロンソン (囚人)
Mike McGear,マイク・マクギア
Roger Ashton-Griffiths,ロジャー・アシュトン＝グリフィス
Billy Sharp,ビリー・シャープ
Christian Dailly,クリスティアン・デイリー
Brian Aherne,ブライアン・エイハーン
Brian Auger,ブライアン・オーガー
Brian Bolland,ブライアン・ボーランド
Chris Hughes,クリス・ヒューズ
Brian Barry,ブライアン・バリー
Brian Large,ブライアン・ラージ
Brian Laws,ブライアン・ローズ (サッカー選手)
Don Partridge,ドン・パートリッジ
Ian Standish Monteith Hamilton,イアン・ハミルトン (陸軍軍人)
Patrick Leigh Fermor,パトリック・リー・ファーマー
Allen Jones,アレン・ジョーンズ
James Wilby,ジェームズ・ウィルビー
Graham King,グレアム・キング
Luke Chambers,ルーク・チェンバース
Lesley Nicol,レズリー・ニコル
Dan Clarke,ダン・クラーク
Jeremy Kemp,ジェレミー・ケンプ
George MacDonald Fraser,ジョージ・マクドナルド・フレイザー
John Richardson,ジョン・リチャードソン
Brian Davison,ブライアン・デヴィソン
Jon Halliday,ジョン・ハリディ
Geoffrey de Havilland,ジェフリー・デハビランド
William Patrick Stuart-Houston,ウィリアム・パトリック・ヒトラー
Geoffrey Ingram Taylor,ジェフェリー・イングラム・テイラー
Alan Bennett,アラン・ベネット
Jim Platt,ジム・プラット
Genesis P-Orridge,ジェネシス・P・オリッジ
Brian Huggett,ブライアン・ヒューゲット
Wong Yuk-man,黄毓民
Tony Cragg,トニー・クラッグ
Steve Brookstein,スティーヴ・ブルックスタイン
Walter Sickert,ウォルター・シッカート
Ramsey Campbell,ラムジー・キャンベル
Mick Jackson,ミック・ジャクソン
Sydney Cockerell,シドニー・コッカレル
William Empson,ウィリアム・エンプソン
Kevin Richardson,ケヴィン・リチャードソン
Serge Pizzorno,セルジオ・ピッツォーノ
Sajjad Karim,サッジド・カリム
Phil Cunningham,フィル・カニンガム
Richard Doll,リチャード・ドール
James Anderson,ジェームズ・アンダーソン
David Healy,デイヴィッド・ヒーリー
Steve Lillywhite,スティーヴ・リリーホワイト
Tom Sturridge,トム・スターリッジ
Jack Hobbs,ジャック・ホッブス
Jimmy Sangster,ジミー・サングスター
Larry Lloyd,ラリー・ロイド
Somerset Gough-Calthorpe,サマーセット・ゴフ＝カルソープ
Kerry Dixon,ケリー・ディクソン
Alan Smith,アラン・スミス (1962年生のサッカー選手)
Colin Todd,コリン・トッド
Colin McGinn,コリン・マッギン
Colin Greenland,コリン・グリーンランド
Jon Hiseman,ジョン・ハイズマン
Edmund Gosse,エドマンド・ゴス
Alan Skidmore,アラン・スキッドモア
Hugh Mitchell,ヒュー・ミッチェル
Alastair Campbell,アリスター・キャンベル
John Mayhew,ジョン・メイヒュー
Paul Gambaccini,ポール・ガンバッキーニ
Gordon Hodgson,ゴードン・ホドソン
Phoebe Philo,フィービー・フィロ
Leonard Rossiter,レナード・ロシター
Joe Meek,ジョー・ミーク
Jody Morris,ジョディ・モリス
Nicholas Hytner,ニコラス・ハイトナー
Leonard Woolf,レナード・ウルフ
Terence Conran,テレンス・コンラン
Sydney Greenstreet,シドニー・グリーンストリート
George Smith,ジョージ・スミス (審判員)
Fred Karno,フレッド・カーノー
Edward Bach,エドワード・バッチ
Julian Bell,ジュリアン・ベル
Harry Angelman,ハリー・アンジェルマン
Isaac Hempstead-Wright,アイザック・ヘンプステッド＝ライト
Ken Scott,ケン・スコット
Jeffrey Walker,ジェフ・ウォーカー
John Ehrman,ジョン・エールマン
Robert Sherard,ロバート・シェラード
Richard B. Parkinson,リチャード・パーキンソン
David Ison,デーヴィッド・アイソン
Maxi Priest,マキシ・プリースト
J. Eric S. Thompson,ジョン・エリック・シドニー・トンプソン
Brian Lumley,ブライアン・ラムレイ
Brian G. W. Manning,ブライアン・G・W・マニング
Brian Moore,ブライアン・ムーア
Brian Morton,ブライアン・モートン
Brian Nash,ブライアン・ナッシュ
Brian Newbould,ブライアン・ニューボールド
William Ling,ウィリアム・リング
Ernő Goldfinger,エルノ・ゴールドフィンガー
Naomi Folkard,ナオミ・フォルカード
Richard Eyre,リチャード・エアー
Simon McBurney,サイモン・マクバーニー
Howard Devoto,ハワード・ディヴォート
Hugh Padgham,ヒュー・パジャム
Lawrence Stone,ローレンス・ストーン
Brian Poole,ブライアン・プール
Brian Gibson,ブライアン・ギブソン
Brian Godding,ブライアン・ゴディング
Brian Greenhoff,ブライアン・グリーンホフ
Brian Patten,ブライアン・パッテン
Brian Pippard,ブライアン・ピパード
Ivor Bolton,アイヴァー・ボルトン
Gareth Jones,ガレス・ジョーンズ
Michael Baxandall,マイケル・バクサンドール
Dave Clarke,デイヴ・クラーク (テクノDJ)
Jonny Howson,ジョニー・ハウソン
Shane Ferguson,シェーン・ファーガソン
Philip de László,フィリップ・ド・ラースロー
John Beazley,ジョン・ビーズリー
Stephen Leather,スティーヴン・レザー
Leslie Charteris,レスリー・チャータリス
Brian Priestley,ブライアン・プリーストリー
Brian Rawlinson,ブライアン・ローリンソン
Max Kennedy Horton,マックス・ケネディ・ホートン
Stephen South,スティーブン・サウス
"James Ramsay, 17th Earl of Dalhousie",ジェームズ・ヒューバート・ラムゼイ (第17代ダルハウジー伯爵)
Lawrence Demmy,ローレンス・デミー
James Kirkup,ジェイムズ・カーカップ
Brian McCardie,ブライアン・マッカーディー
Ray Lankester,レイ・ランケスター
David Garnett,デイヴィッド・ガーネット
Mal Evans,マル・エヴァンズ
Luciano Bacheta,ルチアーノ・バシェタ
Mike Doyle,マイク・ドイル
Ian Hamilton,イアン・ハミルトン
Jack Baldwin,ジャック・ボールドウィン
Stuart Drummond,ステュアート・ドラモンド
Michael Deeley,マイケル・ディーリー
Richard Pynson,リチャード・ピンソン
Roger Moorhouse,ロジャー・ムーアハウス
Brian Tufano,ブライアン・テュファーノ
"John FitzRoy, 9th Duke of Grafton",ジョン・フィッツロイ (第9代グラフトン公)
Edward Hardwicke,エドワード・ハードウィック
Rick Wills,リック・ウィルス
William Tenn,ウィリアム・テン
Alastair Sim,アラステア・シム
Ray Houghton,レイ・ホートン
Joe Anderson,ジョー・アンダーソン
Mark Hateley,マーク・ヘイトリー
George MacKay,ジョージ・マッケイ
Jack Beresford,ジャック・ベレスフォード
Colin Turkington,コリン・ターキントン
Michael Crawford,マイケル・クロフォード
Raphael Ravenscroft,ラファエル・ラヴェンスクロフト
Lewis Williamson,ルイス・ウィリアムソン
Martin Rushent,マーティン・ラシェント
Jonathan Nott,ジョナサン・ノット
Prince William of Gloucester,ウィリアム・オブ・グロスター
Keith Spurgeon,キース・スポルジョン
Kris Commons,クリス・コモンズ
Nicky Weaver,ニッキー・ウィーバー
Tubby Hayes,タビー・ヘイズ
Lizzy Yarnold,リジー・ヤーノルド
Francis L. Sullivan,フランシス・L・サリヴァン
Kerry Minnear,ケリー・ミネア
Phil Shulman,フィリップ(フィル)・シャルマン
Edward Gregson,エドワード・グレグソン
Len Hutton,レン・ハットン
Brian Rust,ブライアン・ラスト
Frank Sinclair,フランク・シンクレア
Lynne Perrie,リン・ペリー
Cecil Aldin,セシル・アルディン
Owney Madden,オウニー・マドゥン
David Kossoff,デヴィッド・コソフ
Roger Griffin,ロジャー・グリフィン
Simon Berry,アート・オブ・トランス
Brian Wellman,ブライアン・ウェルマン
Lustmord,ラストモード
Harry Kane,ハリー・ケイン
Leo Baeck,レーオ・ベック
Lancelot Royle,ランスロット・ロイル
Bríd Brennan,ブリッド・ブレナン
Doug Bradley,ダグ・ブラッドレイ
Mike Batt,マイク・バット
Ian Stewart,イアン・スチュワート (陸上選手)
Owen Thomas Jones,オーウェン・ジョーンズ
Brian Robinson,ブライアン・ロビンソン
Gordon Durie,ゴードン・デューリー
Steve Harley,スティーヴ・ハーレイ
Peter Wyngarde,ピーター・ウィンガード
Victor Saville,ヴィクター・サヴィル
Art Malik,アート・マリック
Bernard Comrie,バーナード・コムリー
Clive Francis,クライヴ・フランシス
Clive Donner,クライヴ・ドナー
Bridget Jones,ブリジット・ジョーンズ
Samuel C. Bradford,サミュエル・Ｃ・ブラッドフォード
Jeremy Bates,ジェレミー・ベイツ
Allan Clarke,アラン・クラーク
John Cotton,ジョン・コットン
Lord David Dundas,デヴィッド・ダンダス
Tim Brooke-Taylor,ティム・ブルック＝テイラー
Justin Tipuric,ジャスティン・ティプリック
"Thomas Scott-Ellis, 8th Baron Howard de Walden",トマス・スコット＝エリス
Donald Campbell,ドナルド・キャンベル
Rory McCann,ロリー・マッキャン
Robert Sidney Cahn,ロバート・シドニー・カーン
Lee Sharpe,リー・シャープ
Allan McGregor,アラン・マクレガー
Ben Adams,ベン・アダムス
Lynn Chadwick,リン・チャドウィック
Vic Reeves,ジム・モイア
Ben Aris,ベン・アリス
Francis Tresham,フランシス・トレシャム
James Wallace,ジェームズ・ウォレス
Terry Yorath,テリー・ヨラス
Harold Monro,ハロルド・モンロー
Alexei Sayle,アレクセイ・セイル
Keith Curle,キース・カール
Eric Mervyn Lindsay,エリック・マーヴィン・リンジー
Peter Saville,ピーター・サヴィル
Jason Plato,ジェイソン・プラト
Mick Harris,ミック・ハリス
Bobby Madden,ボビー・マッデン
Cosmo Duff-Gordon,コズモ・ダフ＝ゴードン
Colin Richardson,コリン・リチャードソン
C. B. Fry,C・B・フライ
Sarah Jane Morris,サラ・ジェーン・モリス
Jimmy Murray,ジミー・マレー
Nathan Baker,ネイザン・ベイカー
John Cobb,ジョン・コッブ
Ryan Dalziel,ライアン・ダルジール
Julian Lewis,ジュリアン・ルイス
"FitzRoy Somerset, 5th Baron Raglan",フィッツロイ・サマセット (第5代ラグラン男爵)
David Lidington,デイヴィッド・リディントン
Robert Goddard,ロバート・ゴダード
Astley Cooper,アストリー・クーパー
Clive Langer,クライヴ・ランガー
Clive Russell,クライヴ・ラッセル
John Marston,ジョン・マーストン
Simon Baron-Cohen,サイモン・バロン＝コーエン
David Rees,デビッド・リース
Harold Darke,ハロルド・ダーク
Brian Talbot,ブライアン・タルボット
Brian Trenchard-Smith,ブライアン・トレンチャード＝スミス
George Macartney,ジョージ・マカートニー
George Barnes,ジョージ・ニコル・バーンズ
"Charles Hepburn-Stuart-Forbes-Trefusis, 21st Baron Clinton",チャールズ・ヘプバーン＝ステュアート＝フォーブス＝トレフューシス (第21代クリントン男爵)
David Elleray,デイヴィッド・エラレイ
Colin Blunstone,コリン・ブランストーン
Clive Wood,クライヴ・ウッド
C. W. Nicol,C・W・ニコル
Ilona Kabos,イローナ・カボス
Don Sharp,ドン・シャープ
Alex Gardner,A-L-X
Pat Roach,パット・ローチ
Colin Bell,コリン・ベル
Charles Tannock,チャールズ・タナック
Eddie Jobson,エディ・ジョブソン
Alex Brundle,アレックス・ブランドル
Rupert Wainwright,ルパート・ウェインライト
Simon Russell Beale,サイモン・ラッセル・ビール
Charlie Higson,チャーリー・ヒグソン
Lancelot Holland,ランスロット・ホランド
Henry St. John Thackeray,ヘンリー・セント・ジョン・サッカレー
Phil Davis,フィル・デイヴィス (俳優)
Thomas Dunhill,トマス・ダンヒル
Mischa Spoliansky,ミシャ・スポリアンスキー
Silvanus P. Thompson,シルバナス・トンプソン
Kieran Agard,キーラン・アガード
Brandon Lewis,ブランドン・ルイス
Betsy Braddock,サイロック
Patrick Godfrey,パトリック・ゴッドフリー
Gerald Holtom,ジェラード・ホルトム
Colette Brettel,コレット・ブレッテル
Steve McMahon,スティーヴ・マクマホン
Frederick Corder,フレデリック・コーダー
Norman Lamb,ノーマン・ラム
Samuel Wesley,サミュエル・ウェスレー (詩人)
Harry Pearce,ハリー・ピアース
Mad Professor,マッド・プロフェッサー
Roy Wood,ロイ・ウッド
Dave Mason,デイヴ・メイソン
Stuart McCall,ステュアート・マッコール
Simon Grayson,サイモン・グレイソン
Ian Liddell-Grainger,イアン・リデル＝グレンジャー
Elfie Donnelly,エルフィ・ドネリー
Henry Edward Armstrong,ヘンリー・エドワード・アームストロング
Chris Leslie,クリス・レスリー
Colin Clarke,コリン・クラーク
Colin Falconer,コリン・ファルコナー
Edward Bond,エドワード・ボンド
Cecil Reddie,セシル・レディ
Steve McQueen,スティーヴ・マックイーン
David Cotterill,デイビッド・コッテリル
Dow Travers,ドウ・トラヴァース
Tom Blomqvist,トム・ブロンクビスト
Colin Mawby,コリン・マウビー
Colin McFarlane,コリン・マクファーレン
Ronald Harwood,ロナルド・ハーウッド
Barry Cooper,バリー・クーパー
Daniel Jones,ダニエル・ジョーンズ
Joe Simpson,ジョー・シンプソン
Tim Sherwood,ティム・シャーウッド
Tadeusz Rybczynski,タデウス・リプチンスキー
John Callen,ジョン・カレン
Ray Shulman,レイ・シャルマン
George Reader,ジョージ・リーダー
Edward Leigh,エドワード・リー
Dennis Robertson,デニス・ロバートソン
Nick Yelloly,ニック・イェロリー
Isidore de Lara,イシドール・ド・ララ
Peter J. Carroll,ピーター・J・キャロル
Kingsley Charles Dunham,キングスレー・チャールズ・ダナム
Neil Adams,ニール・アダムス
Walter Leigh,ウォルター・リー
Geoff Crammond,ジェフ・クラモンド
Paul Kossoff,ポール・コゾフ
Edgar Bainton,エドガー・ベイントン
Leo G. Carroll,レオ・G・キャロル
David Wise,デビッド・ワイズ
Robert S. Baker,ロバート・ベーカー
David Seidler,デヴィッド・サイドラー
Guy Green,ガイ・グリーン
Colin Gordon,コリン・ゴードン
Jeremy Lefroy,ジェレミー・レフロイ
Phillip Lee,フィリップ・リー
Eleanor Laing,エレノア・レング
Tom Helmore,トム・ヘルモア
Jimmy Hastings,ジミー・ヘイスティングス
William Nicholson,ウィリアム・ニコルソン
Kwasi Kwarteng,クワシ・クワーテング
David Almond,デイヴィッド・アーモンド
A. J. P. Taylor,A・J・P・テイラー
John Parrott,ジョン・パロット
Keith Relf,キース・レルフ
Clive Allen,クライヴ・アレン
Kris Marshall,クリス・マーシャル
Conn Iggulden,コン・イガルデン
Peter Giles,ピーター・ジャイルズ
Sarah McCorquodale,セーラ・マッコーコデール
Nigel Hitchin,ニジェール・ヒッチン
Martin Walsh,マーティン・ウォルシュ
Jon Harris,ジョン・ハリス
Colin Rowe,コーリン・ロウ
Neil Innes,ニール・イネス
Alan A'Court,アラン・アコート
Guy Burgess,ガイ・バージェス
