Dominika Leśniewicz,ドミニカ・レスニェビッチ
Rafał Trzaskowski,ラファウ・トシャスコフスキ
Donatan,ドナタン
Grzegorz Łomacz,グジェゴシュ・ウォマチ
Dorota Osińska,ドロタ・オシンスカ
Tomasz Kowalski (judoka),トマシ・コヴァルスキ
Szymon Hołownia,シモン・ホウォヴニャ
Roman Suszko (logik),ロマン・スシュコ
Roman Lasocki,ロマン・ラソツキ
Tomasz Bednarczyk,トマシュ・ベドナルチク
Wiesław Błach,ヴィエスワフ・ブワフ
Tomasz Niewodniczański,トマシュ・ニェボードニーチャンスキー
Wojciech Reszko,ヴォイチェフ・レシェコ
Łukasz Borowicz,ウカシュ・ボロヴィチ
Witold Jabłoński (sinolog),ウィットルド・ヤブロンスキー
Wincenty Okoń,ウィンセンティ・オコン
Zdzisław Szostak,ズジスワフ・ショスタク
Witold Waszczykowski,ヴィトルト・ヴァシチコフスキ
Zbigniew Rau (prawnik),ズビグニェフ・ラウ
Łukasz Janik,ウカシュ・ヤニク
Zdzisław Jasiński,ズジスワフ・ヤシンスキ
Beata Maksymow,ベアタ・マクシモフ
Kazimierz Lubomirski,カジミェシュ・ルボミルスキ
Jan Błachowicz,ヤン・ブラホヴィッチ
Konstanty Andrzej Kulka,コンスタンティ・クルカ
Marcin Różalski,マーティン・ロザルスキー
Maksymilian Zimoląg,マクシミリアン・ツィモロング
Krzysztof Szpilman,クリストファー・W・A・スピルマン
Jacek Kaspszyk,ヤツェク・カスプシク
Leon Hufnagel,レオン・フフナゲル
Katarzyna Nowak (tenisistka),カタジナ・ノバク
Jadwiga Rodowicz-Czechowska,ヤドヴィガ・ロドヴィッチ
Małgorzata Bielak,マウゴジャータ・ビエラク
Filip Starzyński (piłkarz),フィリップ・スタジンスキ
Irit Amiel,イリット・アミエル
Jan Toporowski,ヤン・トポロフスキ
Jakub Bartkowski,ヤクブ・バルトコフスキ
Grażyna Dudek,グラジナ・ドゥデク
Grzegorz Heromiński,グジェゴシ・ヘロミンスキー
Jakub Popiwczak,ヤクブ・ポピフチャク
Leszek Starkel,レシェク・スターケル
Krzysztof Jotko,クリストフ・ヨトゥコ
Kaja Danczowska,カヤ・ダンチョフスカ
Marcin Janusz,マルチン・ヤヌシュ
Marcin Budkowski,マルシン・ブドコウスキー
Malwina Smarzek,マルヴィナ・スマジェク
Kamila Frątczak,カミラ・フラトチャク
Małgorzata Roszkowska,マウゴジャータ・ロシュコフスカ
Maciej Zakościelny,マチェイ・ザコシェルニー
Michał Radomił Wiśniewski,ミハウ・ラドミル・ヴィシニェフスキ
Paulina Kaczanow,マリアンナ・ロキータ
Paulina Kuczalska-Reinschmit,パウリナ・クチャルスカ＝ラインシュミット
Mateusz Morawiecki,マテウシュ・モラヴィエツキ
Maria Gontowicz,マリア・ゴントビッチ
Joanna Jędrzejczyk,ヨアナ・イェンジェイチック
Dawid Kownacki,ダヴィド・コフナツキ
Karolina Kowalkiewicz-Zaborowska,カロリーナ・コバケビッチ
Sebastian Bonecki,セバスティアン・ボネツキ
Krzysztof Kamiński (ur. 1990),クシシュトフ・カミンスキー
Katarzyna Połeć,カタジナ・ポウェチ
Ewa Pajor,エヴァ・パヨル
Natalia Kaliszek-Wąsik,ナタリア・カリシェク
Jan Bednarek (piłkarz),ヤン・ベドナレク
Filip Jagiełło,フィリップ・ヤギェウォ
Michał Helik,ミハウ・ヘリク
Marcin Tybura,マルチン・ティブラ
Adam Czerniaków,アダム・チェルニャクフ
Aleksandra Dranka,アレクサンドラ・ドランカ
Helena Sparrow,ヘレナ・スパロウ
Paweł Bochniewicz,パヴェウ・ボフニェヴィチ
Monika Gałkowska,モニカ・ガウコフスカ
Krystian Bielik,クリスティアン・ビエリク
Bartosz Kapustka,バルトシュ・カプストゥカ
Damian Kądzior,ダミアン・コンジョル
Rafał Augustyniak,ラファウ・アウグスティニアク
Krzysztof Charamsa,クシシュトフ・ハラムサ
Michał Walski,ミハウ・ヴァルスキ
Martyna Grajber-Nowakowska,マルティナ・グライベル
Przemysław Frankowski (piłkarz),プジェミスワフ・フランコフスキ
Mateusz Gamrot,マテウス・ガムロット
Aleksander Śliwka,アレクサンデル・シリフカ
Adam Buksa,アダム・ブクサ
Stanisław Kowalski (1910–2022),スタニスワフ・コワルスキー
Paweł Dawidowicz,パヴェウ・ダヴィドヴィチ
Michał Masłowski (piłkarz),ミハウ・マスウォフスキ
Bartłomiej Drągowski,バルトウォミェイ・ドロンゴフスキ
Mateusz Szwoch,マテウシュ・シュヴォフ
Mateusz Wieteska,マテウシュ・ヴィテスカ
Karol Świderski,カロル・シフィデルスキ
Ewa Piątkowska,エワ・ピアットコフスカ
Paweł Tarnowski (żeglarz),パヴェウ・タルノフスキ
Michał Cieślak (bokser),ミハル・チェスラック
Maciej Sulęcki,マチェック・スレッキ
Natalia Starr,ナタリア・スター
Babatunde Aiyegbusi,ババテュンデ・アエグブシ
Łukasz Żal,ウカシュ・ジャル
Agata Ozdoba-Błach,アガタ・オズドバ
Joanna Majdan (judoczka),ヨアンナ・マイダン
Natasha Starr,ナターシャ・スター
Magdalena Ogórek,マグダレナ・オグレク
Ewa Brodnicka,エワ・ブロドニッカ
Rafał Kurzawa,ラファウ・クルザワ
Cleo (piosenkarka),クレオ・(歌手)
Agnieszka Rejment,アニエスカ・レイメント
Maksym Spodyriew,マクシム・スポディレフ
Kamil Wojtkowski,カミル・ヴォイトコフスキ
Kamil Dankowski,カミル・ダンコフスキ
Hubert Hurkacz,フベルト・フルカチュ
Damian Szymański,ダミアン・シマンスキ
Tomasz Fornal,トマシュ・フォルナル
Jarosław Niezgoda,ヤロスワフ・ニェズゴダ
Maria Andrejczyk,マリア・アンドレイチク
Karol Angielski,カロル・アンギェルスキ
Mateusz Bieniek,マテウシュ・ビエニエク
Damian Gąska,ダミアン・ゴンスカ
Łukasz Kaczmarek (siatkarz),ウーカシュ・カチュマレク
Michalina Olszańska,ミハリーナ・オルシャンスカ
Cyryl Kozaczewski,ツィリル・コザチェフスキ
Arkadiusz Reca,アルカディウシュ・レツァ
Jarosław Jach,ヤロスワフ・ヤッハ
Agnieszka Niedźwiedź,アグニシュカ・ニエズビッチ
Martyna Łukasik,マルティナ・ウカシク
Krzysztof Piątek,クシシュトフ・ピョンテク
Dawid Kudła,ダヴィド・クドワ
Patryk Dziczek,パトリク・ジチェク
Sebastian Szymański (piłkarz),セバスティアン・シマンスキ
Przemysław Szymiński,プジェミスワフ・シミンスキ
Mateusz Lis,マテウシュ・リス
Piotr Wlazło,ピオトル・ヴラズウォ
Piotr Zioła,ピオトル・ジオワ
Kamil Jóźwiak,カミル・ヨズヴィアク
Robert Gumny,ロベルト・グムニー
Matty Cash,マティ・キャッシュ
Jacek Góralski,ヤツェク・グラルスキ
Patryk Klimala,パトリク・クリマラ
Kamil Semeniuk,カミル・セメニュク
Radosław Majecki,ラドスワフ・マイェツキ
Jadwiga Szubartowicz,ヤドウィガ・スズバルトヴィチ
Iga Świątek,イガ・シフィオンテク
Bartosz Bielenia,バルトシュ・ビィエレニア
Alina Scholtz,アリナ・ショルツ
Adrian Danek,アドリアン・ダネク
Szymon Żurkowski,シモン・ジュルコフスキ
Beata Pacut-Kłoczko,ベアタ・パツト
Julia Kowalczyk,ユリア・コバルチク
Nela mała reporterka,ネラ・ザ・リトル・レポーター
Przemysław Płacheta,プシェミスワフ・プワヘタ
Wanda Wierzchleyska,ワンダ・ヴィエルツクレイスカ
Kryscina Cimanouska,クリスツィナ・ツィマノウスカヤ
Mateusz Praszelik,マテウシュ・プラスゼリク
Ralph Kaminski,ラルフ・カミンスキ
Karol Niemczycki,カロル・ニェムチツキ
Tymoteusz Puchacz,ティモテウシュ・プハチ
Tekla Juniewicz,テクラ・ユニェヴィチ
Maria Stenzel,マリア・ステンゼル
Olivia Różański,オリビア・ロジャンスキ
Jakub Moder,ヤクブ・モデル
Klaudia Alagierska-Szczepaniak,クラウディア・アラギェルスカ
Julia Nowicka,ユリア・ノビツカ
Alan Czerwiński,アラン・チェルヴィンスキ
Mateusz Żukowski,マテウシュ・ジュコフスキ
Sebastian Walukiewicz,セバスティアン・ヴァルキエヴィツ
Kamil Grabara,カミル・グラバラ
Jekatierina Kurakowa,エカテリーナ・クラコワ
Filip Marchwiński,フィリプ・マルチヴィニスキ
Mateusz Młyński,マテウシュ・ムウィニスキ
Mateusz Bogusz,マテウシュ・ボグシュ
Sebastian Kowalczyk (piłkarz),セバスティアン・コヴァルチク
Magdalena Stysiak,マグダレナ・スティシャク
Krzysztof Ciebień,クシシュトフ・チェベン
Mateo Klimowicz,マテオ・クリモヴィッツ
Michał Skóraś,ミハウ・スコラシュ
Jacek Izydorczyk,ヤツェク・イズィドルチク
Paweł Milewski,パヴェウ・ミレフスキ
Michał Karbownik,ミハエル・カルボニック
Jakub Kamiński (piłkarz),ヤクブ・カミンスキ
Jakub Kiwior,ヤクブ・キヴィオル
Kamil Piątkowski,カミル・ピョンツコフスキ
Jan Sobociński,ヤン・ソボチンスキ
Nicola Zalewski,ニコラ・ザレフスキ
Serafin Szota,セラフィン・ショタ
Viki Gabor,ヴィキ・ガボール
Bartosz Slisz,バルトシュ・スリシュ
Zuzanna Górecka,スザンナ・ゴレツカ
Aleksander Buksa,アレクサンデル・ブクサ
Kacper Kozłowski (piłkarz),カツペル・コズウォフスキ
Angelika Szymańska,アンジェリカ・シマンスカ
Bartosz Białek,バルトシュ・ビャウェク
Łukasz Różański,ルカシュ・ロザンスキー
Gabriel Slonina,ガブリエル・スロニナ
Kacper Smoliński (piłkarz),カツペル・スモリンスキ
Polska 2050,ポーランド2050
Jeremy Sochan,ジェレミー・ソーハン
Katarzyna Wenerska,カタジナ・ベネルスカ
Helena Krasowska,ヘレナ・クラソフスカ
Mateusz Łęgowski,マテウシュ・ウェンゴフスキ