girolamo mazzola bedoli,ジローラモ・マッツォーラ・ベドリ,jirōramo・mattsōra・bedori
giuseppe addobbati,ジュゼッペ・アドバッティ,juzeppe・adobatti
carlo geloso,カルロ・ジェロソ,karuro・jeroso
filippo silvestri,フィリッポ・シルヴェストリ,firippo・shiruvuェsutori
marcello fois,マルチェロ・フォイス,maruchero・foisu
joseph olivadoti,ジョセフ・オリヴァドーティ,josefu・orivadōti
raffaele paolucci,ラファエル・パオルッチ,rafaeru・paorutchi
walter santesso,ウォルター・サンテッソ,worutā・santesso
giuseppe amato,ジュゼッペ・アマト,juzeppe・amato
giuseppe antonio borgese,ジュゼッペ・アントニオ・ボルジェーゼ,juzeppe・antonio・borujēze
michele paramatti,ミチェーレ・パラマッティ,michēre・paramatti
emilio bianchi,エミリオ・ビアンキ,emirio・bianki
marcello dudovich,マルチェッロ・ドゥドヴィック,marucherro・dudovikku
luca vigiani,ルカ・ヴィジャーニ,ruka・vijāni
michele cimarosa,ミケーレ・チマローザ,mikēre・chimarōza
giulio ricciarelli,ジュリオ・リッチャレッリ,jurio・ritcharerri
giulio manfredonia,ジュリオ・マンフレドニア,jurio・manfuredonia
giuseppe capotondi,ジュゼッペ・カポトンディ,juzeppe・kapotondi
giuseppe cocconi,ジュゼッペ・コッコーニ,juzeppe・kokkōni
nadya ochner,ナディア・オホナー,nadia・ohonā
nando angelini,ナンド・アンジェリーニ,nando・anjerīni
rodolfo lipizer,ロドルフォ・リピツァー,rodorufo・ripitsā
franca viola,フランカ・ヴィオラ,furanka・viora
franco lerda,フランコ・レルダ,furanko・reruda
felice natalino,フェリチェ・ナタリーノ,feriche・natarīno
ivano beggio,イバノ・バッジオ,ibano・bajjio
ivan artipoli,イヴァン・アルティポリ,ivan・arutipori
dino alfieri,ディーノ・アルフィエリ,dīno・arufieri
giuseppe sulfaro,ジュゼッペ・スルファーロ,juzeppe・surufāro
giuseppe vari,ジュゼッペ・ヴァリ,juzeppe・vari
giuseppe fiorello,ジュゼッペ・フィオーレロ,juzeppe・fiōrero
massimo introvigne,マッシモ・イントロヴィーニャ,masshimo・intorovīnya
giuliano urbani,ジュリアーノ・ウルバーニ,juriāno・urubāni
martina grimaldi,マルティナ・グリマルディ,marutina・gurimarudi
marina lotar,マリナ・ヘドマン,marina・hedoman
nunzio giuliano,ヌンツィオ・ジュリアーノ,nuntsio・juriāno
giuseppe virgili,ジュゼッペ・ヴィルジーリ,juzeppe・virujīri
giuseppe wilson,ジュゼッペ・ウィルソン,juzeppe・wiruson
giuseppe romagnoli,ジュゼッペ・ロマニョーリ,juzeppe・romanyōri
salvo lima,サルヴォ・リマ,saruvuォ・rima
roberto infascelli,ロベルト・インファセッリ,roberuto・infaserri
nerio bernardi,ネリオ・ベルナルディ,nerio・berunarudi
nicola boem,ニコラ・ボエム,nikora・boemu
joseph zoderer,ヨーゼフ・ツォーデラー,yōzefu・tsōderā
manlio rocchetti,マンリオ・ロケッティ,manrio・roketti
nadir caselli,ナーディル・カゼッリ,nādiru・kazerri
sergio luzzatto,セルジョ・ルッツァット,serujo・ruttsatto
nicola samale,ニコラ・サマーレ,nikora・samāre
sergio graziani,セルジオ・グラツィアーニ,serujio・guratsiāni
sergio garrone,セルジオ・ガローネ,serujio・garōne
luigi raimondi,ルイージ・ライモンディ,ruīji・raimondi
diego de ascentis,ディエゴ・デ・アシェンティス,diego・de・ashentisu
pio la torre,ピオ・ラ・トッレ,pio・ra・torre
paolo romani,パオロ・ロマーニ,paoro・romāni
fiorella mannoia,フィオレッラ・マンノイア,fiorerra・mannoia
vincenzo scotti,ヴィンチェンツォ・スコッティ,vinchentso・sukotti
giovanni campari,ジョヴァンニ・カンパーリ,jovanni・kanpāri
romolo tavoni,ロモロ・タヴォーニ,romoro・tavuォーni
andrea campagnolo,アンドレア・カンパニョーロ,andorea・kanpanyōro
stefano desideri,ステファーノ・デジデーリ,sutefāno・dejidēri
migidio bourifa,ミジーディオ・ブーリファ,mijīdio・būrifa
leo valiani,レオ・ヴァリアーニ,reo・variāni
milo campari,ミロ・カンパーリ,miro・kanpāri
don fanucci,ドン・ファヌッチ,don・fanutchi
mario caroli,マリオ・カーロリ,mario・kārori
pinuccio ardia,ピヌッチオ・アルディア,pinutchio・arudia
corrado barazzutti,コラド・バラズッティ,korado・barazutti
andrea lo cicero,アンドレア・ロ・チチェロ,andorea・ro・chichero
ninni bruschetta,ニンニ・ブルスケッタ,ninni・burusuketta
silverio blasi,シルヴェリオ・ブラージ,shiruvuェrio・burāji
daniele zoratto,ダニエレ・ゾラット,daniere・zoratto
andrea camplone,アンドレア・カンプローネ,andorea・kanpurōne
nino fuscagni,ニノ・フスカニ,nino・fusukani
scapino,スカピーノ,sukapīno
gonzalo canale,ゴンザーロ・カナーレ,gonzāro・kanāre
silvano ippoliti,シルヴァーノ・イッポリーティ,shiruvāno・ipporīti
salvatore cardillo,サルヴァトーレ・カルディッロ,saruvatōre・karudirro
luigi scarabello,ルイジ・スカラベッロ,ruiji・sukaraberro
joseph janni,ジョゼフ・ジャンニ,jozefu・janni
tiziano dall'antonia,ティツィアーノ・ダッラントニア,titsiāno・darrantonia
mario martiradonna,マリオ・マルティラドンナ,mario・marutiradonna
ludovica modugno,ルドヴィカ・モドゥーニョ,rudovika・modūnyo
jules rossi,ユレス・ロッシ,yuresu・rosshi
rino vernizzi,リノ・ベルニッツィ,rino・berunittsi
maurizio ferrini,マウリツィオ・フェッリーニ,mauritsio・ferrīni
manfredo tafuri,マンフレッド・タフーリ,manfureddo・tafūri
carlo galli,カルロ・ガッリ,karuro・garri
aldo cantarutti,アルド・カンタルッティ,arudo・kantarutti
aligi sassu,アリギ・サッス,arigi・sassu
simone massi,シモーネ・マッシ,shimōne・masshi
néstor fabbri,ネストール・ファブリ,nesutōru・faburi
silvia mezzanotte,シルビア・メザノット,shirubia・mezanotto
ginevra elkann,ジネヴラ・エルカン,jinevura・erukan
carlo agostoni,カルロ・アゴストーニ,karuro・agosutōni
pippo franco,ピッポ・フランコ,pippo・furanko
diego ronchini,ディエゴ・ロンキーニ,diego・ronkīni
vincenzo amato,ヴィンチェンツォ・アマート,vinchentso・amāto
francesco golisano,フランチェスコ・ゴリザーノ,furanchesuko・gorizāno
spartaco bandinelli,スパルタコ・バンディネッリ,suparutako・bandinerri
paolo bortoluzzi,パオロ・ボルトルッツィ,paoro・borutoruttsi
peter kolosimo,ピーター・コロシモ,pītā・koroshimo
luciano armani,ルチアーノ・アルマーニ,ruchiāno・arumāni
francesco albanese,フランチェスコ・アルバネーゼ,furanchesuko・arubanēze
antonio pagani,アントニオ・パガニン,antonio・paganin
verena buratti,ヴェレーナ・ブラッティ,vuェrēna・buratti
fabiano fontanelli,ファビアーノ・フォンタネッリ,fabiāno・fontanerri
antonio tartaglia,アントニア・タルタリア,antonia・tarutaria
massimiliano cappellini,マッシミリアーノ・カッペッリーニ,masshimiriāno・kapperrīni
giovanni de prà,ジョヴァンニ・デ・プラ,jovanni・de・pura
michael tumi,マイケル・トゥミ,maikeru・tumi
emanuele cavalli,エマニュエル・カヴァッリ,emanyueru・kavarri
nicolangelo carnimeo,ニコランジェロ・カルニメオ,nikoranjero・karunimeo
nicola trussardi,ニコラ・トラサルディ,nikora・torasarudi
alessandro pierini,アレッサンドロ・ピエリーニ,aressandoro・pierīni
tanino liberatore,タニノ・リベラトーレ,tanino・riberatōre
attilio degrassi,アッティリオ・デグラッシ,attirio・degurasshi
anthony louis scarmolin,アンソニー・ルイス・スカーモリン,ansonī・ruisu・sukāmorin
giulio de vita,ジュリオ・デ・ヴィータ,jurio・de・vīta
francesca lollobrigida,フランチェスカ・ロロブリジーダ,furanchesuka・roroburijīda
turi vasile,トゥーリ・ヴァジーレ,tūri・vajīre
manlio sgalambro,マンリオ・スガランブロ,manrio・sugaranburo
sofia goggia,ソフィア・ゴッジア,sofia・gojjia
jimmy fontana,ジミー・フォンタナ,jimī・fontana
pierangelo garegnani,ビエランジェロ・ガレニャーニ,bieranjero・garenyāni
ivan graziani,イヴァン・グラツィアーニ,ivan・guratsiāni
adriano olivetti,アドリアーノ・オリヴェッティ,adoriāno・orivuェtti
lia origoni,リア・オリゴーニ,ria・origōni
dario cerrato,ダリオ・チェラート,dario・cherāto
franco rotella,フランコ・ロテラ,furanko・rotera
pietro belluschi,ピエトロ・ベルスキ,pietoro・berusuki
oreste coltellacci,オレステ・コルテラッチ,oresute・koruteratchi
piero regnoli,ピエロ・レニョーリ,piero・renyōri
federico dionisi,フェデリコ・ディオニージ,federiko・dionīji
nunzio daniele lombardi,ヌンツィオ・ダニエーレ・ロンバルディ,nuntsio・daniēre・ronbarudi
riccardo nencini,リカルド・ネンシーニ,rikarudo・nenshīni
oscar brazzi,オスカル・ブラッツィ,osukaru・burattsi
ottavio alessi,オッタヴィオ・アレッシ,ottavio・aresshi
elisabetta dami,エリザベッタ・ダミ,erizabetta・dami
albert spaggiari,アルベール・スパジアリ,arubēru・supajiari
osvaldo civirani,オズワルド・チヴィラーニ,ozuwarudo・chivirāni
osvaldo desideri,オズワルド・デシデーリ,ozuwarudo・deshidēri
luigi scaccianoce,ルイジ・スカッチャノーチェ,ruiji・sukatchanōche
alfonso gatto,アルフォンソ・ガット,arufonso・gatto
brunello spinelli,ブルネッロ・スピネッリ,burunerro・supinerri
piero angela,ピエロ・アンジェラ,piero・anjera
alfonso angelini,アルフォンソ・アンジェリーニ,arufonso・anjerīni
silvio cadelo,シルヴィオ・カデロ,shiruvio・kadero
salvatore burruni,サルバトーレ・ブルニ,sarubatōre・buruni
antonio scaduto,アントニオ・スカドゥート,antonio・sukadūto
ventzislav simeonov,ベンツィスラフ・シメオノフ,bentsisurafu・shimeonofu
ilaria graziano,イラリア・グラツィアーノ,iraria・guratsiāno
edoardo ballerini,エドアルド・バレリーニ,edoarudo・barerīni
lorenzo mongiardino,ロレンツォ・モンジャルディーノ,rorentso・monjarudīno
placido rizzotto,プラーチド・リッツォット,purāchido・rittsotto
jessica tomasi,ジェシカ・トマージ,jeshika・tomāji
al campanis,アル・キャンパニス,aru・kyanpanisu
albert one,アルベルト・カルパーニ,aruberuto・karupāni
stefano carobbi,ステファノ・カロッビ,sutefano・karobbi
francesca rio,フランチェスカ・リオ,furanchesuka・rio
ezio capuano,エツィオ・カプアーノ,etsio・kapuāno
alberta ferretti,アルベルタ・フェレッティ,aruberuta・feretti
isa danieli,イサ・ダニエリ,isa・danieri
abate faria,アベ・ファリア,abe・faria
adriano rimoldi,アドリアーノ・リモルディ,adoriāno・rimorudi
adelaide ametis,アデライデ・アメティス,aderaide・ametisu
paolo berlusconi,パオロ・ベルルスコーニ,paoro・berurusukōni
angelo del boca,アンジェロ・デル・ボカ,anjero・deru・boka
stefano sibaldi,ステファノ・シバルディ,sutefano・shibarudi
mario moretti,マリオ・モレッティ,mario・moretti
paolo bordoni,パオロ・ボルドーニ,paoro・borudōni
paolo cottignola,パオロ・コッティニョーラ,paoro・kottinyōra
anna maria tarantola,アンナ・マリア・タラントラ,anna・maria・tarantora
paolo carignani,パオロ・カリニャーニ,paoro・karinyāni
angelo tarchi,アンジェロ・タルキ,anjero・taruki
paolo ferrero,パオロ・フェレーロ,paoro・ferēro
alberto de marchi,アルベルト・デ・マルキ,aruberuto・de・maruki
alberto marini,アルベルト・マリーニ,aruberuto・marīni
leonardo pinizzotto,レオナルド・ピニツォット,reonarudo・pinitsotto
angiolo gabrielli,アンジョロ・ガブリエッリ,anjoro・gaburierri
aldo silvani,アルド・シルヴァーニ,arudo・shiruvāni
alberto sorbelli,アルベルト・ソルベリ,aruberuto・soruberi
donato creti,ドナート・クレティ,donāto・kureti
raffaele pinto,ラッファエレ・ピント,raffaere・pinto
carlo gabriel nero,カルロ・ガブリエル・ネロ,karuro・gaburieru・nero
alessandra bianchi,アレッサンドラ・ビアンキ,aressandora・bianki
greta zocca,グレタ・ゾッカ,gureta・zokka
teresa saponangelo,テレーザ・サポナンジェロ,terēza・saponanjero
anna cataldi,アンナ・カタルディ,anna・katarudi
loris dominissini,ロリス・ドミニッシーニ,rorisu・dominisshīni
antonia terzi,アントニア・テルッツィ,antonia・teruttsi
tosca,トスカ,tosuka
alessandro riccitelli,アレッサンドロ・リッチテッリ,aressandoro・ritchiterri
cristian stoica,クリスティアン・ストイカ,kurisutian・sutoika
fabrice de nola,ファブリス・デ・ノーラ,faburisu・de・nōra
alessio galante,アレッシオ・ガラント,aresshio・garanto
pamela villoresi,パメラ・ヴィロレッジ,pamera・virorejji
alessandro iannuzzi,アレッサンドロ・イアンヌッツィ,aressandoro・iannuttsi
uberto pasolini,ウベルト・パゾリーニ,uberuto・pazorīni
isabella cortese,イザベッラ・コルテーゼ,izaberra・korutēze
guido bertolaso,グイード・ベルトラーゾ,guīdo・berutorāzo
guido pontecorvo,グイド・ポンテコルヴォ,guido・pontekoruvuォ
laudec,ラウデック,raudekku
alessio secco,アレッシオ・セッコ,aresshio・sekko
annalisa minetti,アンナリーザ・ミネッティ,annarīza・minetti
tony rosato,トニー・ロサト,tonī・rosato
roberto cipriani,ロベルト・チプリアーニ,roberuto・chipuriāni
simone fernando sacconi,シモーネ・フェルナンド・サッコーニ,shimōne・ferunando・sakkōni
antonio recalcati,アントニオ・レカルカティ,antonio・rekarukati
ugo intini,ウーゴ・インティニ,ūgo・intini
tullio marengoni,トゥリオ・マレンゴーニ,turio・marengōni
antonio bernieri,アントニオ・ベルニエーリ,antonio・beruniēri
antonio cimatori,アントニオ・チマトリ,antonio・chimatori
guido crosetto,グイード・クロセット,guīdo・kurosetto
guido magnone,ギド・マニョーヌ,gido・manyōnu
antonio pavanello,アントニオ・パヴァネッロ,antonio・pavanerro
assunta de rossi,アスンタ・デ・ロッシ,asunta・de・rosshi
piero coppola,ピエロ・コッポラ,piero・koppora
antonio latella,アントニオ・ラテラ,antonio・ratera
antonio mancuso,アントニオ・マンクーゾ,antonio・mankūzo
antonio percassi,アントニオ・ペルカッシ,antonio・perukasshi
alfredo frassati,アルフレード・フラッサーティ,arufurēdo・furassāti
alfredo mantica,アルフレード・マンティコ,arufurēdo・mantiko
fausto melotti,ファウスト・メロッティ,fausuto・merotti
ugo orlandi,ウーゴ・オルランディ,ūgo・orurandi
armando dell'aquila,アルマンド・デッラクィラ,arumando・derrakwira
ugo fangareggi,ウーゴ・ファンガレッジ,ūgo・fangarejji
vanessa gravina,ヴァネッサ・グラヴィーナ,vanessa・guravīna
valerio lualdi,ヴァレリオ・ルアルディ,varerio・ruarudi
lucio bini,ルシオ・ビニ,rushio・bini
barbara canepa,バルバラ・カネパ,barubara・kanepa
barbara magnolfi,バーバラ・マグノルフィ,bābara・magunorufi
josh sole,ジョシュ・ソール,joshu・sōru
italo vassallo,イタロ・ヴァッサロ,itaro・vassaro
italo brancucci,イタロ・ブランクッチ,itaro・burankutchi
arturo gallea,アルトゥーロ・ガッレア,arutūro・garrea
aida boni,アイーダ・ボニ,aīda・boni
aurelio mancuso,アウレリオ・マンクーゾ,aurerio・mankūzo
donatella finocchiaro,ドナテッラ・フィノッキアーロ,donaterra・finokkiāro
ivo ferriani,イヴォ・フェッリアーニ,ivuォ・ferriāni
andrea branzi,アンドレア・ブランジ,andorea・buranji
piero badaloni,ピエロ・バダローニ,piero・badarōni
aldo mieli,アルド・ミエリ,arudo・mieri
elena zareschi,エレナ・ザレスキ,erena・zaresuki
andrea soncin,アンドレア・ソンチン,andorea・sonchin
marco minniti,マルコ・ミンニティ,maruko・minniti
joseph lanza,ジョー・ランザ,jō・ranza
adriano pappalardo,エイドリアーノ・パパラード,eidoriāno・paparādo
tanio boccia,タニオ・ボッチャ,tanio・botcha
matías caruzzo,マティアス・カルッソ,matiasu・karusso
vannino chiti,ヴァニーノ・キーティ,vanīno・kīti
piera degli esposti,ピエラ・デッリ・エスポスティ,piera・derri・esuposuti
jules brocherel,ジュール・ブロチェレル,jūru・burochereru
benjamin de jager,ベンジャミン・デ・ヤーゲル,benjamin・de・yāgeru
barbara alberti,バーバラ・アルベルティ,bābara・aruberuti
vittorio munari,ヴィットーリオ・ムナーリ,vittōrio・munāri
katia bellillo,カティア・ベルリッロ,katia・berurirro
andrea manfredi,アンドレア・マンフレディ,andorea・manfuredi
nazzareno carusi,ナッツァレーノ・カルージ,nattsarēno・karūji
andrea procaccini,アンドレア・プロカッチーニ,andorea・purokatchīni
carlo cossutta,カルロス・コスッタ,karurosu・kosutta
aldo de benedetti,アルド・デ・ベネデッティ,arudo・de・benedetti
guglielmo cavallo,グリエルモ・カヴァッロ,gurierumo・kavarro
walter pozzebon,ヴァルテル・ポッツェボン,varuteru・pottsebon
antonino faà di bruno,アントニーノ・ファ・ディ・ブルーノ,antonīno・fa・di・burūno
giovanni grazzini,ジョヴァンニ・グラッツィーニ,jovanni・gurattsīni
kaine robertson,ケイン・ロバートソン,kein・robātoson
valerio tebaldi,ヴァレリオ・テバルディ,varerio・tebarudi
alberto lionello,アルベルト・リオネッロ,aruberuto・rionerro
quinto parmeggiani,クイント・パルメッジャーニ,kuinto・parumejjāni
gianfranco franchini,チャンフランコ・フランキーニ,chanfuranko・furankīni
aldo lampredi,アルド・ランプレーディ,arudo・ranpurēdi
ginevra bompiani,ジネーヴラ・ボンピアーニ,jinēvura・bonpiāni
gian piero brunetta,ジャン・ピエロ・ブルネッタ,jan・piero・burunetta
kristian sbaragli,クリスティアン・ズバラーリ,kurisutian・zubarāri
vitale bramani,ビターレ・ブラマニー,bitāre・buramanī
vito d'ambrosio,ヴィトー・ダンブロシオ,vitō・danburoshio
marco müller,マルコ・ミュラー,maruko・myurā
aldo dolcetti,アルド・ドルチェッティ,arudo・doruchetti
angelo barbagallo,アンジェロ・バルバガッロ,anjero・barubagarro
achille longo,アキッレ・ロンゴ,akirre・rongo
gianfranco marzolla,ジャンフランコ・マルツォッラ,janfuranko・marutsorra
teresio ferraroni,テレージオ・フェッラローニ,terējio・ferrarōni
terisio pignatti,テリージョ・ピニャッティ,terījo・pinyatti
erika fasana,エリカ・ファサナ,erika・fasana
desmond n'ze,デズモンド・エンゼ,dezumondo・enze
tebaldo,ティボルト,tiboruto
aldo monza,アルド・モンツァ,arudo・montsa
laura gore,ラウラ・ゴア,raura・goa
achille mario dogliotti,アキレ・マリオ・ドリオッティ,akire・mario・doriotti
aldo gabrielli,アルド・ガブリエッリ,arudo・gaburierri
lazzaro baldi,ラザロ・バルディ,razaro・barudi
aminta migliari,アミンタ・ミグリアリ,aminta・miguriari
laura saccomani,ラウラ・サッコマーニ,raura・sakkomāni
andrea agnello,アンドレア・アニェーロ,andorea・aniェーro
aldo raimondi,アルド・ライモンディ,arudo・raimondi
achille manzotti,アキッレ・マンツォッティ,akirre・mantsotti
achille majeroni,アキッレ・マイェローニ,akirre・mayerōni
fabrizio rongione,ファブリツィオ・ロンジョーネ,faburitsio・ronjōne
letizia camera,レティツィア・カーメラ,retitsia・kāmera
elisabetta preziosa,エリザベッタ・プレッツィオーザ,erizabetta・purettsiōza
vincenzo martellotta,ヴィチェンツォ・マッテロッタ,vichentso・matterotta
amir issaa,アミール・イッサ,amīru・issa
natale de carolis,ナターレ・デ・カロリス,natāre・de・karorisu
bona,ボナ,bona
aldo puglisi,アルド・プリージ,arudo・purīji
raffaele rossetti,ラファエル・ロセッティ,rafaeru・rosetti
sergio gobbi,セルジョ・ゴッビ,serujo・gobbi
sandro bono,サンドロ・ボーノ,sandoro・bōno
andrea bonistalli,アンドレア・ボニスタッリ,andorea・bonisutarri
callisto piazza,カッリスト・ピアッツァ,karrisuto・piattsa
loredano ugolini,ロレダノ・ウゴリーニ,roredano・ugorīni
oleg caetani,オレグ・カエターニ,oregu・kaetāni
anchise brizzi,アンキーゼ・ブリッツィ,ankīze・burittsi
aldo ralli,アルド・ラッリ,arudo・rarri
aldo reggiani,アルド・レジアーニ,arudo・rejiāni
lorenzo cittadini,ロレンツォ・チッタディーニ,rorentso・chittadīni
camélia liparoti,カメリア・リパロティ,kameria・riparoti
carla accardi,カルラ・アッカルディ,karura・akkarudi
carlo capone,カルロ・カポネ,karuro・kapone
aldo tommasini,アルド・トマシーニ,arudo・tomashīni
carlo ninchi,カルロ・ニンキ,karuro・ninki
bruno salvadori,ブルーノ・サルヴァドーリ,burūno・saruvadōri
carlo crivelli,カルロ・クリヴェッリ,karuro・kurivuェrri
luca wackermann,ルーカ・ワッケルマン,rūka・wakkeruman
carlo festuccia,カルロ・フェストゥッチャ,karuro・fesututcha
luca rangoni,ルカ・ランゴーニ,ruka・rangōni
andrea augello,アンドレア・アウジェッロ,andorea・aujerro
luca penni,ルカ・ペンニ,ruka・penni
aldo vidussoni,アルド・ヴィドゥソーニ,arudo・vidusōni
carmine recano,カルミネ・レカーノ,karumine・rekāno
adele faccio,アデレ・ファッチョ,adere・fatcho
adelio cogliati,アデーリオ・コリアーティ,adērio・koriāti
adelio crespi,アデーリオ・クレスピ,adērio・kuresupi
adelio terraroli,アデーリオ・テッラローリ,adērio・terrarōri
andrea bruschi,アンドレア・ブルスチ,andorea・burusuchi
luigi cosenza,ルイージ・コセンツァ,ruīji・kosentsa
luigi busà,ルイージ・ブザ,ruīji・buza
adelchi serena,アデルキ・セレーナ,aderuki・serēna
gianluca savoldi,ジャンルカ・サヴォルディ,janruka・savuォrudi
andrea fabbrini,アンドレア・ファッブリーニ,andorea・fabburīni
andrea coppola,アンドレア・コッポラ,andorea・koppora
adriana ivancich,アドリアーナ・イヴァンチッチ,adoriāna・ivanchitchi
luciano orquera,ルチアーノ・オルケーラ,ruchiāno・orukēra
luciano ramella,ルチアーノ・ラメッラ,ruchiāno・ramerra
adriana russo,アドリアーナ・ルッソ,adoriāna・russo
adriana benetti,アドリアーナ・ベネッティ,adoriāna・benetti
ettore maria margadonna,エットーレ・マリア・マルガドンナ,ettōre・maria・marugadonna
alessandra costanzo,アレッサンドラ・コスタンゾ,aressandora・kosutanzo
marco canola,マルコ・カノーラ,maruko・kanōra
luigi vannucchi,ルイジ・ヴァンヌッキ,ruiji・vannukki
adriana guerrini,アドリアーナ・グェリーニ,adoriāna・guェrīni
adriana libretti,アドリアナ・リブレッティ,adoriana・riburetti
adriano aragozzini,アドリアーノ・アラゴッツィーニ,adoriāno・aragottsīni
adriano baracco,アドリアーノ・バラッコ,adoriāno・barakko
pietro pipolo,ピエトロ・ピポロ,pietoro・piporo
bruno arena,ブルーノ・アリーナ,burūno・arīna
massimiliano cavallari,マックス・カヴァラーリ,makkusu・kavarāri
luigi quagliata,ルイジ・カグリアータ,ruiji・kaguriāta
luigi riccio,ルイージ・リッチョ,ruīji・ritcho
andrea ichino,アンドレア・イチノ,andorea・ichino
manoa vosawai,マノア・ヴォサワイ,manoa・vuォsawai
alessandra ierse,アレッサンドラ・イルセ,aressandora・iruse
chiara francini,キアラ・フランシーニ,kiara・furanshīni
adriano micantoni,アドリアーノ・ミカントーニ,adoriāno・mikantōni
adriano lualdi,アドリアーノ・ルアルディ,adoriāno・ruarudi
marco brambilla,マルコ・ブランミッラ,maruko・buranmirra
marco guidarini,マルコ・グィダリーニ,maruko・guィdarīni
marco pacione,マルコ・パチョーネ,maruko・pachōne
ciro petrone,チーロ・ペトローネ,chīro・petorōne
marco mancassola,マルコ・マンカッソーラ,maruko・mankassōra
agata flori,アガタ・フローリ,agata・furōri
adriano graziano,アドリアーノ・グラツィアーノ,adoriāno・guratsiāno
corrado guarducci,コラド・ガルデュッシ,korado・garudyusshi
marcella crudeli,マルチェッラ・クルデーリ,marucherra・kurudēri
laurent ottoz,ローラン・オットツ,rōran・ottotsu
andrea mangiante,アンドレア・マンジャンテ,andorea・manjante
claudio maccone,クラウディオ・マッコーネ,kuraudio・makkōne
giovanni francesco romanelli,ジョヴァンニ・フランチェスコ・ロマネッリ,jovanni・furanchesuko・romanerri
marco messeri,マルコ・メッセーリ,maruko・messēri
alessandro bono,アレッサンドロ・ボーノ,aressandoro・bōno
