lionel messi,リオネル・メッシ,rioneru・messhi
massimo troisi,マッシモ・トロイージ,masshimo・toroīji
ettore scola,エットーレ・スコラ,ettōre・sukora
ilan araújo dall'igna,イラン・アラウージョ・ダッリーニャ,iran・araūjo・darrīnya
antonio pietrangeli,アントニオ・ピエトランジェリ,antonio・pietoranjeri
gabriele salvatores,ガブリエレ・サルヴァトレス,gaburiere・saruvatoresu
ferzan özpetek,フェルザン・オズペテク,feruzan・ozupeteku
salvatore quasimodo,サルヴァトーレ・クァジモド,saruvatōre・kuァjimodo
nino manfredi,ニーノ・マンフレディ,nīno・manfuredi
augusto genina,アウグスト・ジェニーナ,augusuto・jenīna
sandro pertini,アレッサンドロ・ペルティーニ,aressandoro・perutīni
francesco cossiga,フランチェスコ・コッシガ,furanchesuko・kosshiga
alessandro matri,アレッサンドロ・マトリ,aressandoro・matori
robert de niro,ロバート・デ・ニーロ,robāto・de・nīro
vittorio gassman,ヴィットリオ・ガスマン,vittorio・gasuman
damiano damiani,ダミアーノ・ダミアーニ,damiāno・damiāni
andrea segre,アンドレア・セグレ,andorea・segure
giuseppe battiston,ジュゼッペ・バッティストン,juzeppe・battisuton
guido calabresi,グイド・カラブレイジ,guido・karabureiji
angelo di livio,アンジェロ・ディ・リービオ,anjero・di・rībio
giovanni gronchi,ジョヴァンニ・グロンキ,jovanni・guronki
antonio segni,アントニオ・セーニ,antonio・sēni
giuseppe saragat,ジュゼッペ・サーラガト,juzeppe・sāragato
giovanni leone,ジョヴァンニ・レオーネ,jovanni・reōne
luciano pavarotti,ルチアーノ・パヴァロッティ,ruchiāno・pavarotti
romano prodi,ロマーノ・プローディ,romāno・purōdi
ugo tognazzi,ウーゴ・トニャッツィ,ūgo・tonyattsi
gina lollobrigida,ジーナ・ロロブリジーダ,jīna・roroburijīda
luigi zampa,ルイジ・ザンパ,ruiji・zanpa
alessandro del piero,アレッサンドロ・デル・ピエロ,aressandoro・deru・piero
eugenio montale,エウジェーニオ・モンターレ,eujēnio・montāre
marcello mastroianni,マルチェロ・マストロヤンニ,maruchero・masutoroyanni
elio petri,エリオ・ペトリ,erio・petori
giuseppe tornatore,ジュゼッペ・トルナトーレ,juzeppe・torunatōre
carlo azeglio ciampi,カルロ・アツェリオ・チャンピ,karuro・atserio・chanpi
carlo verdone,カルロ・ヴェルドーネ,karuro・vuェrudōne
federico marchetti,フェデリコ・マルケッティ,federiko・maruketti
giorgio napolitano,ジョルジョ・ナポリターノ,jorujo・naporitāno
franco zeffirelli,フランコ・ゼフィレッリ,furanko・zefirerri
valerio zurlini,ヴァレリオ・ズルリーニ,varerio・zururīni
steno,ステーノ,sutēno
francesco rosi,フランチェスコ・ロージ,furanchesuko・rōji
mario bava,マリオ・バーヴァ,mario・bāva
pupi avati,プピ・アヴァティ,pupi・avati
liliana cavani,リリアーナ・カヴァーニ,ririāna・kavāni
walter bonatti,ヴァルテル・ボナッティ,varuteru・bonatti
michelangelo antonioni,ミケランジェロ・アントニオーニ,mikeranjero・antoniōni
sergio corbucci,セルジオ・コルブッチ,serujio・korubutchi
emanuele crialese,エマヌエーレ・クリアレーゼ,emanuēre・kuriarēze
monica bellucci,モニカ・ベルッチ,monika・berutchi
oscar luigi scalfaro,オスカル・ルイージ・スカルファロ,osukaru・ruīji・sukarufaro
camila giorgi,カミラ・ジョルジ,kamira・joruji
giorgio chiellini,ジョルジョ・キエッリーニ,jorujo・kierrīni
gennaro gattuso,ジェンナーロ・ガットゥーゾ,jennāro・gattūzo
noemi,ノエミ,noemi
diego abatantuono,ディエゴ・アバタントゥオーノ,diego・abatantuōno
valentina cervi,ヴァレンティナ・チェルヴィ,varentina・cheruvi
sandro lopopolo,サンドロ・ロポポロ,sandoro・ropoporo
dario fo,ダリオ・フォ,dario・fo
ludovico einaudi,ルドヴィコ・エイナウディ,rudoviko・einaudi
luciano liggio,ルチアーノ・リッジョ,ruchiāno・rijjo
iván piris,イバン・ピリス,iban・pirisu
paola ruffo di calabria,パオラ・ルッフォ・ディ・カラブリア,paora・ruffo・di・karaburia
emiliano sala,エミリアーノ・サラ,emiriāno・sara
andrea chiesa,アンドレア・キエーザ,andorea・kiēza
carlo clerici,カルロ・クレリーチ,karuro・kurerīchi
alfredo dinale,アルフレード・ディナーレ,arufurēdo・dināre
valentino gasparella,ヴァレンティーノ・ガスパレッラ,varentīno・gasuparerra
antonio candreva,アントニオ・カンドレーヴァ,antonio・kandorēva
lina wertmüller,リナ・ウェルトミューラー,rina・werutomyūrā
gustav thöni,グスタヴォ・トエニ,gusutavuォ・toeni
deborah compagnoni,デボラ・コンパニョーニ,debora・konpanyōni
alberto tomba,アルベルト・トンバ,aruberuto・tonba
nino farina,ジュゼッペ・ファリーナ,juzeppe・farīna
cesare pavese,チェーザレ・パヴェーゼ,chēzare・pavuェーze
sophia loren,ソフィア・ローレン,sofia・rōren
marcello lippi,マルチェロ・リッピ,maruchero・rippi
enrico de nicola,エンリコ・デ・ニコラ,enriko・de・nikora
luigi einaudi,ルイージ・エイナウディ,ruīji・einaudi
alberto lattuada,アルベルト・ラットゥアーダ,aruberuto・rattuāda
ricardo martinelli,リカルド・マルティネリ,rikarudo・marutineri
valentina arrighetti,ヴァレンティナ・アリゲッティ,varentina・arigetti
giorgio francia,ジョルジオ・フランシア,jorujio・furanshia
primo nebiolo,プリモ・ネビオロ,purimo・nebioro
fabrizio donato,ファブリツィオ・ドナート,faburitsio・donāto
mauro goicoechea,マウロ・ゴイコエチェア,mauro・goikoechea
anita pallenberg,アニタ・パレンバーグ,anita・parenbāgu
danilo gallinari,ダニーロ・ガリナリ,danīro・garinari
mario soldati,マリオ・ソルダーティ,mario・sorudāti
fabio cannavaro,ファビオ・カンナヴァーロ,fabio・kannavāro
rocco siffredi,ロッコ・シフレディ,rokko・shifuredi
emanuele filiberto di savoia,エマヌエーレ・フィリベルト・ディ・サヴォイア,emanuēre・firiberuto・di・savuォia
kaspar capparoni,カスパー・カパローニ,kasupā・kaparōni
romeo bertini,ロメオ・ベルティーニ,romeo・berutīni
gianni infantino,ジャンニ・インファンティーノ,janni・infantīno
valerio arri,ヴァレリオ・アリ,varerio・ari
filippo inzaghi,フィリッポ・インザーギ,firippo・inzāgi
massimo oddo,マッシモ・オッド,masshimo・oddo
martin scorsese,マーティン・スコセッシ,mātin・sukosesshi
andrea bocelli,アンドレア・ボチェッリ,andorea・bocherri
luciano moggi,ルチアーノ・モッジ,ruchiāno・mojji
roberta vinci,ロベルタ・ビンチ,roberuta・binchi
anna magnani,アンナ・マニャーニ,anna・manyāni
alberto ascari,アルベルト・アスカリ,aruberuto・asukari
totò,トト,toto
andrea pirlo,アンドレア・ピルロ,andorea・piruro
tarcisio bertone,タルチジオ・ベルトーネ,taruchijio・berutōne
marco borriello,マルコ・ボリエッロ,maruko・borierro
giorgio pantano,ジョルジオ・パンターノ,jorujio・pantāno
christian abbiati,クリスティアン・アッビアーティ,kurisutian・abbiāti
josé altafini,ジョゼ・アルタフィーニ,joze・arutafīni
yves montand,イヴ・モンタン,ivu・montan
virna lisi,ヴィルナ・リージ,viruna・rīji
giovanni trapattoni,ジョバンニ・トラパットーニ,jobanni・torapattōni
nicola amoruso,ニコラ・アモルーゾ,nikora・amorūzo
paolo di canio,パオロ・ディ・カーニオ,paoro・di・kānio
monica vitti,モニカ・ヴィッティ,monika・vitti
giuseppe olmo,ジュゼッペ・オルモ,juzeppe・orumo
silvana mangano,シルヴァーナ・マンガーノ,shiruvāna・mangāno
giulietta masina,ジュリエッタ・マシーナ,jurietta・mashīna
eugenio calabi,エウジェニオ・カラビ,eujenio・karabi
sara simeoni,サラ・シメオニ,sara・shimeoni
pietro mennea,ピエトロ・メンネア,pietoro・mennea
pietro anastasi,ピエトロ・アナスタージ,pietoro・anasutāji
francesca piccinini,フランチェスカ・ピッチニーニ,furanchesuka・pitchinīni
manolo gabbiadini,マノロ・ガッビアディーニ,manoro・gabbiadīni
maria montessori,マリア・モンテッソーリ,maria・montessōri
claudio pizarro,クラウディオ・ピサーロ,kuraudio・pisāro
mario balotelli,マリオ・バロテッリ,mario・baroterri
renato dulbecco,レナート・ドゥルベッコ,renāto・durubekko
federico fellini,フェデリコ・フェリーニ,federiko・ferīni
matteo renzi,マッテオ・レンツィ,matteo・rentsi
pier luigi bersani,ピエル・ルイジ・ベルサーニ,pieru・ruiji・berusāni
agnolo bronzino,アーニョロ・ブロンズィーノ,ānyoro・buronzīno
eddy ottoz,エディ・オットツ,edi・ottotsu
matteo darmian,マッテオ・ダルミアン,matteo・darumian
alida valli,アリダ・ヴァリ,arida・vari
claudia cardinale,クラウディア・カルディナーレ,kuraudia・karudināre
fabio quagliarella,ファビオ・クアリャレッラ,fabio・kuaryarerra
gabriel heinze,ガブリエル・エインセ,gaburieru・einse
gundi busch,ガンディ・ブッシュ,gandi・busshu
raffaele marciello,ラファエル・マルチェッロ,rafaeru・marucherro
marco cimatti,マルコ・チマッティ,maruko・chimatti
marco terrazzino,マルコ・テラッツィーノ,maruko・terattsīno
marco benassi,マルコ・ベナッシ,maruko・benasshi
roberto baggio,ロベルト・バッジョ,roberuto・bajjo
andrea barzagli,アンドレア・バルツァッリ,andorea・barutsarri
leo franco,レオ・フランコ,reo・furanko
antonio di pietro,アントニオ・ディ・ピエトロ,antonio・di・pietoro
ermanno olmi,エルマンノ・オルミ,erumanno・orumi
franco margola,フランコ・マルゴーラ,furanko・marugōra
lola pagnani,ローラ・パニーニ,rōra・panīni
alberto paloschi,アルベルト・パロスキ,aruberuto・parosuki
romeo benetti,ロメオ・ベネッティ,romeo・benetti
alessandro birindelli,アレッサンドロ・ビリンデッリ,aressandoro・birinderri
roberto bettega,ロベルト・ベッテガ,roberuto・bettega
edmond fischer,エドモンド・フィッシャー,edomondo・fisshā
giampiero boniperti,ジャンピエロ・ボニペルティ,janpiero・boniperuti
livio berruti,リビオ・ベルッティ,ribio・berutti
bernardino luini,ベルナルディーノ・ルイーニ,berunarudīno・ruīni
enrico fermi,エンリコ・フェルミ,enriko・ferumi
gianfranco fini,ジャンフランコ・フィーニ,janfuranko・fīni
sergio brio,セルジオ・ブリオ,serujio・burio
daniel bovet,ダニエル・ボベット,danieru・bobetto
massimo d'alema,マッシモ・ダレマ,masshimo・darema
beppe grillo,ベッペ・グリッロ,beppe・gurirro
antonio cabrini,アントニオ・カブリーニ,antonio・kaburīni
gianluigi buffon,ジャンルイジ・ブッフォン,janruiji・buffon
riccardo scamarcio,リッカルド・スカマルチョ,rikkarudo・sukamarucho
julio hernán rossi,フリオ・エルナン・ロッシ,furio・erunan・rosshi
fabrizio miccoli,ファブリツィオ・ミッコリ,faburitsio・mikkori
marco di vaio,マルコ・ディ・ヴァイオ,maruko・di・vaio
mauro icardi,マウロ・イカルディ,mauro・ikarudi
simone collio,シモーネ・コリオ,shimōne・korio
marco cassetti,マルコ・カッセッティ,maruko・kassetti
silvio berlusconi,シルヴィオ・ベルルスコーニ,shiruvio・berurusukōni
emma bonino,エンマ・ボニーノ,enma・bonīno
alberto sordi,アルベルト・ソルディ,aruberuto・sorudi
ilona staller,シュターッレル・イロナ,shutārreru・irona
giulio andreotti,ジュリオ・アンドレオッティ,jurio・andoreotti
parmigianino,パルミジャニーノ,parumijanīno
gae aulenti,ガエ・アウレンティ,gae・aurenti
ildebrando d'arcangelo,イルデブランド・ダルカンジェロ,irudeburando・darukanjero
abdul rahman,アブドル・ラフマン,abudoru・rafuman
ettore sottsass,エットレ・ソットサス,ettore・sottosasu
gianfranco zola,ジャンフランコ・ゾラ,janfuranko・zora
luis durnwalder,ルイス・ドゥルンヴァルダー,ruisu・durunvarudā
giampaolo pozzo,ジャンパオロ・ポッツォ,janpaoro・pottso
andrea stramaccioni,アンドレア・ストラマッチョーニ,andorea・sutoramatchōni
potito starace,ポティート・スタラーチェ,potīto・sutarāche
giuseppe gabrielli,ジュゼッペ・ガブリエッリ,juzeppe・gaburierri
giorgio manganelli,ジョルジョ・マンガネッリ,jorujo・manganerri
giuseppe sinopoli,ジュゼッペ・シノーポリ,juzeppe・shinōpori
stefano mauri,ステファノ・マウリ,sutefano・mauri
leonardo sciascia,レオナルド・シャーシャ,reonarudo・shāsha
damiano cunego,ダミアーノ・クネゴ,damiāno・kunego
gian maria volonté,ジャン・マリア・ヴォロンテ,jan・maria・vuォronte
enzo maresca,エンツォ・マレスカ,entso・maresuka
andrea agnelli,アンドレア・アニェッリ,andorea・aniェrri
gaetano martino,ガエターノ・マルティーノ,gaetāno・marutīno
tommaso rocchi,トンマーゾ・ロッキ,tonmāzo・rokki
alfredo binda,アルフレッド・ビンダ,arufureddo・binda
mario monti,マリオ・モンティ,mario・monti
umberto bossi,ウンベルト・ボッシ,unberuto・bosshi
antonio langella,アントニオ・ランジェッラ,antonio・ranjerra
giorgio rocca,ジョルジョ・ロッカ,jorujo・rokka
giuliano razzoli,ジュリアーノ・ラッツォーリ,juriāno・rattsōri
roberto mancini,ロベルト・マンチーニ,roberuto・manchīni
giovanna mezzogiorno,ジョヴァンナ・メッツォジョルノ,jovanna・mettsojoruno
umberto eco,ウンベルト・エーコ,unberuto・ēko
carlo scarpa,カルロ・スカルパ,karuro・sukarupa
frank capra,フランク・キャプラ,furanku・kyapura
vittorio de sica,ヴィットリオ・デ・シーカ,vittorio・de・shīka
roberto rossellini,ロベルト・ロッセリーニ,roberuto・rosserīni
ivan santaromita,イヴァン・サンタロミータ,ivan・santaromīta
alfred duncan,アルフレッド・ダンカン,arufureddo・dankan
poggio bracciolini,ポッジョ・ブラッチョリーニ,pojjo・buratchorīni
stefano fiore,ステファノ・フィオーレ,sutefano・fiōre
giuseppe giannini,ジュゼッペ・ジャンニーニ,juzeppe・jannīni
arisa,アリーザ,arīza
alessandro blasetti,アレッサンドロ・ブラゼッティ,aressandoro・burazetti
pietro germi,ピエトロ・ジェルミ,pietoro・jerumi
mauro bolognini,マウロ・ボロニーニ,mauro・boronīni
bernardo bertolucci,ベルナルド・ベルトルッチ,berunarudo・berutorutchi
marco bellocchio,マルコ・ベロッキオ,maruko・berokkio
dario argento,ダリオ・アルジェント,dario・arujento
guido brignone,グイド・ブリニョーネ,guido・burinyōne
vanessa beecroft,ヴァネッサ・ビークロフト,vanessa・bīkurofuto
claudio abbado,クラウディオ・アバド,kuraudio・abado
gian francesco malipiero,ジャン・フランチェスコ・マリピエロ,jan・furanchesuko・maripiero
arturo benedetti michelangeli,アルトゥーロ・ベネデッティ・ミケランジェリ,arutūro・benedetti・mikeranjeri
riccardo montolivo,リッカルド・モントリーヴォ,rikkarudo・montorīvuォ
rodolfo graziani,ロドルフォ・グラツィアーニ,rodorufo・guratsiāni
manuele blasi,マヌエレ・ブラージ,manuere・burāji
romano mussolini,ロマーノ・ムッソリーニ,romāno・mussorīni
andrea bosic,アンドレア・ボシック,andorea・boshikku
dario dainelli,ダリオ・ダイネッリ,dario・dainerri
filippa giordano,フィリッパ・ジョルダーノ,firippa・jorudāno
carlo bergonzi,カルロ・ベルゴンツィ,karuro・berugontsi
luigi comencini,ルイジ・コメンチーニ,ruiji・komenchīni
arturo toscanini,アルトゥーロ・トスカニーニ,arutūro・tosukanīni
renato corsetti,レナート・コルセッティ,renāto・korusetti
stephan el shaarawy,ステファン・エル・シャーラウィ,sutefan・eru・shārawi
nanni loy,ナンニ・ロイ,nanni・roi
carmine gallone,カルミネ・ガローネ,karumine・garōne
giuseppe de santis,ジュゼッペ・デ・サンティス,juzeppe・de・santisu
marco ferreri,マルコ・フェレーリ,maruko・ferēri
primo levi,プリーモ・レーヴィ,purīmo・rēvi
michael bublé,マイケル・ブーブレ,maikeru・būbure
oriana fallaci,オリアーナ・ファラーチ,oriāna・farāchi
mario monicelli,マリオ・モニチェリ,mario・monicheri
gillo pontecorvo,ジッロ・ポンテコルヴォ,jirro・pontekoruvuォ
dino risi,ディーノ・リージ,dīno・rīji
giovanni lanfranco,ジョヴァンニ・ランフランコ,jovanni・ranfuranko
elsa respighi,エルザ・レスピーギ,eruza・resupīgi
bobby solo,ボビー・ソロ,bobī・soro
gianluca pessotto,ジャンルカ・ペッソット,janruka・pessotto
mauro maur,マウロ・マウル,mauro・mauru
leonardo piepoli,レオナルド・ピエポリ,reonarudo・piepori
luchino visconti,ルキノ・ヴィスコンティ,rukino・visukonti
margherita hack,マルゲリータ・アック,marugerīta・akku
alex schwazer,アレックス・シュバーツァー,arekkusu・shubātsā
duccio di buoninsegna,ドゥッチョ・ディ・ブオニンセーニャ,dutcho・di・buoninsēnya
eros ramazzotti,エロス・ラマゾッティ,erosu・ramazotti
pablo piatti,パブロ・ピアッティ,paburo・piatti
luca lombardi,ルカ・ロンバルディ,ruka・ronbarudi
andreas seppi,アンドレアス・セッピ,andoreasu・seppi
alcide de gasperi,アルチーデ・デ・ガスペリ,aruchīde・de・gasuperi
walter veltroni,ワルテル・ヴェルトローニ,waruteru・vuェrutorōni
dario cataldo,ダリオ・カタルド,dario・katarudo
luca castellazzi,ルカ・カステラッツィ,ruka・kasuterattsi
gina cigna,ジーナ・チーニャ,jīna・chīnya
maria chiara,マリア・キアーラ,maria・kiāra
maurizio damilano,マウリツイオ・ダミラノ,mauritsuio・damirano
domenico pozzovivo,ドメニコ・ポッツォヴィーヴォ,domeniko・pottsovīvuォ
giuseppe gibilisco,ジュゼッペ・ジビリスコ,juzeppe・jibirisuko
roberto vittori,ロベルト・ヴィットーリ,roberuto・vittōri
virgilio mortari,ヴィルジリオ・モルターリ,virujirio・morutāri
roberto boninsegna,ロベルト・ボニンセーニャ,roberuto・boninsēnya
paolo nespoli,パオロ・ネスポリ,paoro・nesupori
italo calvino,イタロ・カルヴィーノ,itaro・karuvīno
cristian zaccardo,クリスティアン・ザッカルド,kurisutian・zakkarudo
gino bartali,ジーノ・バルタリ,jīno・barutari
giuseppe pella,ジュゼッペ・ペッラ,juzeppe・perra
cecilia bartoli,チェチーリア・バルトリ,chechīria・barutori
luigi dallapiccola,ルイージ・ダッラピッコラ,ruīji・darrapikkora
aldo rossi,アルド・ロッシ,arudo・rosshi
francesco totti,フランチェスコ・トッティ,furanchesuko・totti
sydne rome,シドニー・ローム,shidonī・rōmu
moreno argentin,モレノ・アルゼンティン,moreno・aruzentin
jasmine trinca,ジャスミン・トリンカ,jasumin・torinka
erika blanc,エリカ・ブラン,erika・buran
lorenzo monaco,ロレンツォ・モナコ,rorentso・monako
cristina comencini,クリスチナ・コメンチーニ,kurisuchina・komenchīni
clara calamai,クララ・カラマイ,kurara・karamai
giuseppina leone,ジュゼッピーナ・レオーネ,juzeppīna・reōne
frank costello,フランク・コステロ,furanku・kosutero
pietro accardi,ピエトロ・アッカルディ,pietoro・akkarudi
aldo maldera,アルド・マルデラ,arudo・marudera
fabio baldato,ファビオ・バルダート,fabio・barudāto
ivan goi,イヴァン・ゴイ,ivan・goi
remo giazotto,レモ・ジャゾット,remo・jazotto
alessandro bertolini,アレッサンドロ・ベルトリーニ,aressandoro・berutorīni
giuseppe furino,ジュゼッペ・フリーノ,juzeppe・furīno
giorgio de chirico,ジョルジョ・デ・キリコ,jorujo・de・kiriko
felix silla,フェリックス・シラ,ferikkusu・shira
franco amurri,フランコ・アムリ,furanko・amuri
luigi durand de la penne,ルイージ・ドゥランド・デ・ラ・ペンネ,ruīji・durando・de・ra・penne
vittorio adorni,ヴィットリオ・アドルニ,vittorio・adoruni
massimo gobbi,マッシモ・ゴッビ,masshimo・gobbi
giuseppe piccioni,ジュゼッペ・ピッチョーニ,juzeppe・pitchōni
roberto benigni,ロベルト・ベニーニ,roberuto・benīni
ennio morricone,エンニオ・モリコーネ,ennio・morikōne
giorgio armani,ジョルジオ・アルマーニ,jorujio・arumāni
maurizio pollini,マウリツィオ・ポリーニ,mauritsio・porīni
gianni vattimo,ジャンニ・ヴァッティモ,janni・vattimo
beniamino gigli,ベニャミーノ・ジーリ,benyamīno・jīri
giuseppe pittau,ヨゼフ・ピタウ,yozefu・pitau
primo carnera,プリモ・カルネラ,purimo・karunera
javier mascherano,ハビエル・マスチェラーノ,habieru・masucherāno
giampiero pinzi,ジャンピエロ・ピンツィ,janpiero・pintsi
antonio benarrivo,アントニオ・ベナリーヴォ,antonio・benarīvuォ
franco battiato,フランコ・バッティアート,furanko・battiāto
luigi nono,ルイジ・ノーノ,ruiji・nōno
frank horvat,フランク・ホーヴァット,furanku・hōvatto
umberto saba,ウンベルト・サバ,unberuto・saba
matteo manassero,マッテオ・マナセロ,matteo・manasero
nanni moretti,ナンニ・モレッティ,nanni・moretti
hernán crespo,エルナン・クレスポ,erunan・kuresupo
pier paolo pasolini,ピエル・パオロ・パゾリーニ,pieru・paoro・pazorīni
carlo cassola,カルロ・カッソーラ,karuro・kassōra
gian lorenzo bernini,ジャン・ロレンツォ・ベルニーニ,jan・rorentso・berunīni
ercole baldini,エルコーレ・バルディーニ,erukōre・barudīni
kaká,カカ,kaka
francesco acerbi,フランチェスコ・アチェルビ,furanchesuko・acherubi
anselmo colzani,アンセルモ・コルツァーニ,anserumo・korutsāni
nunzio malasomma,ヌンチオ・マラソンマ,nunchio・marasonma
paolo maffei,パオロ・マフェイ,paoro・mafei
goffredo lombardo,ゴッフレード・ロンバルド,goffurēdo・ronbarudo
giorgia meloni,ジョルジャ・メローニ,joruja・merōni
roberto saviano,ロベルト・サビアーノ,roberuto・sabiāno
carlo lizzani,カルロ・リッツァーニ,karuro・rittsāni
alberto moravia,アルベルト・モラヴィア,aruberuto・moravia
colin firth,コリン・ファース,korin・fāsu
jonas gonçalves oliveira,ジョナス・ゴンサウヴェス・オリヴェイラ,jonasu・gonsauvuェsu・orivuェira
domenico morfeo,ドメニコ・モルフェオ,domeniko・morufeo
italo gariboldi,イータロ・ガリボルディ,ītaro・gariborudi
alessandro cicognini,アレッサンドロ・チコニーニ,aressandoro・chikonīni
carlo gambino,カルロ・ガンビーノ,karuro・ganbīno
sebastiano serlio,セバスティアーノ・セルリオ,sebasutiāno・serurio
maria curcio,マリア・クルチオ,maria・kuruchio
lorenzo buffon,ロレンツォ・ブッフォン,rorentso・buffon
leo nucci,レオ・ヌッチ,reo・nutchi
massimo donati,マッシモ・ドナーティ,masshimo・donāti
franco selvaggi,フランコ・セルヴァッジ,furanko・seruvajji
simone del nero,シモーネ・デル・ネロ,shimōne・deru・nero
sonia gandhi,ソニア・ガンディー,sonia・gandī
franco zuculini,フランコ・スクリーニ,furanko・sukurīni
sandro salvadore,サンドロ・サルヴァドーレ,sandoro・saruvadōre
sergio leone,セルジオ・レオーネ,serujio・reōne
antonio conte,アントニオ・コンテ,antonio・konte
enrico berlinguer,エンリコ・ベルリンゲル,enriko・beruringeru
alessandro de marchi,アレッサンドロ・デ・マルキ,aressandoro・de・maruki
angelino alfano,アンジェリーノ・アルファノ,anjerīno・arufano
fabrizio bosso,ファブリッツィオ・ボッソ,faburittsio・bosso
leonardo fioravanti,レオナルド・フィオラヴァンティ,reonarudo・fioravanti
bruno pontecorvo,ブルーノ・ポンテコルボ,burūno・pontekorubo
davide rigon,ダビデ・リゴン,dabide・rigon
francesco rutelli,フランチェスコ・ルテッリ,furanchesuko・ruterri
angelo conterno,アンジェロ・コンテルノ,anjero・konteruno
angelo damiano,アンジェロ・ダミアーノ,anjero・damiāno
alex baldolini,アレックス・バルドリーニ,arekkusu・barudorīni
bartolomeo schedoni,バルトロメオ・スケドーニ,barutoromeo・sukedōni
luigi ferdinando tagliavini,ルイジ・フェルディナンド・タリアヴィーニ,ruiji・ferudinando・tariavīni
indro montanelli,インドロ・モンタネッリ,indoro・montanerri
mario roatta,マリオ・ロアッタ,mario・roatta
giovanni volpi,ジョヴァンニ・ヴォルピ,jovanni・vuォrupi
frank scalice,フランク・スカリーチェ,furanku・sukarīche
dino baggio,ディノ・バッジョ,dino・bajjo
vincenzo cimatti,ヴィンチェンツォ・チマッティ,vinchentso・chimatti
lucio dalla,ルーチョ・ダッラ,rūcho・darra
