césar camargo mariano,セザール・カマルゴ・マリアーノ,sezāru・kamarugo・mariāno
fernando augusto,フェルナンド・テレレ,ferunando・terere
joaquim gonçalves ledo,ジョアキム・ゴンサルヴェス・レド,joakimu・gonsaruvuェsu・redo
cassio werneck,カシオ・ヴェルネック,kashio・vuェrunekku
joel zito araujo,ジョエル・ズィト・アラウージョ,joeru・zito・araūjo
alessandro lopes pereira,アレッサンドロ・ロペス・ペレイラ,aressandoro・ropesu・pereira
josé clemente pereira,ジョゼ・クレメンテ・ペレイラ,joze・kuremente・pereira
josé guilherme merquior,ジョゼ・ギリェルメ・メルクイオル,joze・giriェrume・merukuioru
victor ferraz macedo,ヴィクトル・フェラズ・マセド,vikutoru・ferazu・masedo
joão maria de orléans e bragança,ジョアン・マリア・デ・オルレアンス・イ・ブラガンサ,joan・maria・de・orureansu・i・buragansa
aldir blanc,アルジール・ブランキ,arujīru・buranki
felipe folgosi,フェリペ・フォルゴシ,feripe・forugoshi
felipe manoel gonçalves,フェリピ・マノエウ・ゴンサウヴェス,feripi・manoeu・gonsauvuェsu
joão emanuel carneiro,ジョアン・エマヌエル・カルネイロ,joan・emanueru・karuneiro
joão fernandes,ジョアン・フェルナンデス,joan・ferunandesu
júnior morais,ジュニオール・モライス,juniōru・moraisu
christian lindell,クリスティアン・リンデル,kurisutian・rinderu
paloma bernardi,パロマ・ベルナルディ,paroma・berunarudi
luiz martin carlos júnior,ルイス・マルティン・カルロス・ジュニオール,ruisu・marutin・karurosu・juniōru
ronaldo lemos,ロナウド・レモス,ronaudo・remosu
nélson cavaquinho,ネルソン・カヴァキーニョ,neruson・kavakīnyo
cezar mutante,セザール・フェレイラ,sezāru・fereira
franciela krasucki,フランシエラ・クラスキ,furanshiera・kurasuki
juliana moreira,ジュリアナ・モレイラ,juriana・moreira
cilinho,シリーニョ,shirīnyo
claudio slon,クラウジオ・スローン,kuraujio・surōn
alex barboza de azevedo terra,アレックス・バルボーザ・ジ・アゼヴェド・テラ,arekkusu・barubōza・ji・azevuェdo・tera
marcos gomes,マルコス・ゴメス,marukosu・gomesu
marina lima,マリーナ・リマ,marīna・rima
mário lago,アリオ・ラゴ,ario・rago
joão zeferino da costa,ジョアン・ゼフェリーノ・ダ・コスタ,joan・zeferīno・da・kosuta
joênia wapichana,ジョエニア・ヴァピシャナ,joenia・vapishana
leon hirszman,レオン・ヒズマン,reon・hizuman
lucas chiaretti cossenzo,ルーカス・シアレッチ・コセンゾ,rūkasu・shiaretchi・kosenzo
anderson santos silva,アンデルソン・サントス・シウバ,anderuson・santosu・shiuba
criolo,クリオロ,kurioro
aline pellegrino,アリーネ・ペレグリーノ,arīne・peregurīno
almir guineto,アルミール・ギネート,arumīru・ginēto
francisco massaranduba,フランシスコ・トリナウド,furanshisuko・torinaudo
mauro mendonça,マウロ・メンドンサ,mauro・mendonsa
alexsandro alves ferreira,アレクサンドロ・アルヴェス・フェレイラ,arekusandoro・aruvuェsu・fereira
alexandré pölking,アレシャンドレ・ペルキング,areshandore・perukingu
fabíula nascimento,ファビウラ・ナシメント,fabiura・nashimento
marcelo cordeiro,マルセロ・コルディロ,marusero・korudiro
maurício poggi villela,マウリシーニョ・ポッジ・ヴィレッラ,maurishīnyo・pojji・virerra
nivaldo lourenço da silva,ニヴァウド・ローレンス・ダ・シルバ,nivaudo・rōrensu・da・shiruba
flávio elias cordeiro,フラビオ・エリアス・コルデイロ,furabio・eriasu・korudeiro
alexandre nero,アレクサンドロ・ネロ,arekusandoro・nero
alison lopes ferreira,アリソン・ロペス・フェレイラ,arison・ropesu・fereira
márcio azevedo,マルシオ・アゼヴェド,marushio・azevuェdo
fábio júnior dos santos,ファビオ・ジュニオール・ドス・サントス,fabio・juniōru・dosu・santosu
aline weber,アリーン・ウェバー,arīn・webā
gabriela bertante,ガブリエラ・ベルタンテ,gaburiera・berutante
angelo carlos pretti,アンジェロ・カルロス・プレッティ,anjero・karurosu・puretti
evaldo silva dos santos,エバウド・シルバ・ドス・サントス,ebaudo・shiruba・dosu・santosu
leandro teixeira dantas,レアンドロ・テイシェイラ・ダンタス,reandoro・teisheira・dantasu
cristina lago,クリスティーナ・ラゴ,kurisutīna・rago
wanderson costa viana,ヴァンデルソン・コスタ・ヴィアナ,vanderuson・kosuta・viana
nicola siri,ニコラ・シリ,nikora・shiri
jorge mautner,ジョルジ・マウチネル,joruji・mauchineru
wilson carlos mano,ウィルソン・カルロス・マノ,wiruson・karurosu・mano
geraldo del rey,ジェラルド・デル・レイ,jerarudo・deru・rei
elison fagundes dos santos,エリソン・ファグンデス・ドス・サントス,erison・fagundesu・dosu・santosu
geovane batista de faria,ジオバネ・バティスタ・デ・ファリア,jiobane・batisuta・de・faria
alex felipe nery,アレックス・フェリペ・ネリー,arekkusu・feripe・nerī
nathan otávio ribeiro,ナタン・オタヴィオ・ヒベイロ,natan・otavio・hibeiro
otacílio neto,オタシリオ・ネト,otashirio・neto
vladimir orlando cardoso de araújo filho,ヴラジミール・オルランド・カルドソ・ジ・アラウージョ・フィーリョ,vurajimīru・orurando・karudoso・ji・araūjo・fīryo
mario caldato jr,マリオ・カルダート・ジュニア,mario・karudāto・junia
moraes moreira,モラエス・モレイラ,moraesu・moreira
maria thereza goulart,マリア・テレザ・フォンテッラ,maria・tereza・fonterra
geronimo dos santos,ジェロニモ・ドス・サントス,jeronimo・dosu・santosu
daniel paulista,ダニエル・パウリスタ,danieru・paurisuta
paulo campos,パウロ・カンポス,pauro・kanposu
anderson henriques,アンデルソン・エンリケス,anderuson・enrikesu
ananias elói castro monteiro,アナニアス・エロイ・カストロ・モンテイロ,ananiasu・eroi・kasutoro・monteiro
otávio edmilson da silva monteiro,オタヴィオ・エジミウソン・ダ・シウヴァ・モンテイロ,otavio・ejimiuson・da・shiuva・monteiro
daniel sarafian,ダニエル・サラフィアン,danieru・sarafian
daniel acácio,ダニエル・アカーシオ,danieru・akāshio
wesley barbosa de morais,ウェズレイ・バルボーサ・ジ・モライス,wezurei・barubōsa・ji・moraisu
danilo caymmi,ダニーロ・カイミ,danīro・kaimi
gerson fraga vieira,ジェルソン・フラガ・ビエイラ,jeruson・furaga・bieira
andressa de morais,アンドレッサ・デ・モライス,andoressa・de・moraisu
marcelo novais teles,マルセロ・ノヴェ・トレ,marusero・novuェ・tore
giovani luiz neitzke,ジウバーニ・ルイス・ネイツケ,jiubāni・ruisu・neitsuke
manuel alves branco,マヌエル・アルヴェス・ブランコ,manueru・aruvuェsu・buranko
mauricio viana,マウリシオ・ビアナ,maurishio・biana
andrucha waddington,アンドルーシャ・ワディントン,andorūsha・wadinton
andré dida,アンドレ・ジダ,andore・jida
gilson kleina,ジルソン・クレイナ,jiruson・kureina
danton mello,ダントン・メーロ,danton・mēro
andré luiz paulino de souza motta,アンドレ・ルイス・パウリーノ・ジ・ソウザ・モッタ,andore・ruisu・paurīno・ji・souza・motta
giselli monteiro,ジセリ・モンテイロ,jiseri・monteiro
rafael de andrade bittencourt pinheiro,ラファエウ・ジ・アンドラージ・ビッテンコウルト・ピニェイロ,rafaeu・ji・andorāji・bittenkouruto・piniェiro
edinaldo gomes pereira,エジナウド・ゴメス・ペレイラ,ejinaudo・gomesu・pereira
everton kempes dos santos gonçalves,エヴェルトン・ケンペス・ドス・サントス・ゴンサウベス,evuェruton・kenpesu・dosu・santosu・gonsaubesu
guilherme costa marques,ギリェルメ・コスタ・マルケス,giriェrume・kosuta・marukesu
kleber romero,クレーベル・ロメロ,kurēberu・romero
jorge zarif,ジョルジ・ザリフ,joruji・zarifu
mauro refosco,マウロ・レファスコ,mauro・refasuko
guilherme de almeida prado,ギエルメ・デ・アルメイダ・プラド,gierume・de・arumeida・purado
josé luiz ferreira rodrigues,ジョゼ・ルイス・フェレイラ・ロドリゲス,joze・ruisu・fereira・rodorigesu
david aparecido da silva,ダビ・アパレシド・ダ・シルバ,dabi・apareshido・da・shiruba
lenny fernandes coelho,レニー・フェルナンデス・コエリョ,renī・ferunandesu・koeryo
mattheus de andrade gama de oliveira,マテウス・デ・アンドラージ・ガマ・デ・オリベイラ,mateusu・de・andorāji・gama・de・oribeira
antoninho fernandes,アントニーニョ・フェルナンデス,antonīnyo・ferunandesu
ricardo aparecido tavares,リカルド・アパレシード・タバレス,rikarudo・apareshīdo・tabaresu
moacir santos,モアシール・サントス,moashīru・santosu
cássio gabus mendes,カシオ・ガブス・メンデス,kashio・gabusu・mendesu
gustavo henrique vernes,グスタヴォ・エンリキ・ヴェルネス,gusutavuォ・enriki・vuェrunesu
romário leiria de moura,ロマーリオ・レイリア・ジ・モウラ,romārio・reiria・ji・moura
ronaldo bôscoli,ホナルド・ボスコリ,honarudo・bosukori
glauce rocha,グラウセ・ホシャ,gurause・hosha
glaydson,グライジソン,guraijison
serginho fraldinha,セルジーニョ・フラウジーニャ,serujīnyo・furaujīnya
ricardo bueno,リカルド・ブエノ,rikarudo・bueno
josimar rosado da silva tavares,ジョジマール・ロサード・ダ・シルバ・タバレス,jojimāru・rosādo・da・shiruba・tabaresu
josualdo alves da silva oliveira,ジョシュアウド・アウヴェス・ダ・シウヴァ・オリヴェイラ,joshuaudo・auvuェsu・da・shiuva・orivuェira
josé fágner silva da luz,ジョゼ・ファグネル・シウヴァ・ダ・ルス,joze・faguneru・shiuva・da・rusu
guto ferreira,グート・フェレイラ,gūto・fereira
cauê santos da mata,カウエ・サントス・ダ・マッタ,kaue・santosu・da・matta
gustavo franco,グスタボ・フランコ,gusutabo・furanko
erling lorentzen,エアリング・ロレンツェン,earingu・rorentsen
alexandre pires,アレクサンドル・ピレス,arekusandoru・piresu
thiago rodrigues da silva,チアゴ・ロドリゲス・ダ・シウヴァ,chiago・rodorigesu・da・shiuva
fernanda vasconcellos,フェルナンダ・バスコンセロス,ferunanda・basukonserosu
wellington clayton gonçalves dos santos,ウェリントン・クレイトン・ゴンサウベス・ドス・サントス,werinton・kureiton・gonsaubesu・dosu・santosu
douglas marques dos santos,ドウグラス・マルケス・ドス・サントス,dougurasu・marukesu・dosu・santosu
maurício peixoto,マウリシオ・ペイショート,maurishio・peishōto
diego luri,ジエゴ・ルリ,jiego・ruri
josé nilson dos santos silva,ジョゼ・ニウソン・ドス・サントス・シルヴァ,joze・niuson・dosu・santosu・shiruva
hal thirlaway,ヘンリー・サーラウェイ,henrī・sārawei
sérgio luís de araújo,セルジオ・ルイス・ジ・アラウージョ,serujio・ruisu・ji・araūjo
domício da gama,ドミシオ・ダ・ガマ,domishio・da・gama
dori caymmi,ドリ・カイミ,dori・kaimi
joão paulo da silva araújo,ジョアン・パウロ・ダ・シウヴァ・アラウージョ,joan・pauro・da・shiuva・araūjo
tales tlaija de souza,タレス・トライジャ・ジ・ソウザ,taresu・toraija・ji・souza
thiago arancam,チアゴ・アランカム,chiago・arankamu
nanda costa,ナンダ・コスタ,nanda・kosuta
diogo sclebin,ジオゴ・スクレビン,jiogo・sukurebin
tato gabus mendes,タトー・ガブス・メンデス,tatō・gabusu・mendesu
diogo correa de oliveira,ジオゴ・コヘア・デ・オリベイラ,jiogo・kohea・de・oribeira
jonas sulzbach,ジョナス・ズルツバッハ,jonasu・zurutsubahha
vinícius santos silva,ヴィニシウス・サントス・シウヴァ,vinishiusu・santosu・shiuva
hannette staack,アネッチ・エスタッキ,anetchi・esutakki
octávio pinto guimarães,オクタヴィオ・ピント・ギマランイス,okutavio・pinto・gimaranisu
josé scheinkman,ジョゼ・シェイクマン,joze・sheikuman
dorival das neves ferraz júnior,ドリバウ・ダス・ネーヴィス・フェハス・ジュニオール,doribau・dasu・nēvisu・fehasu・juniōru
juarez moreira,フアレス・モレイラ,fuaresu・moreira
paulo nobre,パウロ・ノブレ,pauro・nobure
niege dias,ネージュ・ディアス,nēju・diasu
william machado de oliveira,ウイリアム・マシャド・デ・オリヴェイラ,uiriamu・mashado・de・orivuェira
nelson angelo,ネルソン・アンジェロ,neruson・anjero
wanderson souza carneiro,ワンデウソン・ソウザ・カルネイロ,wandeuson・souza・karuneiro
werley ananias da silva,ヴェルレイ・アナニアス・ダ・シウヴァ,vuェrurei・ananiasu・da・shiuva
dyanfres douglas chagas matos,ダイアンフレス・ドウグラス・シャガス・マトス,daianfuresu・dougurasu・shagasu・matosu
bernardo kucinski,ベルナルド・クシンスキー,berunarudo・kushinsukī
boris vassilievich skvortsov,ボリス・ヴァシーリエヴィッチ・スクヴォルツォフ,borisu・vashīrievitchi・sukuvuォrutsofu
zíbia gasparetto,ジビア・ガスパレット,jibia・gasuparetto
cleiton silva,クレイトン・シウバ,kureiton・shiuba
alexandre tombini,アレクサンドレ・トンビニ,arekusandore・tonbini
wilde gomes da silva,ウィルデ・ゴメス・ダ・シウヴァ,wirude・gomesu・da・shiuva
everton ribeiro,エヴェルトン・リベイロ,evuェruton・ribeiro
kátya chamma,カチャ・チャンマ,kacha・chanma
lorenzo merlino,ロレンゾ・メルリーノ,rorenzo・merurīno
ben goertzel,ベン・ゲーツェル,ben・gētseru
paulo betti,パウロ・ベッチ,pauro・betchi
josé gomes pinheiro machado,ジョゼ・ゴメス・ピニェイロ・マシャド,joze・gomesu・piniェiro・mashado
fabiano soares pessoa,ファビアーノ・ソアレス・ペッソア,fabiāno・soaresu・pessoa
adriano bispo dos santos,アドリアーノ・ビスポ・ドス・サントス,adoriāno・bisupo・dosu・santosu
kaio felipe gonçalves,カイオ・フェリペ・ゴンサウベス,kaio・feripe・gonsaubesu
patrícia medrado,パトリシア・メドラード,patorishia・medorādo
joéliton lima santos,ジョエリトン・リマ・サントス,joeriton・rima・santosu
bianca bin,ビアンカ・ビン,bianka・bin
eduardo godinho felipe,エドゥアルド・ゴジーニョ・フェリペ,eduarudo・gojīnyo・feripe
eduardo godinho felipe de souza,エドゥアルド・ゴジーニョ・フェリペ・ジ・ソウザ,eduarudo・gojīnyo・feripe・ji・souza
henrique meirelles,エンリケ・メイレレス,enrike・meireresu
lais ribeiro,レイス・リベイロ,reisu・ribeiro
laudir de oliveira,ラウヂール・ヂ・オリヴェイラ,raudjīru・dji・orivuェira
eduardo josé diniz costa,エドゥワルド・ジョゼ・ジニズ・コスタ,eduwarudo・joze・jinizu・kosuta
jefferson lopes faustino,ジェフェルソン・ロペス・ファウスチーノ,jeferuson・ropesu・fausuchīno
leandro altair machado,レアンドロ・アウタイール・マシャード,reandoro・autaīru・mashādo
othon bastos,オトン・バストス,oton・basutosu
francisco pereira passos,フランシスコ・ペレイラ・パソス,furanshisuko・pereira・pasosu
edílson mendes guimarães,エジウソン・メンデス・ギマランイス,ejiuson・mendesu・gimaranisu
alexandra aikhenvald,アレクサンドラ・アイヘンヴァルト,arekusandora・aihenvaruto
leila diniz,レイラ・ディニス,reira・dinisu
leandro aparecido padilha de oliveira,レアンドロ・アパレシド・パジーリャ・ジ・オリベイラ,reandoro・apareshido・pajīrya・ji・oribeira
leandro assumpção,レアンドロ・アスンサォン,reandoro・asunsaォn
léo gandelman,レオ・ガンデルマン,reo・ganderuman
sergio ricardo,セルジオ・リカルド,serujio・rikarudo
adriano goldman,アドリアーノ・ゴールドマン,adoriāno・gōrudoman
milton gonçalves,ミルトン・ゴンサルヴェス,miruton・gonsaruvuェsu
lidi lisboa,リディ・リスボア,ridi・risuboa
eli sabiá,エリ・サビア,eri・sabia
eliana pittman,エリアーナ・ピットマン,eriāna・pittoman
fernando morais,フェルナンド・モライス,ferunando・moraisu
sergio gabrielli,セルジオ・ガブリエリ,serujio・gaburieri
elias ribeiro de oliveira,エリアス・リベイロ・ジ・オリヴェイラ,eriasu・ribeiro・ji・orivuェira
eliomar correia silva,エリオマール・コレイア・シウヴァ,eriomāru・koreia・shiuva
elisa volpatto,エリサ・ヴォルパット,erisa・vuォrupatto
leandro freire de araújo,レアンドロ・フレイレ・デ・アラウージョ,reandoro・fureire・de・araūjo
jan antonín baťa,ヤン・アントニン・バタ,yan・antonin・bata
claudionor souza de jesus,クラウディオノル・ソウザ・ジ・ジェズス,kuraudionoru・souza・ji・jezusu
leny andrade,レニー・アンドラージ,renī・andorāji
eleílson farias de moura,エレウソン・ファリアス・デ・モウラ,ereuson・fariasu・de・moura
rubens gerchman,ホゥベンス・ゲルシマン,hubensu・gerushiman
liliu,リリウ,ririu
rosaly lopes,ロザリー・ロープス,rozarī・rōpusu
jamelão,ジャメラォン,jameraォn
emmerson nogueira,エマーソン・ノゲイラ,emāson・nogeira
odete lara,オデッチ・ララ,odetchi・rara
odilon duarte braga,オディロン・ドゥアルテ・ブラガ,odiron・duarute・buraga
thiago dos santos cunha,チアゴ・ドス・サントス・クーニャ,chiago・dosu・santosu・kūnya
rossana ghessa,ロッサナ・ゲッサ,rossana・gessa
tiago da silva,チアゴ・ダ・シルバ,chiago・da・shiruba
vera mossa,ヴェラ・モッサ,vuェra・mossa
érica awano,エリカ・アワノ,erika・awano
erik wanderley,エリック・ヴァンダレイ,erikku・vandarei
lino facioli,リノ・ファシオリ,rino・fashiori
lisalla montenegro,リザラ・モンテネグロ,rizara・monteneguro
erenice guerra,エレニセ・ゲーラ,erenise・gēra
miguel rio branco,ミゲル・リオ・ブランコ,migeru・rio・buranko
lucas lepri,ルーカス・レプリ,rūkasu・repuri
pablo nascimento castro,パブロ・ナシメント・カストロ,paburo・nashimento・kasutoro
pakorn prempak,パコーン・プレムパック,pakōn・puremupakku
louis chirillo,ルイス・チリロ,ruisu・chiriro
theodoro peckolt,テオドール・ペッコルト,teodōru・pekkoruto
otacílio gonçalves da silva júnior,オタシリオ・ゴンサウヴェス・ダ・シルバ・ジュニオール,otashirio・gonsauvuェsu・da・shiruba・juniōru
danielle foxxx,ダニエル・フォックス,danieru・fokkusu
uri valadão,ウリ・ヴァラダン,uri・varadan
tatá werneck,タタ・ヴェルネック,tata・vuェrunekku
stefano cugurra,ステファノ・クグラ,sutefano・kugura
drica moraes,ドリカ・モラエス,dorika・moraesu
marco aurélio dos santos,マルコ・アウレリオ・ドス・サントス,maruko・aurerio・dosu・santosu
waldick soriano,ワルディック・ソリアーノ,warudikku・soriāno
tiago queiroz bezerra,ティアゴ・ケイロズ・ベゼルラ,tiago・keirozu・bezerura
lourenço mutarelli,ロウレンソ・ムタレリ,rourenso・mutareri
jairo luis blumer,ジャイロ・ルイス・ブルメル,jairo・ruisu・burumeru
wellington katzor de oliveira,ウェリントン・カッツォル・デ・オリベイラ,werinton・kattsoru・de・oribeira
vinícius cantuária,ヴィニシウス・カントゥアリア,vinishiusu・kantuaria
luiz antônio de souza soares,ルイス・アントニオ・ジ・ソウザ・ソアレス,ruisu・antonio・ji・souza・soaresu
aleksandar mandic,アレッシャンドレ・マンジック,aresshandore・manjikku
aldo cini,アルド・チーニ,arudo・chīni
wanderley santos monteiro júnior,ヴァンデルレイ・サントス・モンテイロ・ジュニオール,vanderurei・santosu・monteiro・juniōru
wanderléa,ワンデルレーア,wanderurēa
yan cabral,ヤン・カブラル,yan・kaburaru
alencar terra,アレンカール・テッラ,arenkāru・terra
luiz brasil,ルイス・ブラジル,ruisu・burajiru
luiz camargo,ルイス・カマルゴ,ruisu・kamarugo
lucas vinicius gonçalves silva,ルーカス・ビニシウス・ゴンサルベス・シルバ,rūkasu・binishiusu・gonsarubesu・shiruba
paulo emílio frossard jorge,パウロ・エミリオ・フロッサルド・ジョルジ,pauro・emirio・furossarudo・joruji
jaques wagner,ジャック・ワグナー,jakku・wagunā
lucas pierre santos oliveira,ルーカス・ピエール・サントス・オリヴェイラ,rūkasu・piēru・santosu・orivuェira
wilson deodato da silva,ウィウソン・デオダト・ダ・シウヴァ,wiuson・deodato・da・shiuva
wilson moreira,ウィルソン・モレイラ,wiruson・moreira
wilson raimundo junior,ウィルソン・ライムンド・ジュニオール,wiruson・raimundo・juniōru
william pinheiro rodrigues,ウィリアム・ピニェイロ・ロドリゲス,wiriamu・piniェiro・rodorigesu
paulo roberto gonzaga,パウロ・ロベルト・ゴンサガ,pauro・roberuto・gonsaga
lúcio rodrigues,ルシオ・ホドリゲス,rushio・hodorigesu
paulo josé,パウロ・ジョゼ,pauro・joze
weverton pereira da silva,ヴェヴェルトン・ペレイラ・ダ・シウヴァ,vuェvuェruton・pereira・da・shiuva
luiz otávio santos de araújo,ルイス・オタヴィオ・サントス・デ・アラウージョ,ruisu・otavio・santosu・de・araūjo
yoya wursch,ヨヤ・ヴルシュ,yoya・vurushu
jaílton lourenço da silva,ジャイルトン・ロレンソ・ダ・シルバ,jairuton・rorenso・da・shiruba
paulo roberto rocha,パウロ・ロベルト・ローシャ,pauro・roberuto・rōsha
paulinho paiakã,パウリーニョ・パイアカン,paurīnyo・paiakan
luke ross,ルーク・ロス,rūku・rosu
magali,マガリ,magari
joaquim josé inácio,ジョアキン・ジョゼ・イナシオ,joakin・joze・inashio
lúcio flávio da silva oliva,ルシオ・フラヴィオ・ダ・シウヴァ・オリヴァ,rushio・furavio・da・shiuva・oriva
paulo sérgio pinheiro,パウロ・セルジオ・ピネイロ,pauro・serujio・pineiro
addison alves de oliveira,アジソン・アウベス・ダ・シウバ,ajison・aubesu・da・shiuba
arcangelo ianelli,アルカンジェロ・イアネッリ,arukanjero・ianerri
joe bennett,ジョー・ベネット,jō・benetto
anna muylaert,アナ・ミュイラート,ana・myuirāto
antunes filho,アントゥネス・フィーリョ,antunesu・fīryo
alexandrino faria de alencar,アレシャンドリノ・ファリア・デ・アレンカル,areshandorino・faria・de・arenkaru
alexandre vidal porto,アレシャンドレ・ヴィダウ・ポルト,areshandore・vidau・poruto
johnath marlone azevedo da silva,ジョーナス・マルローニ・アゼヴェド・ダ・シウヴァ,jōnasu・marurōni・azevuェdo・da・shiuva
jonas henrique pessalli,ジョナス・エンヒキ・ペサーリ,jonasu・enhiki・pesāri
jordan de freitas,ジョルダン・ジ・フレイタス,jorudan・ji・fureitasu
phelipe rodrigues,フェリペ・ロドリゲス,feripe・rodorigesu
phil rajzman,フィル・ライズマン,firu・raizuman
aureliano lessa,アウレリアーノ・レッサ,aureriāno・ressa
preta gil,プレタ・ジル,pureta・jiru
marcelo luis de almeida carmo,マルセロ・ルイス・デ・アルメイダ・カルモ,marusero・ruisu・de・arumeida・karumo
johil de oliveira,ジョイユ・デ・オリベイラ,joiyu・de・oribeira
petra costa,ペトラ・コスタ,petora・kosuta
marcio alves dos santos,マルシオ・アウベス・ドス・サントス,marushio・aubesu・dosu・santosu
ralek gracie,ハレック・グレイシー,harekku・gureishī
pâmella oliveira,パメラ・オリベイラ,pamera・oribeira
marcelo lomba do nascimento,マルセロ・ロンバ・ド・ナシメント,marusero・ronba・do・nashimento
marcelo lopes de souza,マルチェロ・ロペス・デ・ソウザ,maruchero・ropesu・de・souza
marcelo cirino da silva,マルセロ・シリーノ・ダ・シウヴァ,marusero・shirīno・da・shiuva
rafael ramos de lima,ラファエル・ラモス・デ・リマ,rafaeru・ramosu・de・rima
renata fan,レナータ・ファン,renāta・fan
altair lima,アルタイル・リマ,arutairu・rima
rafael coelho,ラファエル・コエルホ,rafaeru・koeruho
marcelo tas,マルセロ・タス,marusero・tasu
marcio de souza gregório júnior,マルシオ・デ・ソウザ・グレゴリオ・ジュニオール,marushio・de・souza・guregorio・juniōru
marco antonio alvarez ferreira,マルコ・アントニオ・アルバレス・フェレイラ,maruko・antonio・arubaresu・fereira
aloysio nunes,アロイジオ・ヌネス,aroijio・nunesu
francisco dornelles,フランシスコ・ドルネレス,furanshisuko・doruneresu
francisco das chagas santos,フランシスコ・ダス・シャガス・サントス,furanshisuko・dasu・shagasu・santosu
