carlos césar,カルロス・セザル,karurosu・sezaru
ricardo pereira,リカルド・ペレイラ,rikarudo・pereira
nuno júdice,ヌノ・ジュディス,nuno・judisu
nuno lopes,ヌーノ・ロペス,nūno・ropesu
virgílio teixeira,ヴィルジリオ・テクセイラ,virujirio・tekuseira
miguel gonçalves mendes,ミゲル・ゴンサルヴェス・メンデス,migeru・gonsaruvuェsu・mendesu
pedro sousa,ペドロ・ソウザ,pedoro・souza
judilson mamadu tuncará gomes,ジュディウソン・ママドゥ・トゥンカラ・ゴメス,judiuson・mamadu・tunkara・gomesu
andré cardoso,アンドレ・カルドソ,andore・karudoso
antónio horta osório,アントニオ・オルタ・オソリオ,antonio・oruta・osorio
antónio augusto dos santos,アントニオ・アウグスト・ドス・サントス,antonio・augusuto・dosu・santosu
antónio botelho,アントニオ・ボテーリョ,antonio・botēryo
josé augusto torres,ホセ・アウグスト・トーレス,hose・augusuto・tōresu
alfredo esteves,アルフレド・エステヴェス,arufuredo・esutevuェsu
antónio costa pinto,アントーニオ・コスタ・ピント,antōnio・kosuta・pinto
eunice muñoz,ユーニス・ムニョス,yūnisu・munyosu
celeste rodrigues,セレステ・ロドリゲス,seresute・rodorigesu
tiago miguel baía pinto,チアゴ・ミゲル・バイーア・ピント,chiago・migeru・baīa・pinto
alfredo tropa,アルフレード・トローパ,arufurēdo・torōpa
maria de belém roseira,マリア・デ・ベレン・ロッシーラ,maria・de・beren・rosshīra
maria do carmo seabra,マリア・ド・カルモ・シーブラ,maria・do・karumo・shībura
beatriz batarda,ベアトリス・バタルダ,beatorisu・bataruda
isabel ruth,イザベル・ルート,izaberu・rūto
teresa madruga,テレーザ・マドルーガ,terēza・madorūga
ricardo jorge novo nunes,リカルド・ジョルジ・ノヴォ・ヌニェス,rikarudo・joruji・novuォ・nuniェsu
andré castro,アンドレ・カストロ,andore・kasutoro
inês henriques,イネス・ヘンリケス,inesu・henrikesu
diogo gama,ディオゴ・ガマ,diogo・gama
paulo de carvalho,パウロ・デ・カルヴァーリョ,pauro・de・karuvāryo
linda de suza,リンダ・デ・スザ,rinda・de・suza
duarte félix da costa,ドゥアルテ・フェリックス・ダ・コスタ,duarute・ferikkusu・da・kosuta
miguel ramos,ミゲル・ラモス,migeru・ramosu
antónio sousa franco,アントニオ・ソーサ・フランコ,antonio・sōsa・furanko
minervino pietra,ミネルヴィーノ・ピエトラ,mineruvīno・pietora
antónio xavier,アントニオ・シャヴィエル,antonio・shavieru
antónio de amaral de meneses,アントニオ・デ・アマラル・デ・メネーゼス,antonio・de・amararu・de・menēzesu
rui cordeiro,ルイ・コルデイロ,rui・korudeiro
fernando lopes,フェルナンド・ロペス,ferunando・ropesu
luís filipe vieira,ルイス・フェリペ・ヴィエイラ,ruisu・feripe・vieira
joão machado,ジョアン・マシャド,joan・mashado
carlos costa,カルロス・コスタ,karurosu・kosuta
kaúlza de arriaga,カウルザ・デ・アリアガ,kauruza・de・ariaga
anthony gonçalves,アントニー・ゴンサルベス,antonī・gonsarubesu
marcos lopes,マルコス・ロペス,marukosu・ropesu
regina pessoa,レジーナ・ペソア,rejīna・pesoa
hugo vieira,ウーゴ・ヴィエイラ,ūgo・vieira
pedro teixeira,ペドロ・テイシェイラ,pedoro・teisheira
miguel simão,ミゲル・シモン,migeru・shimon
maria adelaide de bragança,マリア・アデライデ・デ・ブラガンサ,maria・aderaide・de・buragansa
antónio josé de almeida,アントニオ・ジョゼ・デ・アルメイダ,antonio・joze・de・arumeida
roberto pinto,ロベルト・ピント,roberuto・pinto
rafael morais,ラファエル・モライス,rafaeru・moraisu
vítor constâncio,ヴィクトル・コンスタンシオ,vikutoru・konsutanshio
nélson agra,ネルソン・アグラ,neruson・agura
filipe gouveia,フィリペ・ゴウヴェイア,firipe・gouvuェia
alberto seixas santos,アウベルト・セイシャス・サントス,auberuto・seishasu・santosu
liza da costa,ライザ・ダ・コスタ,raiza・da・kosuta
luís marques mendes,ルイス・マルケス・メンデス,ruisu・marukesu・mendesu
luís miguel rocha,ルイス・ミゲル・ローシャ,ruisu・migeru・rōsha
nuno miguel lopes,ヌーノ・ミゲル・ロペス,nūno・migeru・ropesu
rui poças,ルイ・ポッサス,rui・possasu
acácio de almeida,アカシオ・デ・アルメイダ,akashio・de・arumeida
noémia delgado,ノエミア・デルガド,noemia・derugado
humberto delgado,ウンベルト・デルガード,unberuto・derugādo
vítor gaspar,ビクトル・ガスパール,bikutoru・gasupāru
jorge silva melo,ジョルジュ・シルヴァ・メロ,joruju・shiruva・mero
josé rodrigues dos santos,ジョゼ・ロドリゲス・ドス・サントス,joze・rodorigesu・dosu・santosu
bock,ボック,bokku
boaventura de sousa santos,ボアベンチュラ・ジ・ソウザ・サントス,boabenchura・ji・souza・santosu
artur correia,アルトゥール・コレイア,arutūru・koreia
antónio teixeira de sousa,アントニオ・テイシェイラ・デ・ソウザ,antonio・teisheira・de・souza
octávio machado,オクタヴィオ・マシャド,okutavio・mashado
lena d'água,レーナ・ダグア,rēna・dagua
nuno sequeira,ヌーノ・セケイラ,nūno・sekeira
francisco de arruda,フランシスコ・デ・アルダ,furanshisuko・de・aruda
antónio de macedo,アントニオ・ド・マセード,antonio・do・masēdo
paulo murinello,パウロ・ムリネロ,pauro・murinero
rui vitória,ルイ・ヴィトーリア,rui・vitōria
paulo oom,パウロ・オム,pauro・omu
carlos tavares,カルロス・タヴァレス,karurosu・tavaresu
carlos eduardo ferreira batista,カルロス・エドゥアルド・フェレイラ・バティスタ,karurosu・eduarudo・fereira・batisuta
paulo grilo,パウロ・グリロ,pauro・guriro
carlos azenha,カルロス・アゼンハ,karurosu・azenha
antónio andré,アントニオ・アンドレ,antonio・andore
antónio francisco dos santos,アントニオ・フランシスコ・ドス・サントス,antonio・furanshisuko・dosu・santosu
tamagnini nené,タマニニ・ネネ,tamanini・nene
antónio calvário,アントニオ・カルヴァーリオ,antonio・karuvārio
antónio campos,アントニオ・カンポス,antonio・kanposu
carla couto,カーラ・クート,kāra・kūto
pedro isidro,ペドロ・イシドロ,pedoro・ishidoro
catarina rodrigues,カタリーナ・ロドリゲス,katarīna・rodorigesu
pedro teotónio pereira,ペドロ・テオトニオ・ペレイラ,pedoro・teotonio・pereira
joão cleofas martins,ジョアン・クレオーファス・マルティンス,joan・kureōfasu・marutinsu
pedro martins,ペドロ・マルティンス,pedoro・marutinsu
carloto cotta,カルロト・コッタ,karuroto・kotta
carmona rodrigues,カルモナ・ロドリゲス,karumona・rodorigesu
dolores silva,ドロレス・シルヴァ,dororesu・shiruva
quim vitorino,キム・ヴィトリーノ,kimu・vitorīno
carlos melancia,カルロス・メランシア,karurosu・meranshia
carlos xavier,カルロス・シャヴィエル,karurosu・shavieru
rahul pandharipande,ラフル・パンダハリパンデ,rafuru・pandaharipande
antónio granjo,アントニオ・グランジョ,antonio・guranjo
antónio lima pereira,アントニオ・リマ・ペレイラ,antonio・rima・pereira
antónio de almeida santos,アントニオ・デ・アルメイダ・サントス,antonio・de・arumeida・santosu
luís miguel afonso fernandes,ルイス・ミゲル・アフォンソ・フェルナンデス,ruisu・migeru・afonso・ferunandesu
mário silva,マリオ・シルヴァ,mario・shiruva
antónio vilar,アントニオ・ヴィラール,antonio・virāru
antónio da cunha telles,アントニオ・ダ・クーニャ・テリス,antonio・da・kūnya・terisu
vergílio ferreira,ヴェルジリオ・フェレイラ,vuェrujirio・fereira
renato santos,レナト・サントス,renato・santosu
joão canijo,ジョアン・カニージョ,joan・kanījo
antónio veloso,アントニオ・ヴェローゾ,antonio・vuェrōzo
antónio simões,アントニオ・シモンエス,antonio・shimonesu
antónio sousa,アントニオ・ソウザ,antonio・souza
domingos castro,ドミンゴス・カストロ,domingosu・kasutoro
joão silva,ジョアン・シルヴァ,joan・shiruva
fernando maurício,フェルナンド・マウリシオ,ferunando・maurishio
fernando nogueira,フェルナンド・ノゲイラ,ferunando・nogeira
fernando nobre,フェルナンドゥ・ノブリ,ferunandu・noburi
bartolomeu lasso,バルトロメウ・ラソ,barutoromeu・raso
ricardo ferreira,リカルド・フェレイラ,rikarudo・fereira
esmaël gonçalves,イズマエル・ゴンサウヴェス,izumaeru・gonsauvuェsu
ernesto da conceição soares,エルネスト・ダ・コンセイソン・ソアレス,erunesuto・da・konseison・soaresu
dona branca,ドナ・ブランカ,dona・buranka
daniela varela,ダニエラ・ヴァレラ,daniera・varera
fernando pereira,フェルナンド・ペレイラ,ferunando・pereira
antónio leonel vilar nogueira sousa,アントニオ・レオネル・ヴィラル・ノゲイラ・ソウザ,antonio・reoneru・viraru・nogeira・souza
joão vieira,ジョアン・ヴィエイラ,joan・vieira
luís de montalvor,ルイス・デ・モンタルヴォル,ruisu・de・montaruvuォru
ricardo manuel ferreira sousa,リカルド・マヌエル・フェレイラ・ソウザ,rikarudo・manueru・fereira・souza
edite fernandes,エディット・フェルナンデス,editto・ferunandesu
josé azevedo,ジョゼ・アセヴェド,joze・asevuェdo
eduardo lourenço,エドゥアルド・ローレンソ,eduarudo・rōrenso
rui caçador,ルイ・カサドール,rui・kasadōru
romeu ribeiro,ロメウ・リベイロ,romeu・ribeiro
jorge nuno pinto da costa,ジョルジェ・ヌーノ・ピント・ダ・コスタ,joruje・nūno・pinto・da・kosuta
artur ivens ferraz,アルトゥル・アイヴェンス・フェラス,aruturu・aivuェnsu・ferasu
louis ferreira,ルイス・フェレイラ,ruisu・fereira
hélio sousa,エリオ・ソウサ,erio・sousa
josé gil,ホセ・ヒル,hose・hiru
rui rio,ルイ・リオ,rui・rio
elisa ferreira,エリサ・フェレイラ,erisa・fereira
carla de sá,カルラ・デ・サー,karura・de・sā
alfredo marceneiro,アルフレド・マルセネイロ,arufuredo・maruseneiro
jennifer smith,ジェニファー・スミス,jenifā・sumisu
alfredo de sá cardoso,アルフレド・デ・サ・カルドソ,arufuredo・de・sa・karudoso
victor hugo de azevedo coutinho,ヴィクトル・ウーゴ・デ・アセヴェド・コーティーニョ,vikutoru・ūgo・de・asevuェdo・kōtīnyo
josé de castro,ジョゼ・デ・カストロ,joze・de・kasutoro
jorge casquilha,ジョルジ・カスキーリャ,joruji・kasukīrya
josé luís,ホセ・トレグロサ,hose・toregurosa
josé manuel coelho,ジュゼ・マヌエル・クエーリョ,juze・manueru・kuēryo
vasco gonçalves,ヴァスコ・ゴンサウヴェス,vasuko・gonsauvuェsu
camané,カマネ,kamane
alfredo nobre da costa,アルフレッド・ノブレ・ダ・コスタ,arufureddo・nobure・da・kosuta
josé menéres pimentel,ジョゼ・メネレス・ピメンテル,joze・meneresu・pimenteru
josé veiga,ジョゼ・ヴェイガ,joze・vuェiga
josé viana da mota,ジョゼ・ヴィアナ・ダ・モッタ,joze・viana・da・motta
eduardo fernandes pereira gomes,エドゥアルド・フェルナンデス・ペレイラ・ゴメス,eduarudo・ferunandesu・pereira・gomesu
josé henrique,ジョゼ・エンリケ,joze・enrike
sérgio pinto,セルジオ・ピント,serujio・pinto
sérgio vieira,セルジオ・ヴィエイラ,serujio・vieira
maria velho da costa,マリア・ベーリョ・ダ・コスタ,maria・bēryo・da・kosuta
manuel alegre,マヌエル・アレグリ,manueru・areguri
júlio correia da silva,ジュリオ・コレイア・ダ・シルヴァ,jurio・koreia・da・shiruva
joão neto,ジョアン・ネト,joan・neto
vitorino guimarães,ヴィトリーノ・ギマランイス,vitorīno・gimaranisu
luís galvão teles,ルイス・ガルヴァン・テレシュ,ruisu・garuvan・tereshu
augusto santos silva,アウグスト・サントス・シルヴァ,augusuto・santosu・shiruva
júlio cernadas pereira,フリオ・セルナダス・ペレイラ,furio・serunadasu・pereira
tiago mesquita,ティアゴ・メスキータ,tiago・mesukīta
carlos vieira,カルロス・ヴィエイラ,karurosu・vieira
joaquim dos santos,ホアキン・ドス・サントス,hoakin・dosu・santosu
tomané,トマネ,tomane
paulo torres,パウロ・トーレス,pauro・tōresu
manuel teixeira gomes,マヌエル・テイシェイラ・ゴメス,manueru・teisheira・gomesu
joão do canto e castro,ジョアン・ド・カント・エ・カストロ,joan・do・kanto・e・kasutoro
marco paixão,マルコ・パイシャン,maruko・paishan
francisco manuel geraldo rosa,フランシスコ・マヌエル・ジェラルド・ロザ,furanshisuko・manueru・jerarudo・roza
magdolna purgly,プルグリ・マグドルナ,puruguri・magudoruna
carlos silva valente,カルロス・シルヴァ・ヴァレンテ,karurosu・shiruva・varente
ianique dos santos tavares,イアニケ・ドス・サントス・タヴァレス,ianike・dosu・santosu・tavaresu
gilberto grácio,ジルベルト・グラシオ,jiruberuto・gurashio
fábio ferreira,ファビオ・フェレイラ,fabio・fereira
fábio daniel moreira barros,ファビオ・ダニエル・モレイラ・バロス,fabio・danieru・moreira・barosu
frederico ferreira silva,フレデリコ・フェレイラ・シルバ,furederiko・fereira・shiruba
cláudio panta nunes,クラウジオ・パンタ・ヌーニェス,kuraujio・panta・nūniェsu
mário ferreira,マリオ・フェレイラ,mario・fereira
francisco vieira,フランシスコ・ヴィエイラ,furanshisuko・vieira
francisco vital,フランシスコ・ヴィタウ,furanshisuko・vitau
óscar duarte,オスカル・ドゥアルテ,osukaru・duarute
vítor bruno,ヴィトル・ブルーノ,vitoru・burūno
alberto júdice leote cavaco,アルベルト・ジュディセ・レオテ・カヴァコ,aruberuto・judise・reote・kavako
fábio martins,ファビオ・マルティンス,fabio・marutinsu
josé carlos malato,ジョゼ・カルロス・マラート,joze・karurosu・marāto
guilherme bentes,ギリェルメ・ベンテス,giriェrume・bentesu
guilherme farinha,ギリェルメ・ファリーニャ,giriェrume・farīnya
cristina cavalinhos,クリスティーナ・カヴァリーニョス,kurisutīna・kavarīnyosu
josé pereira,ジョゼ・ペレイラ,joze・pereira
ljubinko drulović,リュビンコ・ドルロヴィッチ,ryubinko・dorurovitchi
laura gonçalves,ラウラ・ゴンサルヴェス,raura・gonsaruvuェsu
eduardo ferro rodrigues,エドゥアルドゥ・フェール・ルドリゲシュ,eduarudu・fēru・rudorigeshu
jamila madeira,ジャミラ・マデイラ,jamira・madeira
josé leitão de barros,ホセ・レイタォン・ド・バーロシュ,hose・reitaォn・do・bāroshu
adolfo calisto,アドルフォ・カリスト,adorufo・karisuto
pedro leal,ペドロ・リール,pedoro・rīru
carlos sousa,カルロス・スーザ,karurosu・sūza
quim machado,キン・マシャド,kin・mashado
cândido de oliveira,カンディド・デ・オリベイラ,kandido・de・oribeira
josé relvas,ジョゼ・レルヴァス,joze・reruvasu
raul solnado,ラウル・ソルナド,rauru・sorunado
antónio da madalena,アントニオ・ダ・マダレーナ,antonio・da・madarēna
patrick mille,パトリック・ミル,patorikku・miru
josé calado,ジョゼ・カラード,joze・karādo
rodrigo leão,ロドリーゴ・レアン,rodorīgo・rean
joão garcia,ジョアン・ガルシア,joan・garushia
manuel gonçalves cerejeira,マヌエル・ゴンザルヴェス・セレジェイラ,manueru・gonzaruvuェsu・serejeira
ruben alves,ルーベン・アルヴェ,rūben・aruvuェ
igor diogo moreira araújo,イゴール・ディオゴ・モレイラ・アラウージョ,igōru・diogo・moreira・araūjo
retornados,レトルナードス,retorunādosu
rafael reis,ラファエル・レイス,rafaeru・reisu
diogo botelho pereira,ディオゴ・ボテリョ・ペレイラ,diogo・boteryo・pereira
nélson veiga,ネルソン・ヴェイガ,neruson・vuェiga
jacinto joão,ジャシント・ジョアン,jashinto・joan
jaime alves,ジャイメ・アルヴェス,jaime・aruvuェsu
octávio mateus,オクタビオ・マテウス,okutabio・mateusu
mário palma,マリオ・パルマ,mario・paruma
vasco cordeiro,バスコ・コルデイロ,basuko・korudeiro
joão pedro pais,ジョアン・ペドロ・パイス,joan・pedoro・paisu
nadir afonso,ナーディル・アフォンソ,nādiru・afonso
césar peixoto,セーザル・ペイショット,sēzaru・peishotto
josé vicente de freitas,ジョゼ・ヴィセンテ・デ・フレイタス,joze・visente・de・fureitasu
irina rodrigues,イリーナ・ロドリゲス,irīna・rodorigesu
joaquim pinheiro,ヨアキム・ピネイロ,yoakimu・pineiro
vera mantero,ヴェラ・モンテロ,vuェra・montero
carlos do carmo,カルロス・ド・カルモ,karurosu・do・karumo
débora monteiro,デボラ・モンテイロ,debora・monteiro
josué sá,ジョズエ・サ,jozue・sa
john tojeiro,ジョン・トジェイロ,jon・tojeiro
josé silva,ホセ・シルバ,hose・shiruba
fernando monteiro de castro soromenho,フェルナンド・モンテイロ・デ・カストロ・ソロメーニョ,ferunando・monteiro・de・kasutoro・soromēnyo
joão infante,ジョアン・インファンテ,joan・infante
tomás taveira,トマス・タヴェイラ,tomasu・tavuェira
carlos alhinho,カルロス・アルヒーニョ,karurosu・aruhīnyo
lucílio batista,ルシリオ・バプティスタ,rushirio・baputisuta
josé manuel martins,ホセ・マヌエル・マーティンス,hose・manueru・mātinsu
ednilson,エジニルソン,ejiniruson
daniel joão santos candeias,ダニエル・ジョアン・サントス・カンデイアス,danieru・joan・santosu・kandeiasu
adriano luz,アドリアーノ・ルズ,adoriāno・ruzu
diogo de silves,ディオゴ・デ・シルベス,diogo・de・shirubesu
domingos leite pereira,ドミンゴス・レイテ・ペレイラ,domingosu・reite・pereira
josé de sousa,ホセ・デ・ソウサ,hose・de・sousa
césar brito,セザール・ブリート,sezāru・burīto
josé reis,ホセ・レイス,hose・reisu
fernando brassard,フェルナンド・ブラッサルド,ferunando・burassarudo
cris huerta,クリス・ウェルタ,kurisu・weruta
joão mário,ジョアン・マリオ,joan・mario
afonso de bragança,アフォンソ・デ・ブラガンサ,afonso・de・buragansa
humberto fernandes,ウンベルト・フェルナンデス,unberuto・ferunandesu
elso roque,エルソ・ローク,eruso・rōku
edson rolando silva sousa,エドソン・ローランド・シルヴァ・ソウザ,edoson・rōrando・shiruva・souza
joão novais,ジョアン・ノヴァイス,joan・novaisu
joão pedro henriques neto,ジョアン・ペドロ・エンリケス・ネト,joan・pedoro・enrikesu・neto
duarte leite,ドゥアルテ・レイテ,duarute・reite
joão paulo pereira gomes,ジョアン・パウロ・ペレイラ・ゴメス,joan・pauro・pereira・gomesu
joão tiago serrão garcês,ジョアン・ティアゴ・セロン・ガルセス,joan・tiago・seron・garusesu
eduardo guedes,エドワルド・グエデス,edowarudo・guedesu
josé mamede,ジョゼ・マメーデ,joze・mamēde
josé vilhena,ホセ・シルバ,hose・shiruba
micaela reis,ミカエラ・レイス,mikaera・reisu
joão josé pereira,ジョアン・ホセ・ペレイラ,joan・hose・pereira
fernando pimenta,フェルナンド・ピメンタ,ferunando・pimenta
carlos manuel,カルロス・マヌエル,karurosu・manueru
joão botelho,ジョアン・ボテリョ,joan・boteryo
mário wilson,マリオ・ウィルソン,mario・wiruson
antónio pinto,アントニオ・ピント,antonio・pinto
kévin rodrigues,ケヴィン・ロドリゲス,kevin・rodorigesu
lucenzo,ルセンゾ,rusenzo
julião sarmento,ジュリアン・サルメント,jurian・sarumento
maria ana de bragança,マリア・アナ・デ・ブラガンサ,maria・ana・de・buragansa
adans lopez peres,アダン・ロペス・ペレス,adan・ropesu・peresu
diogo morgado,ディオゴ・モルガド,diogo・morugado
nuno ribeiro,ヌーノ・リベイロ,nūno・ribeiro
jaime pacheco,ジャイメ・パチェコ,jaime・pacheko
jorvan vieira,ジョルバン・ビエイラ,joruban・bieira
luis rego,ルイス・レゴ,ruisu・rego
filomena cautela,フィロメナ・コーテラ,firomena・kōtera
lorène bazolo,ロレーヌ・バゾロ,rorēnu・bazoro
josé mendes,ジョゼ・メンデス,joze・mendesu
pedro manuel da silva moreira,ペドロ・マヌエル・ダ・シルヴァ・モレイラ,pedoro・manueru・da・shiruva・moreira
luís manuel costa silva,ルイス・マヌエル・コスタ・シルヴァ,ruisu・manueru・kosuta・shiruva
luís norton de matos,ルイス・ノルトン・デ・モトス,ruisu・noruton・de・motosu
filipe vargas,フィリッピ・ヴァルガス,firippi・varugasu
luís filipe menezes,ルイス・フィリペ・メネゼス,ruisu・firipe・menezesu
luís jardim,ルイス・ジャルディン,ruisu・jarudin
joão franco,ジョアン・フランコ,joan・furanko
luis reis,ルイス・レイス,ruisu・reisu
josé peseiro,ジョゼ・ペセイロ,joze・peseiro
pedro espinha,ペドロ・エスピーニャ,pedoro・esupīnya
joão tomás,ジョアン・トマス,joan・tomasu
antónio carneiro,アントニオ・カルネイロ,antonio・karuneiro
otelo saraiva de carvalho,オテロ・サライヴァ・デ・カルヴァーリョ,otero・saraiva・de・karuvāryo
henrique lopes de mendonça,エンリケ・ロペス・デ・メンドンサ,enrike・ropesu・de・mendonsa
almada negreiros,アルマダ・ネグレイロス,arumada・negureirosu
teixeira de pascoaes,テイシェイラ・デ・パスコアエ,teisheira・de・pasukoae
tito schipa jr,ティート・スキーパ・ジュニア,tīto・sukīpa・junia
vítor damas,ヴィトール・ダマス,vitōru・damasu
manuel tito de morais,マヌエル・ティト・デ・モライス,manueru・tito・de・moraisu
madalena barbosa,マダレナ・バルボサ,madarena・barubosa
antónio macedo,アントニオ・マセド,antonio・masedo
isabel de herédia,イサベル・デ・エレディア,isaberu・de・eredia
josé domingues dos santos,ジョゼ・ドミンゲス・ドス・サントス,joze・domingesu・dosu・santosu
antónio fernando dos santos,アントニオ・フェルナンド・ドス・サントス,antonio・ferunando・dosu・santosu
francisco manuel homem cristo,フランシスコ・マヌエル・オメン・クリスト,furanshisuko・manueru・omen・kurisuto
tino navarro,ティノ・ナバロ,tino・nabaro
francisco de ascensão mendonça,フランシスコ・デ・アセンサン・メンドンサ,furanshisuko・de・asensan・mendonsa
maria teresa de bragança,マリア・テレザ・デ・ブラガンサ,maria・tereza・de・buragansa
joão paulo fernandes,ジョアン・パウロ・フェルナンデス,joan・pauro・ferunandesu
abel salazar,アベル・サラザール,aberu・sarazāru
josé morais,ジョゼ・モライス,joze・moraisu
josé manuel gomes,ホセ・マニュエル・ゴメス,hose・manyueru・gomesu
joão mário grilo,ジョアン・マリオ・グリロ,joan・mario・guriro
filipe cardoso,フェリペ・カルドーゾ,feripe・karudōzo
alexandre guedes,アレクサンドレ・ゲデス,arekusandore・gedesu
francisco louçã,フランシシュク・ローサ,furanshishuku・rōsa
tiago guedes,ティアゴ・ゲデス,tiago・gedesu
adriano moreira,アドリアーノ・モレイラ,adoriāno・moreira
adolfo luxúria canibal,アドルフォ・ルクスリア・カニバル,adorufo・rukusuria・kanibaru
joão carlos teixeira,ジョアン・カルロス・テイシェイラ,joan・karurosu・teisheira
altino pinto de magalhães,アルティーノ・ピント・デ・マガリャンイス,arutīno・pinto・de・magaryanisu
joão loureiro,ジョアン・ロウレイロ,joan・roureiro
ana rocha,アナ・ロチャ,ana・rocha
miguel albuquerque,ミゲル・アルブケルケ,migeru・arubukeruke
alfredo pimenta,アルフレード・ピメンタ,arufurēdo・pimenta
henrique espírito santo,エンリケ・エスピリト・サント,enrike・esupirito・santo
victória guerra,ビクトリア・グエッラ,bikutoria・guerra
marisa cruz,マリサ・クルス,marisa・kurusu
antónio josé seguro,アントニオ・ジョゼ・セグーロ,antonio・joze・segūro
marco martins,マルコ・マルティンズ,maruko・marutinzu
henrique galvão,エンリケ・ガルヴァン,enrike・garuvan
nuno da câmara pereira,ヌノ・ダ・カマラ・ペレイラ,nuno・da・kamara・pereira
gastão elias,ガシュタン・エリーアシュ,gashutan・erīashu
joão domingos pinto,ジョアン・ドミンゴス・ピント,joan・domingosu・pinto
mina andala,ミナ・アンダラ,mina・andara
ágata,アガタ,agata
zita duarte,ジタ・ドゥアルテ,jita・duarute
joão salaviza,ジョアン・サラビサ,joan・sarabisa
rui bragança,ダルイ・ブラガンサ,darui・buragansa
