valentin rusu,ヴァリ・ヴィイェリエ,vari・viyerie
vlad ivanov,ヴラド・イヴァノフ,vurado・ivanofu
miron nicolescu,ミロン・ニコレスク,miron・nikoresuku
florica bagdasar,フロリカ・バグダサル,furorika・bagudasaru
vasile șoimaru,ヴァシレ・ソイマル,vashire・soimaru
cezar florin ouatu,フロリン・チェザル・オワトゥ,furorin・chezaru・owatu
laura codruța kövesi,ローラ・コドルツァ・コヴェシ,rōra・kodorutsa・kovuェshi
viorel hrebenciuc,ヴィオレル・フレベンチュク,vioreru・furebenchuku
camelia zorlescu,カメリア・ゾレスク,kameria・zoresuku
israel zinger,イスラエル・ジネガル,isuraeru・jinegaru
lea lexis,リー・レクシス,rī・rekushisu
cella delavrancea,チェラ・デラブランチャ,chera・deraburancha
liviu dragnea,リヴィウ・ドラグネア,riviu・doragunea
virgil măgureanu,ヴァージル・マグレアヌ,vājiru・magureanu
vitalia pavlicenco,ヴィタリア・パブリセンコ,vitaria・paburisenko
francisc pécsi,フランチスク・ペクシ,furanchisuku・pekushi
ősz jános,エース・ヤーノシュ,ēsu・yānoshu
lorena bogza,ロレナ・ボグザ,rorena・boguza
vladimir cristi,ウラジミール・クリスティ,urajimīru・kurisuti
virgil madgearu,ヴァージル・マジェール,vājiru・majēru
gabriel spahiu,ガブリエル・スパイユ,gaburieru・supaiyu
cazimir ionescu,カズィミール・イオネスク,kazimīru・ionesuku
zigu ornea,ジグ・オルネア,jigu・orunea
zsolt kosz,コス・ジョルト,kosu・joruto
gelu voican voiculescu,ジェル・ヴォイカン・ヴォイコレスク,jeru・vuォikan・vuォikoresuku
lothar rădăceanu,ロタル・ラダチェアヌ,rotaru・radacheanu
maria antonescu,マリア・アントネスク,maria・antonesuku
maria rosetti,マリア・ロゼッティ,maria・rozetti
ștefan stănculescu,シュテファン・スタンクレスク,shutefan・sutankuresuku
ștefan de la bărbulești,シュテファン・デ・ラ・バルブレシュティ,shutefan・de・ra・barubureshuti
teodora albon,テオドラ・アルボン,teodora・arubon
ștefan voitec,シュテファン・ヴォイテク,shutefan・vuォiteku
marian iancu,マリアン・ヤンク,marian・yanku
carmen șerban,カルメン・シェルバン,karumen・sheruban
george ivașcu,ジョージ・イヴァスク,jōji・ivasuku
irina loghin,イリーナ・ログン,irīna・rogun
márta károlyi,カーロイ・マールタ,kāroi・māruta
georgiana drumen,ジョージアナ・ドルメン,jōjiana・dorumen
constantin mișelăricu,コンスタンティン・ミシェリク,konsutantin・misheriku
matei pavel haiducu,マテイ・パベル・ハイドゥク,matei・paberu・haiduku
corina dănilă,コリーナ・ダニラ,korīna・danira
mihai cimpoi,ミハイ・チンポイ,mihai・chinpoi
francisc șimon,フランチスク・シモン,furanchisuku・shimon
mihai balan,ミハイ・バラン,mihai・baran
francisc nemeș,フランチスク・ネメシュ,furanchisuku・nemeshu
francisc zimmermann,フランチスク・ツィンメルマン,furanchisuku・tsinmeruman
max auschnitt,マックス・アウシュニット,makkusu・aushunitto
mihai morar,ミハイ・モラール,mihai・morāru
mihai pătrașcu,ミハイ・パトラシュク,mihai・patorashuku
mihail starenki,ミハイル・スタレンキ,mihairu・sutarenki
gheorghe săsărman,ギョルゲ・ササルマン,gyoruge・sasaruman
corvin radovici,コルヴィン・ラドヴィチ,koruvin・radovichi
ada condeescu,エイダ・コンディースク,eida・kondīsuku
lora,ロラ,rora
mihai șora,ミハイ・ショラ,mihai・shora
mihail stelescu,ミハイ・ステレスク,mihai・suteresuku
mihai stoica,ミハイ・ストイカ,mihai・sutoika
francisc cociș,フランチスク・コチシュ,furanchisuku・kochishu
costin georgescu,コスティン・ジョルジュク,kosutin・jorujuku
serafina moritz,セラフィナ・モーリツ,serafina・mōritsu
vasilicaviorica dăncilă,ヴィオリカ・ダンチラ,viorika・danchira
grigore nandriș,グリゴーレ・ナンドリシュ,gurigōre・nandorishu
adrian păduraru,エイドリアン・パーダル,eidorian・pādaru
adrian titieni,アドリアン・ティティエニ,adorian・titieni
gianu bucurescu,ジャヌ・ブクレスク,janu・bukuresuku
maria cârneci,マリア・カルネッチ,maria・karunetchi
manuela hărăbor,マヌエラ・ハラバー,manuera・harabā
william amorim,ウィリアム・アモリム,wiriamu・amorimu
alexandra bădoi,アレクサンドラ・バドイ,arekusandora・badoi
alexandra ungureanu,アレクサン・ドラウングレアヌ,arekusan・doraungureanu
călin vlasie,カリン・ヴラシエ,karin・vurashie
elena ilinoiu codreanu,エレナ・イリノイウ・コドレアヌ,erena・irinoiu・kodoreanu
ionuț badea,ヨヌツ・バデア,yonutsu・badea
maria gheorghiu,マリア・グオルギュー,maria・guorugyū
dinu sânmărtean,ディヌ・スンマルテアン,dinu・sunmarutean
marin barbu,マリン・バーブ,marin・bābu
alexandru darie,アレクサンドル・ダリー,arekusandoru・darī
dale băsescu,デイル・バセスク,deiru・basesuku
valentin sinescu,ヴァレンティン・シネスク,varentin・shinesuku
mariana mihuț,マリアナ・ミフット,mariana・mifutto
marian crișan,マリアン・クリサン,marian・kurisan
gheorghe țițeica,ゲオルゲ・ティツェイカ,georuge・titseika
marius bodochi,マリウス・ボドチ,mariusu・bodochi
smiley,スマイリー,sumairī
nicușor dan,ニクショル・ダン,nikushoru・dan
alexandru repan,アレクサンドル・レパン,arekusandoru・repan
jasmine black,ジャスミン・ブラック,jasumin・burakku
mihaela gabriela delcea,デルチャ・ミハエラ・ガブリエラ,derucha・mihaera・gaburiera
mihai bobocica,ミハイ・ボボチーカ,mihai・bobochīka
ilinca goia,イリンカ・ゴヤ,irinka・goya
francisc cocoș,フランチスク・ココシュ,furanchisuku・kokoshu
marta trancurainer,マルタ・レイナー,maruta・reinā
mihai constantinescu,ミハイ・コンスタンティネスク,mihai・konsutantinesuku
ioan moța,ヤン・モタ,yan・mota
doina aldea teodorovici,ドイナ・アルデア・テオドロヴィチ,doina・arudea・teodorovichi
mihai petre,ミハイ・ペトレ,mihai・petore
mihai tudose,ミハイ・トゥドセ,mihai・tudose
guccifer,グッチファー,gutchifā
alexandru papadopol,アレクサンドル・パパドポル,arekusandoru・papadoporu
sorin vieru,ソリン・ヴィエル,sorin・vieru
alexandru tomescu,アレクサンドル・トメスコウ,arekusandoru・tomesukou
minodora,ミノドーラ,minodōra
mitzura arghezi,ミツラ・アルゲジ,mitsura・arugeji
ion monoran,イオン・モノラン,ion・monoran
ovidiu savin,オヴィディウ・サヴィン,ovidiu・savin
bogdan dumitrache,ボグダン・ドゥミトラケ,bogudan・dumitorake
erlend krauser,エルレンド・クラウザー,erurendo・kurauzā
emil lassaria,エミール・ラッサリア,emīru・rassaria
ion traian ștefănescu,イオン・トライアン・ステファネスク,ion・toraian・sutefanesuku
nae caranfil,ナー・カランフィル,nā・karanfiru
simona pop,シモナ・ポップ,shimona・poppu
amna,アムナ,amuna
tudor caranfil,チューダー・カランフィル,chūdā・karanfiru
natașa raab,ナターシャ・ラーブ,natāsha・rābu
traian bratu,トライアン・ブラトゥ,toraian・buratu
aurora cornu,オーロラ・コルニュ,ōrora・korunyu
nelu ploieșteanu,ネル・プロイエスタエヌ,neru・puroiesutaenu
isidor sârbu,イシドール・サルブ,ishidōru・sarubu
valentin cojocaru,ヴァレンティン・コジョカル,varentin・kojokaru
iulian mincu,ユリアン・ミンク,yurian・minku
valeria seciu,ヴァレリア・セシウ,vareria・seshiu
iustin marchiș,ユスティン・マルキシュ,yusutin・marukishu
eugen chebac,エウゼン・チェバック,euzen・chebakku
daniel buzdugan,ダニエル・ブズゥガン,danieru・buzuゥgan
nicolae malaxa,ニコラエ・マラクサ,nikorae・marakusa
marius stan,マリウス・スタン,mariusu・sutan
andrian candu,アンドリアン・カンドゥ,andorian・kandu
cătălin carp,カタリン・カルプ,katarin・karupu
lia olguța vasilescu,リア・オルグツァ・バシレスク,ria・orugutsa・bashiresuku
mihnea constantinescu,ミフネア・コンスタンティネスク,mifunea・konsutantinesuku
andrei rădoi,アンドレイ・ラドイ,andorei・radoi
cornelia catangă,コルネリア・カタンガ,koruneria・katanga
octavian fodor,フォドル・オクタヴィアン,fodoru・okutavian
valentin popârlan,バレンティン・ポパルラン,barentin・poparuran
ionuț ursu,ヨヌツ・ウルス,yonutsu・urusu
victor socaciu,ビクター・ソカシウ,bikutā・sokashiu
anca damian,アンカ・ダミアン,anka・damian
paul bujor,ポール・ビュジョール,pōru・byujōru
poliana cristescu,ポリアナ・クリステスク,poriana・kurisutesuku
constantin pristăvița,コンスタンティン・プリスタヴィツァ,konsutantin・purisutavitsa
tudorița chidu,ツドリタ・キドウ,tsudorita・kidou
ionuț dumitru,イオヌツ・デュミトゥル,ionutsu・dyumituru
sorin dumitrescu,ソーリン・ドミトレスク,sōrin・domitoresuku
adrian fochi,アドリアン・フォキ,adorian・foki
cătălin ilea,カタリン・イレア,katarin・irea
eugen simion,エウゼン・シミオン,euzen・shimion
bogdan stanoevici,ボグダン・スタノエヴィッチ,bogudan・sutanoevitchi
șerban pavlu,サーバン・パブルー,sāban・paburū
șerban marinescu,セルバン・マリネスク,seruban・marinesuku
radu mironovici,ラドゥ・ミロノヴィッチ,radu・mironovitchi
ionel tudorache,イオネル・トゥドゥラチェ,ioneru・tudurache
theodor munteanu,テオドール・ムンテアヌ,teodōru・munteanu
aristide teică,アリスティド・テイカ,arisutido・teika
ștefan hepites,シュテファン・ヘピテス,shutefan・hepitesu
ion țurai,イオン・ジュライ,ion・jurai
anamaria prodan,アナマリア・プロダン,anamaria・purodan
mihai ungheanu,ミハイ・ウンゲアヌ,mihai・ungeanu
richard franasovici,リチャード・フランソヴィチ,richādo・furansovichi
eduardmichael grosu,エドワード・グロス,edowādo・gurosu
george homoștean,ジョルジェ・ホモシュタン,joruje・homoshutan
remus kofler,レムス・コフレー,remusu・kofurē
gheorghe vlăduțescu,ゲオルゲ・ヴラドゥシェスク,georuge・vuradushesuku
carmen galin,カルメン・ガリン,karumen・garin
răzvan rădulescu,ラズヴァン・ラドゥレスク,razuvan・raduresuku
mirela oprișor,ミレーラ・オプリショル,mirēra・opurishoru
oana orlea,オアナ・オルレア,oana・orurea
olimpia melinte,オリンピア・メリンテ,orinpia・merinte
maria ploae,マリア・フロエ,maria・furoe
carmen iohannis,カルメン・ヨハニス,karumen・yohanisu
gabriel marinescu,ガブリエル・マリネスク,gaburieru・marinesuku
andreea iridon,アンドレエア・イリドン,andoreea・iridon
mirela zeța,ミレラ・ゼッタ,mirera・zetta
gabriela firea,ガブリエラ・フィーラ,gaburiera・fīra
irina margareta nistor,イリーナ・マルガレータ・ニストル,irīna・marugarēta・nisutoru
albert kitzl,アルバート・キツル,arubāto・kitsuru
tudorel toader,トゥドレル・トアデール,tudoreru・toadēru
dana rogoz,ダナ・ロゴズ,dana・rogozu
florentinacristina petre,フローレンティーナ・ペトル,furōrentīna・petoru
andreea ispas,アンドレエア・イスパス,andoreea・isupasu
sorin grindeanu,ソリン・グリンデアヌ,sorin・gurindeanu
anca ionescu,アンカ・イオネスク,anka・ionesuku
theodor codreanu,テオドール・コドレアヌ,teodōru・kodoreanu
tudor pamfile,トゥドル・パムフィレ,tudoru・pamufire
valeriu graur,ヴァレリュー・グラウル,vareryū・gurauru
sergiu luca,セルジウ・ルカ,serujiu・ruka
patricia maria țig,パトリチア・マリア・ツィグ,patorichia・maria・tsigu
alexander nanau,アレクサンダー・ナナウ,arekusandā・nanau
eugen dijmărescu,ユージェン・ディジュマレスコ,yūjen・dijumaresuko
nicolae mătcaș,ニコラエ・マトカシュ,nikorae・matokashu
ilie sârbu,イリエ・スルブ,irie・surubu
levente molnár,モルナール・レヴェンテ,morunāru・revuェnte
anita nagy,アニタ・ナジ,anita・naji
constantin papp,コンスタンティン・パップ,konsutantin・pappu
svetozar popović,スヴェトザル・ポポヴィッチ,suvuェtozaru・popovitchi
niță cireașă,ニツァ・チレアシャ,nitsa・chireasha
lia bugnar,リア・バニャー,ria・banyā
mihai ralea,ミハイ・ラレア,mihai・rarea
ana ularu,アナ・ウラル,ana・uraru
dorian popa,ドリアン・ポパ,dorian・popa
andreea aanei,アンドレエア・アアネイ,andoreea・aanei
florin zamfirescu,フロリン・ザムフィレスク,furorin・zamufiresuku
vasile bolea,ヴァシレ・ボレア,vashire・borea
constantin niculae,コンスタンティン・ニクラエ,konsutantin・nikurae
tudor cristian jurgiu,トゥドール・クリスチャン・ジュルギウ,tudōru・kurisuchan・jurugiu
iulian chifu,イウリアン・チフ,iurian・chifu
michael horodniceanu,マイケル・ホロドニチアヌ,maikeru・horodonichianu
giulia nahmany,ジュリア・ナハマニー,juria・nahamanī
grigore leșe,グリゴア・レシェ,gurigoa・reshe
florin ioniță,フロリン・イオニタ,furorin・ionita
camelia ceasar,カメリア・シーザー,kameria・shīzā
constantin doncea,コンスタンティン・ドンチャ,konsutantin・doncha
mihail ghelmegeanu,ミハイル・ゲルメギェアヌ,mihairu・gerumegiェanu
irina bara,イリナ・バラ,irina・bara
jean de la craiova,ジャン・デ・ラ・クライオバ,jan・de・ra・kuraioba
astrid fodor,アストリド・フォドル,asutorido・fodoru
sorin cîmpeanu,ソリン・クンペアーヌ,sorin・kunpeānu
marius antonescu,マリウス・アントネスク,mariusu・antonesuku
andrei ursache,アンドレイ・ウルサケ,andorei・urusake
viorel lucaci,ビオレル・ルカチ,bioreru・rukachi
vlad nistor,ブラッド・ニストル,buraddo・nisutoru
nick stuart,ニック・スチュアート,nikku・suchuāto
vlad dragomir,ヴラド・ドラゴミール,vurado・doragomīru
marius nichiteanu,マリウス・ニシテーネ,mariusu・nishitēne
nicușor fota,ニクショル・フォタ,nikushoru・fota
lica gheorghiu,リカ・ゲオルギウ,rika・georugiu
didier nunes,ディディ・ヌネス,didi・nunesu
eugen teodorovici,エウゼン・テオドロヴィチ,euzen・teodorovichi
ștefania mărăcineanu,シュテファニア・マラチネヌ,shutefania・marachinenu
tudorel bratu,トゥドレル・ブラトゥ,tudoreru・buratu
sabin strătilă,サビン・ストラティラ,sabin・sutoratira
matei balș,マテイ・バルシュ,matei・barushu
liviu voinea,リヴィウ・ヴォイネア,riviu・vuォinea
silviu purcărete,シルヴィウ・プルカレーテ,shiruviu・purukarēte
raul palmeș,ラウル・パルメシュ,rauru・parumeshu
olguța berbec,オルグタ・ベルベック,oruguta・berubekku
bogdan aurescu,ボグダン・アウレスク,bogudan・auresuku
magda puskas,マグダ・プシュカシュ,maguda・pushukashu
alla dolință,アラ・ドリンツァ,ara・dorintsa
corneliu furculiță,コルネリウ・フォルクリツァ,koruneriu・forukuritsa
adrian lebedinschi,アドリアン・レベディンシュ,adorian・rebedinshu
ghenadi mitriuc,ゲナディ・ミトリウク,genadi・mitoriuku
radu mudreac,ラドゥ・マドラック,radu・madorakku
ioan negrei,イオアン・ネグレイ,ioan・negurei
ioan crișan,イオアン・クリシャン,ioan・kurishan
alexandru ciorbă,サンドゥ・チョルバ,sandu・choruba
marcela topor,マルセラ・トポル,marusera・toporu
răzvan horj,ラズヴァン・ホルジ,razuvan・horuji
petru florescu,ペトル・フロレスク,petoru・furoresuku
teodor coste,テオドル・コステ,teodoru・kosute
mariana șora,マリアナ・ショラ,mariana・shora
vlad voiculescu,ヴラド・ヴォイクレスク,vurado・vuォikuresuku
anca pop,アンカ・ポップ,anka・poppu
radu vâlcan,ラドゥ・ヴァルカン,radu・varukan
benonie ștefan,ベノニエ・シュテファン,benonie・shutefan
laurențiu popescu,ラウレンツィウ・ポペスク,raurentsiu・popesuku
denisa golgotă,デニサ・ゴルゴタ,denisa・gorugota
alin ignea,アリン・イグネア,arin・igunea
gheorghe fazekaș,ジョルジ・ファゼカス,joruji・fazekasu
ionel badiu,イオネル・バディウ,ioneru・badiu
alin dudea,アリン・ドゥデア,arin・dudea
marian târșă,マリアン・トゥルシャ,marian・turusha
andrei burcă,アンドレイ・ブルカ,andorei・buruka
marius ungureanu,マリウス・ウングレアーヌ,mariusu・ungureānu
iuliana popa,イウリアナ・ポパ,iuriana・popa
marcel pigulea,マルセル・ピグレア,maruseru・pigurea
anton tauf,アントン・タウフ,anton・taufu
nicolae panța,ニコラエ・パンツァ,nikorae・pantsa
jovan marković,ヨヴァン・マルコヴィッチ,yovan・marukovitchi
diana cavallioti,ダイアナ・カヴァリオティ,daiana・kavarioti
mihai fifor,ミハイ・フィフォル,mihai・fiforu
ion cucu,ヨン・クク,yon・kuku
marian stoenac,マリアン・ストエナク,marian・sutoenaku
andreea chira,アンドレエア・キーラ,andoreea・kīra
gheorghe chira,ゲオルゲ・キーラ,georuge・kīra
radu petrescu,ラドゥ・ペトレスク,radu・petoresuku
iulian carabela,ユリアン・カラベラ,yurian・karabera
tiberiu lung,ティベリウ・ルング,tiberiu・rungu
steliancristian ion,ステリアン・イオン,suterian・ion
cristian măcelaru,クリスティアン・マチェラル,kurisutian・macheraru
andrei finți,アンドレイ・フィンツィ,andorei・fintsi
francisc dobrai,フランチスク・ドブライ,furanchisuku・doburai
aida moga,アイダ・モガ,aida・moga
feli donose,フェリ・ドノセ,feri・donose
tudor boldor,チューダー・ボルドール,chūdā・borudōru
oltin hurezeanu,オルティン・フレゼアヌ,orutin・furezeanu
dan barna,ダン・バルナ,dan・baruna
paul stănescu,ポール・スタネスク,pōru・sutanesuku
lucian ion,ルチアン・イオン,ruchian・ion
rada mihalcea,ラダ・ミハルセア,rada・miharusea
paul antoche,パウル・アントケ,pauru・antoke
aurel pădureanu,オーレル・パドゥレアヌ,ōreru・padureanu
alina berzunțeanu,アリーナ・ベルズンシェアヌ,arīna・beruzunsheanu
ilinca hărnuț,イリンカ・ハーナット,irinka・hānatto
ingrid bisu,イングリット・ビス,inguritto・bisu
eneli,エネリ,eneri
irina rimes,イリナ・リメス,irina・rimesu
petre bejan,ペトレ・ベジャン,petore・bejan
cristian balgiu,クリスティアン・バルジュ,kurisutian・baruju
neculai predica,ネキュライ・プレディカ,nekyurai・puredika
ghiță popp,ギツァ・ポップ,gitsa・poppu
ilinca băcilă,イリンカ・バチラ,irinka・bachira
alexandru pașcanu,アレックス・パシュカヌ,arekkusu・pashukanu
dana bunescu,ダナ・ブネスク,dana・bunesuku
ada solomon,アダ・ソロモン,ada・soromon
alexandru cîrneală,アレクサンドル・シルネアラ,arekusandoru・shiruneara
constantin fugașin,コンスタンティン・フガシン,konsutantin・fugashin
nathan ross margold,ネイサン・ロス・マーゴールド,neisan・rosu・māgōrudo
ionuț biceanu,ヨヌツ・ビチェアヌ,yonutsu・bicheanu
alex florea,アレックス・フローラ,arekkusu・furōra
ester peony,エスター・ピオニー,esutā・pionī
bogdan chipirliu,ボグダン・チピルリウ,bogudan・chipiruriu
marius panduru,マリウス・パンドゥル,mariusu・panduru
cornel feruță,コルネル・フェルータ,koruneru・ferūta
alexandru costache,アレクサンドル・コスタケ,arekusandoru・kosutake
luis nițu,ルイス・ニツ,ruisu・nitsu
ion chicu,イオン・チク,ion・chiku
silvia bădescu,シルビア・バデスク,shirubia・badesuku
claudiu pamfile,クラウディウ・パムフィレ,kuraudiu・pamufire
tania popa,タニア・ポパ,tania・popa
anca dumitra,アンカ・ドゥミトラ,anka・dumitora
anghel damian,アンゲル・ダミアン,angeru・damian
levent sali,レベント・サリ,rebento・sari
corneliu ulici,コーネリウ・ウリチ,kōneriu・urichi
sorin brotnei,ソリン・ブロトニー,sorin・burotonī
toma niga,トマ・ニガ,toma・niga
francisc papp,フランチスク・パップ,furanchisuku・pappu
mihai velisar,ミハイ・ヴェリサル,mihai・vuェrisaru
paula pcay,パウラ・ペーカイ,paura・pēkai
cristian terheș,クリスティアン・テルヘシュ,kurisutian・teruheshu
ramona barta,ラモーナ・バルター,ramōna・barutā
adrian zaluschi,アドリアン・ザルスキ,adorian・zarusuki
nora steriadi,ノラ・ステリアディ,nora・suteriadi
gabriel croitoru,ガブリエル・クロイトル,gaburieru・kuroitoru
marius leca,マリウス・レカ,mariusu・reka
sorin medeleni,ソリン・メデレニ,sorin・medereni
claudiu trandafir,クラウディウ・トランダフィール,kuraudiu・torandafīru
rareș lazăr,レアシュ・ラザール,reashu・razāru
sabrina ionescu,サブリナ・イオネスク,saburina・ionesuku
luminițateodora odobescu,ルミニタ・オドベスク,ruminita・odobesuku
ilie poenaru,イリエ・ポエナル,irie・poenaru
dragoș penescu,ドラゴシュ・ペネスク,doragoshu・penesuku
francisc cristea,フランシスク・クリステア,furanshisuku・kurisutea
constantin iancovescu,コンスタンティン・イアンコヴェスク,konsutantin・iankovuェsuku
andrei cordea,アンドレイ・コルデア,andorei・korudea
bogdan jica,ボグダン・ジカ,bogudan・jika
constantin radu,コンスタンティン・ラドゥ,konsutantin・radu
mihai udrea,ミハイ・ウドレア,mihai・udorea
marian adochiței,マリアン・アドチシェイ,marian・adochishei
attila deák,アティッラ・ディーク,atirra・dīku
alin fică,アリン・フィカ,arin・fika
răzvan matiș,ラズヴァン・マティシュ,razuvan・matishu
alin panc,アリン・パンチ,arin・panchi
sergiu costache,セルジュ・コスターケ,seruju・kosutāke
laurențiu ardelean,ラウレンツィウ・アルデレアン,raurentsiu・aruderean
florin birta,フロリン・ビルタ,furorin・biruta
adrian lustig,アドリアン・ラスティグ,adorian・rasutigu
emanuela ionica,エマヌエラ・イオニカ,emanuera・ionika
manuela ciucur,マヌエラ・シウクル,manuera・shiukuru
maria junghetu,マリア・ユングヘトゥ,maria・yunguhetu
theo rose,テオ・ローズ,teo・rōzu
george ulmeni,ジョージ・ウルメニ,jōji・urumeni
dorina done,ドリナ・ドーン,dorina・dōn
mihai mag,ミハイ・マグ,mihai・magu
alcina dimitrescu,オルチーナ・ドミトレスク,oruchīna・domitoresuku
filip ugran,フィリップ・ウグラン,firippu・uguran
olivia nita,オリビア・ニタ,oribia・nita
igor grosu,イゴル・グロス,igoru・gurosu
costin cambir,コスティン・キャンバー,kosutin・kyanbā
monica odagiu,モニカ・オダギウ,monika・odagiu
răzvan onea,ラズヴァン・オネア,razuvan・onea
ioana mihăilă,イワナ・ミハイラ,iwana・mihaira
mihaela nestorescu,ミハエラ・ネストレスク,mihaera・nesutoresuku
tzancă uraganu,ツァンカ・ウラガヌ,tsanka・uraganu
marcello cobzarju,マルセル・コブザリウ,maruseru・kobuzariu
olga verbitchi,オルガ・ヴェルビッチ,oruga・vuェrubitchi
aarne,アアルネ,aarune
lucian ghimiși,ルシアン・ギミシ,rushian・gimishi
petre cănciulescu,ペトレ・カンチュレスク,petore・kanchuresuku
karl heisenberg,カール・ハイゼンベルク,kāru・haizenberuku
cristian comeagă,クリスチャン・コマガ,kurisuchan・komaga
andia,アンディア,andia
patricia poienaru,パトリシア・ポイナール,patorishia・poināru
claudiu mitcu,クラウディウ・ミク,kuraudiu・miku
tudor smoleanu,チュードル・スモレヌ,chūdoru・sumorenu
nicu mihoc,ニク・ミホック,niku・mihokku
emil măndănac,エミル・マンダナック,emiru・mandanakku
adelina pestritu,アデリナ・ペストリトゥ,aderina・pesutoritu
alexandra poiana,アレクサンドラ・ポイアナ,arekusandora・poiana
cătălin preda,カタリン・プレダ,katarin・pureda
emaa,エマー,emā
mario fresh,マリオ・フレッシュ,mario・furesshu
maruca băiașu,マルカ・バイアシュ,maruka・baiashu
alecs năstoiu,アレックス・ナストイウ,arekkusu・nasutoiu
andreea grămoșteanu,アンドレア・グラモステアヌ,andorea・guramosuteanu
dragoș nicolae mădăraș,ドラゴシュ・ニコラエ・マダラシュ,doragoshu・nikorae・madarashu
ana baniciu,アナ・バニシウ,ana・banishiu
vescan,ベスカン,besukan
marian ciripan,マリアン・シリパン,marian・shiripan
ana odagiu,アナ・オダギウ,ana・odagiu
cătălin jugravu,カタリン・ジュグラブ,katarin・jugurabu
irina saulescu,イリーナ・サウレスク,irīna・sauresuku
ocna sibiului,オクナ・シビウルイ,okuna・shibiurui
vâlcea,ヴルチャケン,vuruchaken
eternul derbi,エテルヌル・デルビー,eterunuru・derubī
alba,アルバケン,arubaken
zalău,ザラウ,zarau
dâmbovița,ドゥンボヴィツァケン,dunbovitsaken
cugir,クジル,kujiru
jimbolia,ジンボリア,jinboria
